username,review
Andiuswaw,"sambalnya mantap. localguide bisa dibungkus dan bawa pulang. bermacam-macam lauk lele goreng, tahu, tempe, udang, ikan laut"
Yuda Cimeel (Chan),"enak bangett, yg ke banyuwangi jangan lupa mampir ke sini yaaa ini aku pesen yang original ya, kalo mau tambah lauk bisa banget, ada ayam, ikan dll"
Andaru Setiawan,"salah 1 nasi tempong terenak di banyuwangi porsi lumayan banyak, sambelnya enak dan lumayan pedas menu favorit lauk telur crispy"
Ade Irwan,"jangan lupa mampir di banyuwangi,makan nasi tempong.lezat dari sumatera barat 2022"
hakam rahmatullah,semula mau ke mbok wah tetapi tersasar kesini. emang mantep bener nasi tempong. makanan khas banyuwangi. ikan lautnya wenak. tempat di sekitaran kota sehingga mufah untuk ditemukan.
Putri Ersun,"ntapz banget rasanya. murah meriah. berdua habis 28 rb. 1 nasi tempong biasa, 1 nasi tempong ayam dan 2 es jeruk pembeli ada terus. ga berhenti2."
Ly,mampir disalah satu kopitiam yang vibesnya lumayan bisa buat nongkrong santai menu favorit ku roti toastnya yang juara crispy outside soft inside perfect pairing sama teh tariknya mie laksanya lumayan buat yang lagi pengen makan kalau nasi lemaknya kurang sih ya overall a nice spot to chill with friends and just relax
wiwin setiabudi,sy suka kopi hitam nya mantap cocok dengan selera saya bbener ga boong aku. suasana nya juga enak. ok pokok nya
FARID BAJURI,"kopitiam terenak sebanyuwangi. harga tiap menunga terjangkau. minumannya enak. makanannya juga enak. penyajiannya juga cepat walaupun sedang dalam keadaan ramai. rekomendasi camilan adalah roti butter, siomay dan pisang goreng"
agung falah,"pelayannya kurang ramah , sofa tempat duduk di dalam ditempati crew sehingga pelanggan enggan mau duduk disana . tempat nya asyik sebenernya , minuman nya semua oke . tapi kemarin pas pesan pisang goreng tepung nya masih belum mateng . semoga kedepan bisa lebih baik lagi"
Aprilia Diliana,cocok buat kumpul kumpul sama temen yang cuap cuap bukan temen yang mau ngobrolin kerjaan. rame banget guys dan sering full. untuk kopinya aku kurang suka dan makanannya menurutku b aja. dengan harga yang relatif lumayan mahal
steven suman,jus jeruk enak. kopi susu mantap. duduk outdoor juga enak.
Bagas Satya,"datang sekitar jam 9 pagi. awal datang, disuguhkan dengan tempat meja dan kursi di area taman yang cukup teduh dan tertata rapi. masuk ke dalam cafe untuk memesan, terlihat bersih dan meja juga tertata rapi. saya memesan roti paratha asin dan teh tarik. -roti paratha asin sangat enak disajikan dengan saus seperti karigulai. rate 4,55 -teh tarik cukup terasa tehnya, terasa creamy. disajikan dengan cup plastik. menurut saya lebih bagus lagi jika disajikan dengan gelas, lebih oke menurut saya. rate 45"
Sanjivani Bulandari Radji,"suasananya enak dibuat nongkrong sama temen, teh tarik dan es coklatnya enak bangeeeet, mie banglanya juga medok banget, kalo laksa kurang suka. overall recommended dibuat nongkrong sampe tengah malem. hehehe"
Aditya Sakti,"interior keren bertema retro menu banyak dan beragam, dari mulai kopi, teh, wedang, makanan berat, camilan semua ada rasa lumayan enak harga terjangkau tempat luas, ada outdoor dan indoor - pelayanan bisa ditingkatkan lagi. pesan nasi lemak harus menunggu 40 menit baru datang"
fiqih ardiansyah,"asik , nyaman dan selalu ramai, langganan anak muda banyuwangi"
Lensy Avita,"cocok buat nongkrong sama temen maupun sama pasangan. buat kopi susu o juga lumayan kalo pesen yang less sugar juga lumayan enak juga. oiya jangan lupa pesen french fries nya menurutku enak sih. tempatnya juga cozy, ada indoor maupun outdoor nya. buat nongkrong siang maupun malam juga cocok."
Ryan,"surya kopitiam, tempat minum kopi kekinian di banyuwangi, tempat nongkrong anak muda, ramai saat malam hari. ada ruangan indoor dan outdoor, menu kopi yang ditawarkan mengikuti menu kopitiam kopitiam di malaysia dan singapore. suasana tempatnya vintage klasik, cocok buat menghabiskan malam bersama teman atau orang yang disenangi."
Lukas Hartanto,"satu lagi cafe yang meramaikan perkulineran di banyuwangi kota. surya kopitiam. letaknya sebelah selatan sego mbok judes. cafe ini sepertinya sama dengan cafe tokokopisumberrejeki . kopinya enak. nyobain siomay juga enak. tentunya bisa sebagai tempat gibah. bisa dicoba suryakopitiam , jl mendut gg 5 no.7 banyuwangi 07.00 sd 22.00"
Irnisa Yunus,"suka banget sama tempat ini yg pertama bukanya pagi, jm 7 udah buka jd yg pingin ngopi pagi sarapan bakal cuss lgsg ksini. yg kedua, tempatnya nyaman banget. bakal jd langganan ini bisa² tiap pagi ksini meski sekedar ngopi"
Oke Sip,tempat cocok untuk kumpul kumpul nasi goreng agak asin selera masing masing roti panggang rotinya agak seret lainnya oke dan mantap
mainmakanmengantuk,"untuk kopi susu o terlalu encer menurutku. buat pecinta kopi pasti suka dengan es kosunya karena pahit dan asamnya pas. suasana tempatnya asik, di rumah tua gitu. ada indoor dan outdoor seating-nya. untuk harga masih reasonable, 1 eskosu rp12.000"
CINDY AJI,tempatnya mungil namun bagian outdoor terdapat banyak kursi dan rindang. kebetulan hanya pesan kopi saja yang harganya cukup murah namun sayang sekali pelayanannya cenderung lama mungkin dikarenakan banyaknya pengunjung di akhir pekan.
alan nobita,kopi o dan kopi susu o nya enak. teh tarik dan roti kayanya enak. tp tetap kembali ke selera ya. buka mulai pagi jam 7 pagi bisa buat sarapan dan kopi pagi. kafenya nuansa jadul. bangunan lawas namun sudah di renovasi tanpa mengubah bentuk bangunannya
Ayu Wulandari,"tempatnya comfy, anak muda banget tapi juga kids friendly. ada ruangan ber-ac, nyaman dipake ngerjain tugas. aksesnya gampang, wifi ada, toilet ada. tempatnya bersih, enak dipake nongkrong agak lama. cuma ruangan indoornya terbatas, jadi kalo hujan suka numpuk jadi satu gitu. but overall, good"
Himatus Syarifah (Sarii Himatus),"harga murah bgt, gak ada pajaknya wkwk cuma saran aja meja kursinya dibanyakin lagi soalnya disini rame terus gapernah sepi"
VICKY DANANG HARDIANSYAH,"vibenya paling cozy, siang hari di suguhkan suasana yang teduh karena rindang. kalau malam hari terpantau padat. untuk main dishes noodles full instan. waiters welcome bgt. tapi pernah beberapa kali kesalahan pada pembayaran pada bagian kasir. spot foto keren segala sudut cafe dapet banget sih."
Lin wenyou,makanan enak cuman sayang sekali pelayanan gak ramah pasang muka bete kalau sudah di perbaiki sama owner nya baru di ganti bintang 5 sukses selalu
yenny hastuti,"coba order roti kaya, teh tarik dan kentang goreng lumayan untuk makanan berat nasi.ready siang untuk nongki2 ok lah harga juga ramah"
Tsamara M,"enak banget kopinya, nyoba kopi butter ekspetasi bakal eneg tapi surprisingly dia nagih, vibesnya juga enak buat nongkrong sore"
Secret Menu,"tempat berkumpul santai di banyuwangi. sangat ramai untuk muda mudi, tidak disarankan membawa mobil karena parkir terbatas."
ghea mnl,"minuman dtg sgt lama, dluan makanannya sejam nunggu saat ditnya lagi trnyta kopi blm dbuat masih mnunggu proses harusnya terinfo di awal kalau proses untuk menu trsebut brp menit shgga bisa ganti menu lainnya. 3 yg dipsan dtg 2 trnyta masnya lupa ga catat"
Vera Pujias,"tempatnya cozy, ada area indoor dan outdoor, outdoor nya juga adem karena banyak pohon-pohon, makan dan minumannya enak-enak dengan harga yang terjangkau. staff nya juga ramah-ramah"
Dean Fathony,"ke sini biasanya buat makan menjelang siang, kopinya enak semua, nasi lemaknya juga enak, tempatnya manteb buat ngadem."
vina aja,tempat yang asik buat nongki ngopi sama temen rame2.
Pinkan Febrian Maharani,"nyobain mie bangla sama teh tariknya, cukup affordable dan rasanya juga enak dan pas. vibes indoornya kerasa bgt jadulnya, unik. kalau dtg malem tempatnya bakalan rame sama anak2 muda bwi recommend"
nabella balqis,pagi kesini dulu baru kerja wkwkw sayangnya wedang surya rasa jangan kelor. perlu ditingkatkan min wkwkw
Dwi Yustiadi,"minumannya rasanya dikurangi jadi kurang ada rasa , apa lagi d kasi es pas cair tambah kurang rasanya"
asta sasmita,suasana asik. kopi susunya enak recomended cocok buat santai dan nongkrong
Walces,"enak, suasanan dan tempatnya cukup nyaman untuk nongkrong, best"
Dio Meyers,tempat kopi yang ga pernah sepi. memang enak bener kopinya. kalau lagi ke banyuwangi jangan lupa mampir kesini.
Cak Fahmi Tibyan,tempatnya cozy
Restu Aneka Setiansyah,selalu jadi pilihan lokasi ngopi kalau ke banyuwangi
RONY ROSADY,wenak kalau siang hari
Adelita Izza,"roti srikayanya nya oke, tp untuk minum biasa aja, tempatnya okee untuk nongkrong"
Dwi Rizki Prasetio,"bagus tempat nya ramee, bnyak anak2 sma dan pegawai negeri"
Okta Pindika Dharma,"dengan konsep kedai kopi melayu, saya pesan es kopi susu o, sebenarnya saya nggak begitu suka kopi jenis ini karena manis banget, cm kalau tidak dikasi gula kurang pas rasanya kalau minum kopi susu o, tapi untuk kopi susu o, ini termasuk enak, karena pahit dari kopi yang cukup kuat dipadukan dengan susu, evaporasi dan skm yg pas, selain manis pahit, juga ada gurih yang terasa di kopi ini."
Fajar P Aji,salah satu spot ngopi chill di bwi kota. lokasinya bersebelahan dengan smj di mendut.
alvianur erfan,rasa dan pelayanan yang sangat baik
Disa Yulansi,tempatnya seru buat nongkrong. tapi pelayanan agak ngaret
Nabila Fakhrozi,"kedai makanan khas melayu, yang cocok dengan selera indonesia. suasananya cocok untuk bersantai bersama teman, sekedar ingin menyantap kudapan, atau mengerjakan tugas. kebanyakan anak muda, dan pekerja kantoran yang berkunjung. lokasi dekat dengan jalan, bisa bersantai sambil menikmati kendaraan lalu lalang. hanya saja kalau kebagian meja yang alas nya berbatu agak efort ya agar meja tidak bergoyang. overall good. staff ramah, makanan lezat, suasana nyaman."
Amelita Mega Hutari,makanan enak dan harga murah
Annisa fii,"dari segi rasa makanan ratenya 35 bukan yg enakk buanget tp msih pas, cuman klo dr segi harga sedikit pricey dengan porsinya yg g terlalu banyak. kalo dr segi tempat 45 lah cozy n enak buat nongkrong generasi kekenian hehe. minus lumayan banyak pengamen aja huhu."
Diana Hikmah,"ruameee banget kafenya. es milo, es kopi, teh tarik dan mie bangla nya enak2. cocok buat anak muda nongkrong. kalo kesini sebaiknya naik motor sj krn parkiran terbatas."
Dimas Sambada,"selalu penasaran dgn tempat ini krn tiap lwt sepulang kerja malam tmptnya selalu ramai, mayoritas usia2 sekolahkuliah. baru bisa nyoba pas sepi tu pagi hari. tenang, jajaran menu standar, harga terjangkau."
dniel,sangat recommended buat orang yg suka dengan makanan ringan tempat parkir tidak terlalu karna dipinggir jalan bisa makan di tempat dan take out pelayanan sangat cepat pelayan ramah snack dan minuman super enakk saya jadi pingin kesana lagi pilihan menu banyak begitu juga dengan minuman
R E N D,kopi susu cinamonnya enak
Eurike Louise,"stay di bwi seminggu, dan kesini 5 kali dalam seminggu. kopitiam nih bikin aku jadi ngga bisa nyobain tempat lain di bwi. terus sekarang nyesel, kenapa ngga ke kopitiam 7 kali seminggu di sby ngga ada tempat ky gini, dengan harga segini, swedih! jatuh cinta sama lechy tea nya, yg beneran teh, dan dikasi 2 buah lechy! harganya 12k aja! nangisssss di sby mana ada mau buka cabang di sby ngga? joinan yuk?"
Maliq Allataqi S.H.,"untuk kopinya kayanya house blend dan lebih berasa di robustanya, tapi overall jossss buat kopi kaya gitu dengan harga cuman 10k. dan pelayanannya cukup ramah. terimakasih."
sopa soprowi,"rame bgt yg dtg, kayaknya tambah live music tipis enak tuh"
Tgifi Oriole,tempat berkumpul yang enak dan lumayan nyaman. varian makanan harusny lebih banyak pilihan lagi. untuk varian kopi enak dan pas.
nor dwi prast,"minuman tidak lengkap, tempat lumayan sempit kalo pas lagi rame. buat yang doyan nongkrong gaul wajib kesini. tapi kalo mau chill gk rekomen"
Andrie Rosseno,"tempatnya nyaman,hrg relatif"
Bernard Yulius,"tempat kecil dan rame, kopi lumayan tp kurang varian. tempat indoor kecil, outdoor lumayan luas, kalau hujan agak repot krn pasti kehujanan"
yogi yussanto,pas banget buat ngopi sepulang gowes
Amirah TF Zaen,"comfy vintage place dan ramah dikantong pelajar, sangat recommended, tapi kalau malem selalu rame jadi ati ati ga dapet tempat"
Julias Andrianto,"bagus dan enak tempatnya, pagi2 sudah buka. sayang pilihan kopi hanya ada robusta."
Syauqi Hidayat,rame kebetulan saat data minumnya banyak yang kosong.
Dismasukma W,aku knpa ya selalu ke tiam kehabisan kopi sama matcha kata baristanya lagi kosong eh temenku pesen kok ada
febri ardianto,tempat yang bagus. kopitiam hits bwi
Muhammad Agita Ferrari,"tempat favorit untuk ngopi sore, tempat duduknya ada yang indoor dan outdoor"
Rian saifudin,"tempat ngopi yg nyaman dan suasa asri, meskipun selalu ramai di tempat ini, dan nggak tau apa yg membuat ramai di sini"
Lia Winarso,"suka kopi nya,tempatnya adem, mas mas pelayannya jga ramah2"
NHaz 14,betah banget nongki disini
Kikik Sales Toyota,kopi istimewa butter oke banget
Damar Wuling,kopi butter nya enak
Rifqi Vet,"kopinya mantap, hanya saja kadang kehabisan waktu ingin beli"
Dodod Dwi,"menu kopinya agak kurang banyak, tapi tempatnya enak kok"
Mas Jenggot,tempatnya anak muda banyuwangi berkumpul rugi klo belum pernah kesini
Jerry Cahyo Setiawan,"harga terjangkau, menu variatif, dan enak."
Ir. Alfaaa,"pertama di banyuwangi,tetep best coffee cabang dari sumber rejeki!!!"
Kacang Merah,nasi lemak kopi o nya recoment tapi nasi gorengnya langu.
Asep Hendriansyah,tempat yg cocok buat ngopi
Nurul Khasanah,"pelayanan lama, piye iki mas, diperbaiki lagi yak"
Krisdana Surya (Laperman_),salah satu kopitiam peranakan paling recomended di banyuwangi
Djoko Subagio,"desain interior yg menarik, kopinya enak"
ongis nade,lumayan rasanya lumayan harganya
maul husnah,"harga affordable, tempatnya nyaman"
Siti N,menyenangkan dpt ilmu baru
Mochamad Sabdo,"tempatnya enak, harga terjangkau"
kung Why,masuk komunitasnya brooo nyaman gaul
Zhurta Prastuta,yah begitulah tempat ngopi
Oscar Neosantara,rame elit upgrade wifi sulitttt
NXTLVL,b aja tp oke suasananya
Nanda Putra Ilmi Mustafid,tempat ngopi terdabest pokoknya
MAULANA ANNAFI'UL HAQ,tempat yang nyaman untuk berbincang dengan teman
Sigit Purwandi,kopi terbaik di tengah kota
Camelia Marita,salah satu tempat ngopi terfavorit
halosatriaaa,kopi istimewanya memang istimewaaa
maratus solehah,pelayanan kurang ramah
Wahyu H S,mantab betul
Alviatur Rosyidah,tempat ngopi anak hits banyuwangi
An Nisa,nyaman sekalee
Ishaq Tuasikal,joooosss pokok e
Eko Wijoyo,tempat nongkrong
Tan Shi Hua,"saya tidak yakin seperti apa roti panggang mentega kaya standar di indonesia, tetapi untuk semua orang malaysia dan singapura, perlu diingat, saya akan menghindari memesan roti panggang mentega kaya es teh tariknya lumayan, dan saya meminta lebih sedikit gula. secara estetika, kafe ini memiliki nuansa vintage dan bagus untuk fotografi. bahkan saat duduk di luar ruangan, suhunya cukup sejuk. secara keseluruhan, saya tidak akan bepergian ke sini untuk minum teh yang sayangnya saya lakukan, tetapi jika anda berada di daerah tersebut, mengapa tidak halo dari singapura, desember 2024"
Ehab Aboud,"tanpa berlebihan, ini adalah satu-satunya makanan terbaik yang pernah kami cicipi di seluruh indonesia sejauh ini! tempat ini luar biasa. suasananya adalah kerumunan orang-orang muda yang ceria yang akan bernyanyi bersama lagu-lagu bagus di speaker atau sekadar bermain kartu dan mengobrol dengan teman-teman mereka, semuanya pada larut malam. daerah yang tampaknya sepi dibangunkan oleh tempat ini begitu anda muncul dan anda tahu alasannya. stafnya juga sangat menyenangkan! sangat ramah dan berusaha sangat keras untuk berkomunikasi dengan saya dan istri saya dalam bahasa inggris. kami memesan mie bangla dan resep ayam dan nasi tetapi mie bangla mencuri perhatian. benar-benar hidangan luar biasa yang membuat kami terpesona teh leci juga sukses besar dan kami menyukainya! saya akan mengatakan satu hal yang identik dengan kafe dan restoran lokal di sekitar jawa deskripsi tiap item menu kurang dan foto juga tidak ada. untuk mendapatkan bintang lima dari saya, setidaknya harus ada menu dengan foto setiap item ditambah deskripsi, dengan bonus tambahan mengunggah ini ke peta google mereka juga, itu akan membuat perjalanan kita jauh lebih mudah. meski begitu, saya menyukai tempat ini jadi saya memuji tim karena pengaturannya yang bagus."
Junia Anindya,"saya suka dekorasi bergaya peranakan retro mereka, dan mereka adalah salah satu dari sedikit kedai kopi di banyuwangi yang buka di pagi hari. saya suka makanan dan minuman mereka. tempatnya selalu ramai di malam hari."
Risyad Aji,"rasanya enak dengan harga terjangkau. wajib coba kopi istimewa, rasanya manis dan gurih. kecepatan internetnya juga bagus. jadi, cocok banget kalau kamu mau cari tempat dengan suasana nyaman dan kecepatan internet yang bagus."
Michel Richard,tempat yang bagus di pulau jawa timur untuk melihat kehidupan anak muda di banyuwangi. namun sayangnya rasa kopinya tidak seperti kopitiam. 610
Bella Al Haifah,tempatnya nyaman dengan harga terjangkau. anda bisa bersantai di dalam ruangan ber-ac atau di luar ruangan untuk area merokok. parkirkan mobilmotor anda di depan kafe. teh hijaunya yang terbaik. stafnya ramah.
Ine Van Der Schueren,"nyaman! nasi dan pao ayamnya sangat populer, tapi berbagai roti panggangnya juga lezat"
Suria Nataadmadja,"kedai kopi tiam atau kedai kopi bergaya cina yang sangat bagus di banyuwangi. kami menikmati telur, roti, dan pisang goreng juga. pelayanan cepat dan memuaskan."
Angger Pangestu Ari,suka tempat bergaya retro. makanan minumannya cukup murah. merupakan tempat yang nyaman untuk berkumpul bersama teman atau bahkan pacar
Lucy Thompson,kopi yang nikmat dengan area duduk luar ruangan yang nyaman. anda juga bisa menikmati smoothie bowl di bar jus di seberangnya!
"Diana, The Globetrotting Detective",saya memesan es kopi latte seharga 12.000 rupiah. rasanya lezat dan pelayanannya baik.
Ravindra Faizal,senang bersantai
Verena L.,"kopi nikmat, tempat duduk asyik!"
farhan 241,rasa kopi sudut datar untuk kopitiam
Laury Rousseau,"tempat yang luar biasa untuk minum kopi dan juga untuk makanan jika anda menginap di sekitar sana, saya sangat menyukainya!"
Arthur R.,"tempat yang cocok untuk sarapan, makan siang, atau makan malam. makanannya lezat. jangan lewatkan tempat ini di banyuwangi!"
Kai Wolf,es kopi terbaik yang kami punya di banyuwangi. staf yang sangat ramah dan makanan super lezat dengan harga bagus. 100 merekomendasikan.
Irene Bergosa,gaya peranakan dan makanannya enakkkkkkkk
M. Kress,harga murah untuk varian ayam dan nasi yang enak - i love it!
Umardhana Arifuddin,"kopi setelah makan siang akan sempurna di sini, bawa laptop anda dan cobalah bekerja di tempat ini. rekomendasi kopi dengan mentega dan roti srikaya."
Lufti NoerDars,"tempat yang bagus dengan menu yang enak, sayangnya, telur setengah rebus akan dihilangkan dari menu."
Olim Hon,"kafe kecil yang nyaman dengan pilihan kopi yang beragam. mereka juga menyiapkan sesuatu yang saya inginkan, meskipun tidak ada di menu."
Tobias “Winchester” M,makanan dan minumannya sangat lezat dan terjangkau. enak sekali!
Whella Fatinda,kopinya enak. pelayanannya bagus. duduk santai.
Rusdi Hartono,"suasana yang baik, makanan yang enak"
Rebecca Metcalf,nasi lemaknya super enak
Nur Muhamad Utama,"ini toko temanku, joss."
Joseph Christian Saragih,jooooosss
Rizky Nuzul Kurnianda,biarkan bintangku berbicara
Aviv Putri Utami,ramah anak
Dinda Vania,tempat bersantai
Robby Firmansyah,tempat yang nyaman sekali
Aulia Mika,"makanannya enak semua, pelayanan ramah dan cepat, tempatnya luas indoor dan outdoor, tersedia playground bermain anak, dan tempatnya bersih udah berkali-kali ke tempat ini ga ada bosennya. semoga tetap konsisten dalam memberikan pelayanan konsumen"
Ela Nuraini,"awalnya sempet ragu mau nyobain wizz mie, tapi karna lihat tempatnya luas dan bagus jadi yakin buat nuobain wkwk porsi mienya lumayan banyak dan dpt 2 pangsit yng lumayan besar. bisa pesen sesuai leves kepedasan yg diinginkan. rasanya ga cuma pedes aja. asin, gurih, manisnya masih kerasa. sipp side dishnya buanyaaakk. jadi pengen nyobaik semuaaa. sushinya ada lebih dari 3 jenis dan ukurannya jg besar pilihan dimsumnya juga banyaakk banget. jadi pengen nyobain semuanya wkwk gelatonya sih definisi the best gelato in town! nyobain yang rasa strawberry bener² kerasa banget strawberrynya. suasananya nyaman dan adem tempatnya bener² luas. cuma yang bagian belakang, alangkah baiknya meja kursi jangan di depan goilet pas yaa parkirnya juga luass banget tapi bagian kanan mungkin lbh baik ditanami pohon biar ga panas² banget huhu oh ya, alangkah lbh baik kalo sistem antriannya pake barcode di masing² meja, jadi antriannya bisa di meja masing² sambil duduk. overall good job wizzme!"
Alya Salsabila,"biasanya aku cuma order wizzmie lewat gojek krn aku tipe yg mls antriagak jauh jg dr rumah, tapi kali ini pas bgt pulang kuliah penasaran pengen cobain langsung ke tempatnya. ternyata suasananya enak jugatempatnya bersih, modern, dan open kitchen gitu, bisa lihat mereka masak langsung. mienya tetep seenak biasanya. aku pesen yang level 3, pas banget buat yang suka pedes tapi gak mau tersiksa pelayanannya juga ramah dan cepet kebetulan mbakasirnya tmn sndiri, jadi aku minta tempat yg sejuk. harganya masih oke, gak beda jauh sama yang di aplikasi."
Dwi Widianto,"kasir ga jelas, banyak ngobrol sendiri sama temannya dan binggung sendiri. order makanan sampai berkali2 ngmngmya, soalnya suara music di store nya kenceng banget. order level 1 malah bolak balik di tanya balik sama kasirnya level 4 ? level 5? padahal uda bilang 1 wkekw. saking kencengnya lagu. order sendiri malah di suruhdikira sama orang lain, untuk masalah tempat duduk juga membinggungkan. kalau sudah di kasih nomer meja biasanya kan bisa pilih meja sesuai keinginan kita, ini dikasih nomer meja tapi disuruh duduk meja yg sama dengan nomernya. lah terus nomer meja portable nuat apa?? kalau emang gitu sistemnya harusnya di info di kasir bahwa nanti kakaknya duduk disini nomer ini. harusnya begitu. bukan sudah duduk malah di suruh pindah karna nomer salah. untuk makanannya oke mie nya, minumnya oke. tapi sushinya anyep, dingin banget. sarannya perlu di training lagi pegawai bagian kasir karna itu yg utama."
Caramel Love,"beberapa kali kesini, beberapa kali juga rasa mienya berubah. paling suka sama udang kejunya. harga termasuk murah ya. untuk tempat duduk dikasih nomer menyesuaikan berapa orang kita datang"
Maha Nanta,"mampir kesini pas malam minggu ternyata ramai sekali wkwkw. udah harganya yang terjangkau, enak, pelayanannya cepat, dan menunya juga variatif, ada varian mie, rice bowl, aneka sushi, dimsum, dan gelato. untuk ketersediaan tempat duduk juga banyak meskipun hanya di lantai 1 saja."
Roni Dwi Cahyo,"untuk lokasi wizzmie cukup mudah dijangkau, berada di pusat kota, parkiran luas dan banyak tempat, tapi sayangnya meja cukup sempit dan kecil, dan antriannya cukup panjang dikarenakan staff pemesanan sangat lelet tidak cekatan, entah kenapa wizzmie tidak melakukan ide barcode di meja sehingga customer bisa memesan secara instan mandiri sperti hal gerai mie sebelah yg sdh bisa pesan instan mandiri di meja, saya sangat kecewa dengan antrian yg sangat panjang dan krodit kami mengantri d bagian pemesan mie sekitar 20mnit berdiri tanpa duduk, setelah itu antri di bagian gelato 20menit berdiri kembali tanpa duduk bayangkan setengah jam lebih hanya untuk berdiri memesan menu belum lagi menunggu makanan ready sungguh kacau pelayanan staff yg sangat lelet dan tidak cekatan, entah kenapa dibagian ini banyak staff perempuan ditempatkan tidak ada satupun laki-laki dibagian depan pelayananan tak hanya itu utk pemilihan meja kursi ditentukan oleh staffnya kami bertiga dikasi meja kecil dan kursi hanya 2, sungguh sangat menyiksa meja dan kursi harus sesuai dengan papan yg kita bawa entah ini ide yg sangat diluar nalar semoga kedepan ada perubahan dan audit evaluasi yg signifikan utk pelayanannya kami sdh makan di berbagai restoran dan gerai makan di berbagai kota tetapi disini sy kira cukup banyak harus dibenahi kembali"
N Ekawati,"tempat nya bagus, luas. terutama parkiran nya luas bgt. mie nya enak, tp gak tau knp lv1 nya pedes banget. kondimen2 lain nya juga enak, minuman nya enak, gelato nya standar aja sih. pelayanan lumayan cepet"
Mikha Setiyawati,"parkir cukup luas, cuman saat beli masih antri. harusnya bisa lebih cepat dgn penambahan kasir. mie mirip gacoan, makanan lain lumayan, harga standard, es krim enak."
nabilaa 1308,tempat yg bagus bersih nyaman parkir juga luas makanan minuman enak segar banyak pilihan menu udah yg ksekian kalinya bikin nagih luv dah poko e
Maya Luvita Sari,"fomomiehitswizzmie lagi cari tempat nongkrong kece sambil nyicipin mie yang lagi fomo banget? cus ke wizzmie banyuwangi! tempat ini tuh vibes-nya retro-disko tapi makanannya super kekinian. dari luar aja udah keliatan eye-catching, apalagi dalemnyabanyak spot estetik buat foto-foto sambil nunggu pesenan dateng. menu andalannya? jelas dong, mie pedas berlevel yang bisa disesuaikan sama nyali kamu! mulai dari yang santai-santai kayak mie manja tanpa cabai, sampe yang bikin lidah goyang kaya mie disko mie goyang. rasanya nagih banget, cocok buat nemenin obrolan seru bareng bestie. gak cuma mie, di sini juga ada rice bowl, dimsum, sushi, sampai gelato buat nutup sesi makan kamu dengan manis. lengkap banget! plus, tempatnya cozy, ac dingin, ada mushala, dan self-order juga adatinggal klik-klik langsung jadi. mau makan di tempat, take away, atau order via ojol? bebas! wizzmie banyuwangi emang definisi makan enak nongkrong asik konten ready. jadi, tunggu apa lagi? yuk cobain mie yang lagi hits sejagad ini!"
Angelita Chen,"tempat nya enak untuk kumpul bersama teman, keluarga ataupun pasangan kids friendly ada tempat bermain juga untuk anak. makanan dan minuman enak dan pelayanan ramah"
