nama_tempat,username,rating,review
Kopi Studio 24,ur admirer,3,"kesana tgl 22 april jam 8 pagi, kasirnya judes banget gila, senyum aja kaga, gw tau mungkin u cape tapi u BARU DATENG ngeshift jir, masa udah cape, giliran digoda sama temen cowo u aja ketawa balik ngadep ke gw u judes lagi. padahal makanan sm minumannya enak."
Kopi Studio 24,Devit F Wibowo,5,"Suasananya seru, pelayan juga oke.. cocok buat nongkrong sambil nyantai"
Kopi Studio 24,Azimatul M,5,"Tempatnya enak banget buat nongkrong santai dan nugas, mantap."
Kopi Studio 24,Billah Maharani,3,Pelayanannya lama tolong yaa saya nunggu udah agak lama saya pesen jam 12.41 dan selesainya jam 13.15
Kopi Studio 24,dwi setiawan,5,"Pelayanan cepatt, cocok buat nugas ato nongkrong untuk harga ramah dikantong"
Kopi Studio 24,Muhammad Afdal,5,"tempat nya nyaman banget, pelayanannya bagus"
Kopi Studio 24,Simpatiku Ah,1,"Sudah setengah jam tunggu menu ayam nya
Ehh stock ayam nya ternyata kosong dan tunggu kiriman"
Kopi Studio 24,REG_14_Dikan Valentino Putra Pratama,5,"pengalaman saya selama di kopi studio blimbing yaitu untuk tempatnya nyaman, pelayanannya ramah, harga terjangkau, asik buat kumpul' bareng kawan / pacar😻😻"
Kopi Studio 24,elma Vaniatari,5,"pelayanan ramah, cepat, harga ramah dikantong, ada wifinya, pokoknya rekomend buat kesinii dehhh"
Kopi Studio 24,Agung Nugroho,5,"Overall good, harga bersahabat menunya banyak variannya. Tempat di cabang ini luas. Didalam agak panas, ayam geprek enak kopinya B aja, tapi sesuai lah dg harga . Worth it"
Kopi Studio 24,Muhammad Fatur Rahman,5,"tempatnya asik buat nongkrong dan nugas, harga sangat terjangkau lagi"
Kopi Studio 24,Sheren Olivia Koopman,5,"tempatnya cocok bgt buat nongkrong, kopi dan makanannya juga enak✨"
Kopi Studio 24,Axioo Class,5,"pelayanannya ramah bintang 5 makanannya enak"" enak pokoknyaaa"
Kopi Studio 24,Tomy Agus Setiawan,5,"Harga murah meriah, tempat makan luas dan nyaman harga bersahabat"
Kopi Studio 24,Ahmad Dafin Maulana,5,"tempatnya nyaman,pelayanan mantap,tempatnyaa juga luass, bismillah pancong"
Kopi Studio 24,Revi Diajeng1,5,"tempatnya nyaman dan luas , wifi nya lancar , makanan josjis  , sejuk juga"
Kopi Studio 24,Carisa Ryanti,5,"tempat nya udah makin luas jadi banyak spot nugas nya
wifi lancar 👍👍👍"
Kopi Studio 24,Refaliya Vinandha Shalsabila,5,"Enak tempatnya, bisa jadi tempat kerja kelompok buat banyak orang, bersih,makanan minumannya enakk"
Kopi Studio 24,Wishnu Ginanjar,5,"Tempat nya nyaman,lokasi strategis bisa memilih tempat duduk sesuai keinginan cocok untuk tempat untuk mengerjakan tugas"
Kopi Studio 24,Ajeng Zamala,1,"Kecewa banget sama nasi bakso bbq hot, menurut saya harga dan isinya gak worth it buangetttt. Udah bakso nya kuecil kecil, saos bbq nya duikit parah banget dah. Kedepannya tolong diperbaiki dong, kalo emang bakso nya dikit senggaknya saos nya kasih banyak biar kita (pelanggan) AGAK puas😊🙏"
Kopi Studio 24,Anisa Chiby,5,"Tempatnya nyaman dan worth it buat nongkrong, makanan serta minumannya murah dan enak"
Kopi Studio 24,Lousye Stevany Christina,5,Makanan dan minumannya enak tempatnya luas dan ada tempat indoor outdoor
Kopi Studio 24,airlangga Putra,5,"pelayanan oke tempat nyaman cocok buat nugas , josjis"
Kopi Studio 24,Maria Ignatia,4,"Tempat nongki di sekitar Blimbing yang selalu ramai sama anak muda. Tempat strategis dipinggir jalan raya, parkiran juga cukup luas. Harga relatif murah bgt dibanding coffe shop lain. Cuman tempat yg dibagian lesehan bean bag kurang nyaman, berantakan dan bocor 🙃"
Kopi Studio 24,Elsa Kayla,5,"pelayanannya ramah, menunya murah, tempatnya nyaman poll"
Kopi Studio 24,aertta,5,"yang jual ramah bgtt suka bet, makanan sm minumannya gacor asli🤤🤤🤤🆗🆗🆗⭐⭐⭐⭐⭐⭐"
Kopi Studio 24,Abdeee ep,5,makanan enak pelayanan ramah dan cepatt
Kopi Studio 24,Ball.,1,Pelayanan lemot sekali dan tidak ramah
Kopi Studio 24,25. Reisha dita,5,"layanan sangat baik, cocok buat nugas, tempatnya luas"
Kopi Studio 24,andini pramesty,5,tempatnya baguss🫶🏻
Kopi Studio 24,atmatyo,5,"tempat nyaman luas, pelayanan oke, harga terjangkau"
Kopi Studio 24,Cyirila Kesuma,5,"pelayanan cepat baikkk ramahhh, makanann okeee"
Kopi Studio 24,ainul Rohma,5,"Tempat rekomendasi buat nugas, nongki makan&minum nya worth it bngtt"
Kopi Studio 24,Stellina Jeslyn,3,"Tempat nugas terbaik untuk anak anak DKV Binusian 24 Malang karena KopStud buka 24 jam dan menjadi tempat kita ngerjain UTS dan UAS bareng bareng dari pagi sampe pagi lagi, semacem jadi rumah ke 2 😂😂😂"
Kopi Studio 24,Bagus Sanjaya,4,Pelayanan ramah.. Suasana enak buat nugas dan nongkrong
Kopi Studio 24,Meta Dwi Yulia,5,pengalaman yang memuaskan tempatnya nyaman dingin makanannya enak enakkk❤️❤️❤️❤️❤️🥺🥺
Kopi Studio 24,Cindya Ningayutasari,5,"Tempatnya luass enak buat nongkrong dan nugasss, buat wfc nyamann"
Kopi Studio 24,Chiesa Valentino. A,5,"Pelayanan sangat baik, harga terjangkau, tempat luas"
Kopi Studio 24,maudyajaaa,5,"layanan nya baik, tempatnya bersih dan nyaman"
Kopi Studio 24,King Works,5,Tempatnya asik untuk ngopi jam malam cocok bisa take away atau menikmati hidangan ditempat.
Kopi Studio 24,Dhani Shadana,5,"Pelayanannya ramah , ngincer satu kasirnya si wkwk"
Kopi Studio 24,wyndi,2,"tempat nya udah bagus, harga juga affordable, tp minus nya pelayanan kasir kurang memuaskan karna suaranya kecil, lemas, seperti belum makan seharian. Dan untuk minuman nya sayang sekali tidak tersedia hot drinks."
Kopi Studio 24,Alya Azzura,5,"fasilitas baik, makanan dan minuman harga terjangkau, dan tempatnya ckup homey buat ngerjain tugas brg temen atau me time"
Kopi Studio 24,Pemuda Seknun,5,Sangat-sqngat rekomen dari pelayanannya cepat higga ke makanannya enak toop markotp🫡🫡🫡
Kopi Studio 24,xifone castle56,5,"tempatny enak, pelayanannya ramah jos deh pokoknya"
Kopi Studio 24,Yanuar Purnama Arifianto,2,"Mesin es krim prosesnya bermasalah, gak siap terima orderan, matikan dulu lah menu es krimnya. Nunggu sampai setengah jam. Disuruh rating 5, dikasih minuman, tp proses menyiapkan lama. Maaf, tak tinggal td minumannya, tak kasihkan teman ojol. Klo pelayanan di order selanjutnya bagus, ya sy rubah lagi ratingnya. Sy fair orangnya. Oh iya 1 lagi, tolong ajari pegawai anda utk meningkatkan lg adabnya. Gak susah kok utk bilang maaf jika memang dr pelayanan anda krg ramah atau lama. Kata MAAF itu simple, tp bs pengaruh kemana². Bukan gila hormat, tp sebagai manusia, gak mau kan dibilang gak ada akhlaq."
Kopi Studio 24,Ananda Putri,1,"tadi pesen paket ayam geprek + minum,yg dikasi cuman ayam gepreknya,pas diingetin kalo es tehnya belum dikasi,malah ketus ,at least bilang ""maaf"" ini gak sama sekali.tukang parkirnya juga ngeselin,uda dibilang kita ga dikasi karcis n uda bayar di awal,malah nyolot n minta liat stnk, ga percaya kalo itu motor kita (fyi tukang parkir yg nerima uang kita sama yg minta liat stnk beda orang,tpi orang yg nerima uang diawal ada diseblah kita, pas tukang parkir yg lain nyolot tentang karcis,harusnya si orang yg nerima uang bisa bilang kalo kita uda bayar,ini ga malah diem aja)"
Kopi Studio 24,Shinta Ayukk,1,"Charger ilang namun minta di check cctv tidak ada hasil dan jawapan
Terlalu menyepelekan pelanggan"
Kopi Studio 24,Erfan Andri,4,"Recommended
👍🏻👍🏻👍🏻
Mantab
Yg d area dalam agak kurang rapi kurang bersih"
Kopi Studio 24,Cindy Azzalina,5,Tempatnya nyaman pegawainya ramah” cocok buat nugas 24 jam
Kopi Studio 24,Putri Candra,4,"Tempatnya cozy, free wifi juga, tempat parkirnya kurang luas, untuk biaya parkir 2 rb. Kopinya ada buy 1 get 1. Pelayanan juga ramah, bikin betah. Suasananya nyaman ada indoor dan outdoor, asik buat ngobrol atau kerja."
Kopi Studio 24,Zugzg xgjv,5,bagus cozy poll rekomen
Kopi Studio 24,Afif Maulana,5,Layanan nya sangat baik tempat nya bagus bersih dan sangat memuaskan
Kopi Studio 24,jihan agustin,2,"pelayanannya jutek, mau pesen kaya lagi ganggu idup kasirnya aja, mana mukanya sengak"
Kopi Studio 24,windi ramaa,1,"sebelum antri uda dateng posisi tepat kasir juga ga rame orderan
masa order dari jam 10.22 baru jadi jam 10.58,yang barusan sampe malah di duluin udah gitu tanya ke depan di bilang suruh buat sendiri sama karyawan ee wkwk"
Kopi Studio 24,vy nie,5,tempatnya nyaman dan makanan minumannya enak🤩
Kopi Studio 24,Nurul Rusdiana,5,"cozyy, nyaman, langganan juga disinii🥹 pokonya worth it buat nongkrong dan nugasss"
Kopi Studio 24,Naufal Aqil,5,"semuanya enak,mulai dari minuman sampai makanannya"
Kopi Studio 24,Sela Sagita,5,"tempat nya enak buat nugas, menunya banyak, pokoknya cozy buat nugas"
Kopi Studio 24,rohman hadinata,5,"Tempatnya luas bisa untuk lesehan ataupun duduk2. Makanan murah, enak dan higienis"
Kopi Studio 24,Maspino Alfino44,5,Sangat memuaskan tempatnya bagus dan sejuk hawanya
Kopi Studio 24,AQUEENA,3,Tempat luas enak.pelayanan kurang rama.kelihatannya karyawan pada kerja semua akan tetapi lemot kurang kecepatan.apa lagi rame pasti binggung semua.di koreksi lagi.biar pelayanan nyaman dan enak begitu.masalah kebersihan juga di tingkatkan dunk dulu bersih sekarang agak kotor GT.
Kopi Studio 24,Sri Mujiati,5,promo buy 1 get 1 semenjak dahulu menjadikan semakin betah kesini dan tempatnya cukup luas muat banyak orang
Kopi Studio 24,Alinaa 62 (Dinaaaaa),5,tempatnya enak banget buat nongkrong harga menu nya juga terjangkau makanan nya enak cuman kasir nya kaya kurang gercep tapi gpp soalnya kaya masih anak baru dan wifi nya juga kurang kenceng
Kopi Studio 24,Adinda Hanna,5,"karena waktu kesana pas rame banget jadi ga sempat nyobain makanan2nya karena kata kasirnya bakalan nunggu lama bngt, tapi overall pelayannya ramah2  bangett, cuma jarak tempat duduknya terlalu mepet, mungkin kalo rada jauh bisa nyaman buat nongki"
Kopi Studio 24,Desta Anas,5,"Ayam nesvilnya enak cuma kenapa   utk take away  beli saus keju,kejunya g ditaruh ditempat tp cm disiram diayam aja cuma dikit ,rasa ayamnya si 👍👍👍👍👍"
Kopi Studio 24,Dzati Faradina,4,"Tempatnyaaa nyamannnn, pelayanan ramahhh puolll🥰🥰🥰"
Kopi Studio 24,Amelia Putri Irawati,5,"bagus, tempat nya enak luas banget"
Kopi Studio 24,jofita bidatur rohma,5,"harganya afforddable, tempatnya nyaman buat nugas, wifinya lancar cashier nya ramah"
Kopi Studio 24,Hell Citizen,4,"Nyaman, minuman enak"
Kopi Studio 24,14. KHUZAIMATUZ ZUHRIYAH,5,"cepat sekali layanan nya padahal lagi rame bangett, mbak nya  ramah dan penjelasannya jelas"
Kopi Studio 24,Pagon Setiawan,5,😍😍😍tempat luas nyaman untuk nongkrong..food and beverage 👍👍👍
Kopi Studio 24,Regina permataningtyas,5,"tempatnya nyaman buat nugas, harganya terjangkau"
Kopi Studio 24,cut aleiya nasya,5,"tempatnya nyaman,luas, dan bersih lalu menu""nya harganya murah dan enak"
Kopi Studio 24,Zalfa Juniar Zahrani Putri,5,"makanan nya yumy , layanan nya mantapo , suasana nya sejuk"
Kopi Studio 24,bhagaskara,5,"pelayanan baik, fasilitas lengkap, harga makanan terbilang cukup murah"
Kopi Studio 24,Suprapto Prapto,5,enak banget tempatnya nyaman
Kopi Studio 24,Khoirunnisa L. A. S,5,"Tempatnya nyaman untuk WFC, ngerjain tugas, atau sekedar nongkrong 👍"
Kopi Studio 24,Nanda Dani,5,Yang ke malang wajib ke sini cuy
Kopi Studio 24,rivaldiii,5,"pelayanan cepat, tempatnya nyaman dan kasirnya ramah²"
Kopi Studio 24,Dita Maharani,5,"Ada dua lokasi indor dan outdor, kue pancongnya enak banget, minuman buy one get one lebih hemat daripada beli satuan, disini juga cocok buat mengerjakan tugas. Kalo mau ke toilet lebih bersih di toilet luar, kalo di dalam kurang rekomended tapi masih bersih."
Kopi Studio 24,rizqi lagiskolah,5,Enak banget buat wfh
Kopi Studio 24,ISHFA NABILA,5,"tempatnya pw, cocok buat nugas, ramah kantong hehe"
Kopi Studio 24,028_Dian Nur Laily,5,"rekomendasi tempat nugas, nongkrong yang cocok di semua generasi, harganya ramah di kantong dan tempat nya nyaman banget"
Kopi Studio 24,20. M. AZZAM A.H,5,"tempat buaguss, nyaman, enak buat nugas sama nongki"
Kopi Studio 24,Rizky Setya,5,"keren bangett si, harue banget kesini kasir nya ramah² karyawan nya gercep bet"
Kopi Studio 24,zahra melodya,3,beberapa kali pesen ayam geprek req sambal dipisah tp ga dipisah
Kopi Studio 24,Sofia Indah,5,"Makanan dan minuman murah enakkk, tempat nya bagus dan bersih"
Kopi Studio 24,Muhammad Rafli,5,"kasir ramahh pembawaan nya baik, dijelaskan dengan rinci waktu tanya. pelyanan nya keren kok"
Kopi Studio 24,Samudra Amd,5,Tempat sangat nyaman harga terjangkau  untuk mahasiswa.
Kopi Studio 24,Aydinn KP,5,Tempatnya bagus sekali cocok buat nongki
Kopi Studio 24,An Umillah Mufidah,5,"Pelayanan cepat, harga affrodable
Apalagi kalo beli online juga cepet sampe"
Kopi Studio 24,34.wijilkinasih,5,tempat bagus untuk nugas wifi lancar makanan minuman enak murah
Kopi Studio 24,Jah romdhony deril Liozi,5,"Tempatnya pw, cocok buat tugas, harga kantong pelajar"
Kopi Studio 24,Angeline Berlian Christiana Telaumbanua,5,Saya sangat puas ngopi disini karena menunya banyak dan harganya terjangkau
Kopi Studio 24,Hayudya Ratu,5,"tempatnya nyaman, enak seru, suasananya juga asik pegawainya santai seruu"
Kopi Studio 24,Febri An,5,"Tempat ngopi yang nyaman, banyak pilihan menunya, banyak promoan nya😂"
Kopi Studio 24,shankara portofolio,5,"pelayanan oke, tempat luas harga terjangkau"
Kopi Studio 24,fika rizty,5,"harga ramah di kantong, pelayanan cepat dan ramah"
Kopi Studio 24,Layla Rahmawati,5,Pelayanan baik sangat baik
Kopi Studio 24,Egi Verdi,5,"Rasanya enak, layanannya ramah, suasananya isferiguuttt"
Kopi Studio 24,Dedi Andre,5,"tempatnya nyaman, senyaman duduk di pundak doi"
Kopi Studio 24,farah faustine,5,"Tempat luas dan nyaman, harga murah dan rasanua pun cocok di lidah kita."
Kopi Studio 24,Zidane mahardika,5,"tempatnya enak dan nyaman, pelayanannya cepat"
Kopi Studio 24,Saputra Aynur Rifa Lestianam,5,rekomended nongkrong kalo gabut
Kopi Studio 24,David Adrian,5,nyaman dan cepattttt recomendedd bgt buat mahasiswa
Kopi Studio 24,afdila Satria,5,cookies n cream nyaa enakkk polll ga bosen bosen ngopi disini soalnya tempatnya nyaman bangett
Kopi Studio 24,Fchri Dhrma,5,"Suasana sangatt damai,pelayanan sangat baik,kopi nya enak buat kopag"
Kopi Studio 24,Nara Fellicia,5,"harga makanan dan minumannya terjangkau, tempatnya luas dan bersih, free wifi juga"
Kopi Studio 24,Khayatun Laundry,4,"Tempat nongkrong anak muda
Asik lumayan fasilitas ada mushola kamar mandi
Bagius"
Kopi Studio 24,Aryal Riski,5,Pelayanan ramah makanan cepat saji intinya bagus lah tempat nya
Kopi Studio 24,Allen Ramadhan,1,"Pelayanan lama, makanan kurang enak, kasir tidak ramah, suasana bagus"
Kopi Studio 24,taqwa aurawp,5,"tempatnya recomend buat nugas,ngopi dan nyaman banget"
Kopi Studio 24,Niko Aryo,1,"pegawai males males kebanykaan rokokan/main hp, struk driver belum dicetak nunggu 1 lebih"
Kopi Studio 24,Halim nor Muqsid,5,"Tempat nongkrong yg nyaman....
Apalagi kalau LG buat ngumpul Ama temen-temen"
Kopi Studio 24,34. Tahta Oktafia,5,"pelayanannya ramah, cepet samainya, tempatnya juga bersih dan luas"
Kopi Studio 24,Fitri Ayu Rahmawati,5,"Tempatnya bagus dan nyaman cocok buat foto2 wkwkwk
Makanannya enak2 dan harganya terjangkau bangett, suasana tempatnya juga enak cocok buat nongkrong rame2 apalagi klo malem sih asik bgt
Pelayanannya oke bgt, kasirnya super komunikatif dan ramah"
Kopi Studio 24,Annisa Trisnawati,5,tempatnya nyaman makanan dan minumannya juga enakk
Kopi Studio 24,Radhitya narendra,5,"baik,pelayanan ramah,mantap pol,tempatnya enak"
Kopi Studio 24,Lisya Faidlotur Rohmah,1,"Review makanan = saya datang tergolong cukup pagi pukul 10 pagi, namun buy 1 get 1 nya dibilang kosong. Kasirnya jutek bgt, gada senyum"" nya, nanya harga ga dijawab jawab, entah ga kedengaran atau gimana. Tolong diperbaiki, membuat tdk nyaman saja.

Yang paling parah pada saat saya pulang, saya hanya punya uang 100 ribu untuk membayar parkir, namun tukang parkir nya malah nyuruh saya untuk tukar di toko madura, harusnya yang cari kembalian tukang parkir bukan? Setelah saya cari, saya ngeluarin sepeda pun tidak dibantu dan saya malah yang samperin untuk kasih uangnya (dalam keadaan hujan deras)

Memang harganya terjangkau, tapi kalau pelayanannya tdk ada etika yang bagus dgn orang ya gmna ya xixixi ☺️"
Kopi Studio 24,Nadzifa Rachman,5,Suasana nyaman hanya saja Masih ada sampah berserakan
Kopi Studio 24,ula faulina,5,"Tempat nya enak, banyak menu nya, banyak spotnya"
Kopi Studio 24,zeidan aflah,5,pelayanan sangat baik makanan enak
Kopi Studio 24,Faraz Putra,5,"Tempat nya nyaman, harganya cocok buat pelajar, rekomendasi banget"
Kopi Studio 24,Mochamad Fainel Filosof,5,"Tempatnya nyaman buat nugas, apalagi harganya yang murah banget untuk mahasiswa yang hobinya nugas 24 jam"
Kopi Studio 24,jawarotul hikma,5,"Tempatnya bagus, nyaman, dan bersih sekali. Suasananya sejuk sehingga d gemari anak muda, harganya tidak menguras kantong alias murah banget"
Kopi Studio 24,Dwi Shinta,5,Kafe ini sangat nyaman dan memiliki suasana yang santai. Kopi dan makanan yang disajikan juga sangat lezat!
Kopi Studio 24,yenny rw,4,"makanan dan minuman murah dan enak, tp kebersihan mohon ditingkatkan yaaa"
Kopi Studio 24,Anisa Auww,5,makanannya enak bgt!! porsi pas
Kopi Studio 24,Frans Andika,1,"Sangat special
Buy 1 get 1 sundae ""tulisannya 12Oz"" Isi gak nyampe setengah 🤣🤣
Tersegel tuh..!!!"
Kopi Studio 24,Mozalira sevina az-zahara,5,HAPPYYY BGTTT SOALNYA TEMPATNYA LUASSSS DAN CEPAT PELAYANAN NYAA LOVVEEEE💗💗💗💗
Kopi Studio 24,Hilmi Rizky Afifuddin,1,Pelayanan lama buat ojol.Ojol datang duluan malah yg didulukan malah pembeli lain.
Kopi Studio 24,Wow Opsional,5,"ada temen saya namanya andy baik banget dia ramah kok dia, kerjanya juga cepat"
Kopi Studio 24,Cloin 77,5,"kalo malem udara nya sejuk dingin, enak buat nyantai"
Kopi Studio 24,07_Devoe Rayhan Prasetyo,1,"sandal hilang, mau cek cctv gabisa diakses alasan dipegangg atasan"
Kopi Studio 24,erlisa cantika herawati,2,"tempat nya kurang bersih, minuman kopi manis tidak bisa request less sugar"
Kopi Studio 24,Fendy Setyawan,1,"Pelayanan lama , sangat merugikan ,terutama buat ojol , mohon di perbaiki"
Kopi Studio 24,Mutiara Margareta,5,"pelayannya bagus, makannya enak murah bgt 😋😋😋😋😋🤤🤤🤤"
Kopi Studio 24,Wildan Nafiq,1,apaaan bgt mas mas pake baju putih gndt  orang tanya jadi kapan malah di suruh buat sendiri lek seng tuku oleh melbu ga kesuen mas hahaha timbang ngenteni setengah jam
Kopi Studio 24,Apip Potret,1,"kena service charge di nota
tp makanan / minuman ambil sendiri

pesen banyak yg kosong 1 menu
knp yg lain gak di bikin kan dulu
malah di diem in tu nota smpai setengah jam
PAYAH ......"
Kopi Studio 24,Abdus Salim,5,"kasirnya ramah tamah,tempat bersih,makanan dan minuman nice murah"
Kopi Studio 24,Rafi Aji Priyama,1,"Ini cireng terbaik seantero nusantara, menggunakan bahan-bahan premium yang diambil dari pegunungan himalaya dan sungai amazon, diolah sepenuh hati menggunakan mesin-mesin canggih dengan bantuan AI sehingga menghabiskan waktu cukup singkat yakni HANYA 1 JAM untuk sebuah cireng yang istimewa ini. Mantap mantap kopstud jaya jaya jaya"
Kopi Studio 24,Vasya Della,5,"Pelayanan ramah, cepat, makanan dan minuman masih fresh👍👍"
Kopi Studio 24,Denis Putri,5,Tempatnya nyaman bangett buat nugas
Kopi Studio 24,Zeke Barnes,5,"Tempatnya nyaman dan ramah ramah, lalu top"
Kopi Studio 24,Keisya Ananda C.,5,"Tempatnya baguss, minumannya murah dan ada promo buy one get one, tempat nongkrong yang nyaman nih. Apalagi ada free Wifi-nya"
Kopi Studio 24,Rifqi Rohadatul'aisy,1,"Tempat paling nyaman dan murah buat nugas. Promo beli 1 dapat 1 nya menarik banget. Kalo kesini jangan lupa beli ayam sambal matah nya, enak banget seger. Sama minum rekomen es coklat sama avocado."
Kopi Studio 24,Revanda Bagas,5,"Pelayanan ramah, makanan dan minuman rasa lebih dari enak"
Kopi Studio 24,Fufa Ayy,5,"tempatnya nyaman, fasilitas nya baik dan cukup lengkap, harga nya juga terjangkau untuk semua kalangan"
Kopi Studio 24,Rehan Alfarizi,5,"Pelayannya ramahhh , cepattt sekaliii mantappp poll"
Kopi Studio 24,Anya Laquisha,5,"tempatnya luas, enak buat kerja kelompok."
Kopi Studio 24,Anggik !,4,"Pelayanan cepat, harga murah banget, kopi d cream enak favorit, tapi sayang tempatnya skr kurang proper. Banyak kyk yg gak kerawat"
Kopi Studio 24,Nafisa Raihanum,5,Tempat cafe yang nyaman untuk mengerjakan tugas dan juga ngumpul bareng temen temen
Kopi Studio 24,Diah Ayu Rahmawati,4,"Tempat Luas, makanan enak, cocok buat nugas"
Kopi Studio 24,Ryou Hikari,5,"Place is comfortable, service is wonderful...Hanya saja perlu ditingkatkan dalam kelengkapan order. Harga boleh ditingkatkan dan porsi dibanyakan.. Serta kecepatan dalam pelayanan. Overall semua yang lain aman."
Kopi Studio 24,Fauzi Putra,5,"Untuk yang suka ngopi atau ngemil,sangat recomended di kopi studio 24 blimbing yaaa guys,untuk pelayanannya sangat ramah dan sabar menghadapi costumer,the best pokoknya !"
Kopi Studio 24,Mila Ani,5,"Harga hemat sesuai kantong 😁😁, , pelayanan Ramah cepat , , tempat bersih bisa buat bersantai"
Kopi Studio 24,panjalu gurat candika,5,Tempat dikopstud ini nyaman dan cocok banget buat kumpul bareng
Kopi Studio 24,KHOLISA SOFA MAWADDAH,5,"wifinya lancar, tempatnya luass topp bgtt"
Kopi Studio 24,Amar Tsaqif,5,"asik dapat minuman gratis, ada menu buy 1 get 1 drink yang bisa kalian coba, hemat bangett, cocok buat anak kos, tempatnya cocok buat kerja"
Kopi Studio 24,Raffael Putra Masshaby,5,Beberapa tempat perlu diperhatikan seperti kamar mandi yang kurang nyaman
Kopi Studio 24,Fathur Rohim Rozi,5,Kopstud blimbing kopi terbaik recommended ada menu geprek nya juga pokoknya bestt
Kopi Studio 24,Taura Az-zahra Kanahaya Iriyanto,5,"pelayanan enak mudah terpercaya, baik bintang 100/10"
Kopi Studio 24,Fitri Faizah,5,Pelayanannya ramah dan penyajiannya cepat
Kopi Studio 24,Rfaa Ni.,5,bagus untuk nongkrong pagi hingga malam nyaman luas
Kopi Studio 24,Umar Kholiq jadid,5,"kamar mandi perlu ditambahkan pewangi, sisanya sudah sangat baik"
Kopi Studio 24,Ulfa Dwi lestari,5,"Enakk, tempat nya luas, pancong nya enk sama matcha nya the besttt"
Kopi Studio 24,Muhamad Nazar,5,tempatnya luas nyaman pelayanannya cepat
Kopi Studio 24,Suci Indah Pratiwi,5,"Tempatnya nyaman pelayanannya juga ramah, kasirnya cantik dan baik"
Kopi Studio 24,Grandyzz Kapul,1,"area outdooorr bau sampahhhh!!!!!!!!!!!!!!!,mbk2nya rodok gak mudeng pesen 2 d ksh 1,ovocheese kosong baru bilang stelah nunggu bbrpa mnt,ahhh payah kopi studiooooo d cbang iniiii👎👎👎👎👎👎"
Kopi Studio 24,Yuliana R,5,"Variannya banyak, terjangkau, dan enak. Tempatnya luas juga, nyaman untuk WFC🙌🏻"
Kopi Studio 24,Zaqi Auliya' Alhabsy,1,"Selain tempatnya panas pol, minta less ice bukannya dikurangi es nya malah dikurangin porsinya. Gada gila”nya ni tempat"
Kopi Studio 24,Azmi Baik,5,"Tempat nya nyaman sejuk,kasir ramah,wifinya lancar"
Kopi Studio 24,Keyshafana Ayodya,5,pelayanan kakak nya ramah banget ☝🏻🩷
Kopi Studio 24,shrl gnwn,5,"joss makanna dan minuman enak,kasirnya ramah ramah murah senyum"
Kopi Studio 24,Rizkya Salsabila,5,"Tempatnya nyaman, cocok banget buat nugas. Harga makanan dan minumannya juga terjangkau"
Kopi Studio 24,Muhammad Iqbal Ramadhan (Iqbal),5,Tempatnya nyaman cocok buat ngopi sambil kerjain tugas
Kopi Studio 24,Zhiya Athir,5,"Harga boleh di tingkat kan tapi porsinya juga di tambahkan jadi seimbang, untuk layanan nya sudah cukup baik dan saya suka suasananya, overall mantap"
Kopi Studio 24,Moza,5,"Tempatnya luas, banyak stop kontak tersedia."
Kopi Studio 24,Robby Wahyu,1,"Pegawai lama 35 menit baru jadi
Sering salah pesanan"
Kopi Studio 24,Shima Ainur Rofi,5,"Mood banget makanan sama tempatnya, mungkin kamar mandinya aja agak kotor, tapi luuv buat nongkrong"
Kopi Studio 24,Dedy Bayu Setiawan,5,"Tempatnya bagus, enak buat nugas"
Kopi Studio 24,Dewa Saputra,5,tempatnya nyaman karyawan yang humbbel makan dan minuman yang worth it
Kopi Studio 24,milky way,4,"kalo bingung mau kmn pasti kesini akhirnya. tempatnya bagus nyamann bgt,cuma ya itu ya menu nya kopstud tu ituu aja tp gpp tetep like😬"
Kopi Studio 24,Bintang Adi,5,"No komen, overall makanannya udh enak, pelayanan nya ramah dan gk pake lama mantap pokok e Jos Gandos😃👍"
Kopi Studio 24,Fiky Maulana Rohman,5,Tempat nongkrong terbaik di malang raya karena selain rasanya enak tempatnya luas dan bagus harga juga berani bersaing dengan kopian lainnya
Kopi Studio 24,Kurniawan Abidzar,5,Harganya sangat terjangkau dan enak juga makanannya
Kopi Studio 24,Siska Wulandari,5,"Tempatnya luas dan nyaman , Makanannya juga enak"
Kopi Studio 24,Elida Agustinah,4,"Tempat, minuman dan makanan standart. Cocok kalo untuk tempat ngobrol, diskusi atau ngerjain tugas.."
Kopi Studio 24,Naila Rizqiyah,1,Pesen lebih dari 1 jam belum jadi²
Kopi Studio 24,anindya irsyandi nurdiansa,5,baguussss enak tempatnya buat nugass kampusss
Kopi Studio 24,Elly R,5,"Tempat nyaman buat nongkrong santai, meskipun selalu ramai sih. Kue pancong kejunya enak, kejunya buanyak. Coffee lattenya enak jg"
Kopi Studio 24,Erhander Khan,1,"Tempatb OK, minus pelayanan!! ice cream sampai leleh kek aer 🤬 sudah ready hanya di letakkan di meja hanoir 15 menit, saya tanyakan baru sadar kalo pesanannya sudah ready, BECANDA?"
Kopi Studio 24,Bagus Setiyawan,1,"pelayanan sangat baik dan ramah dan bersih, wifi juga lancar"
Kopi Studio 24,Krisna Saktya A.,5,"tempatnya enak, luas, free wifi"
Kopi Studio 24,HRD SSA,5,"good banget, tempatnya nyaman"
Kopi Studio 24,putri ayla,5,"cozy buat nugas, makanannya okee"
Kopi Studio 24,Firman Andriansyah,1,Pegawai kebanyakan tertawa tidak proporsional attitude minus
Kopi Studio 24,ELOK Fauziah,5,Pelayanan yang sangat ramah dan cepat
