nama_tempat,username,rating,review
Kopi Studio 24,emang boleh,5,"oiyaaa tolong dongg pancong” nya itu lain kali kalo packing ga usah pake kerak gosong” nya, yang harusnya enak malah jadi keliatan ga higienis😢

overall kopsus dcream with less ice masih jadi favoritku 🤩"
Kopi Studio 24,Fathonah Onah,5,"Tempatnya sangat luas, stop kontak ada di setiap sudut jadi lebih leluasa buat nugas, harganya juga kantong mahasiswa banget"
Kopi Studio 24,Syamsie Noor,5,"Tempat e luas. Banyak pilihan kursi atau tempat duduk.
Ada yg indoor dan outdoor, juga lesehan.

Makanan nya pancong mantab.
Minuman nya enak semua. Dan harga nya murah meriah. Jadi betah sering-sering kesini.

Fasilitas lengkap. Musholla, toilet, wifi, dan colokan listrik.

Pelayanan ramah dan cepat."
Kopi Studio 24,Syamsie UNGU,5,"Nice place for coffee and working your assignment

Harga minuman nya murah banget. Bisa pesen paket biar lebih murah meriah.

Tempat nya luas, banyak pilihan tempat duduk.
Free wifi, toilet Dan colokan listrik."
Kopi Studio 24,Sham Arifin,5,"Untuk yg berbudget ngepress, tapi butuh tempat nyaman untuk mengerjakan tugas, work from cafe, meeting terbatas dadakan, ngobrol, ngerumpi atau bahkan untuk rebahan dan tidur sejenak, Kopstud24 di LA sucipto sangat aku rekomendasikan.

Harga sangat friendly selayaknya kopstud pada umumnya, tapi di LA Sucipto ini ada hall luas berkarpet yg bisa untuk selonjoran sambil rebahan. Ada area outdoor yg lumayan instagramable dan nyaman untuk curhat, ada ruang meeting terbatas dg meja panjang juga, dn tentu saja, semua meja sangat nyaman untuk work from cafe atau ngerjain tugas di sana. Sambil begadang seru juga.. sayangnya.. tidak ada menu kopi panas di sini. Jadi untuk begadang di malam yg dingin sih.. kurang rekomended ya."
Kopi Studio 24,Chaila Putri,1,"Tempat yang jadi langganan buat nongkrong maupun take away.
Jujurly buat rasa kopi dan makanan sangat enak.
Tapi untuk pelayanan bener benr burukk dan gasopan,tdk ada repeat order sehingga pesananya kurang ,minim interaksi dan sangat ketus baik ekspresi ataupun nada bicara.
Suasa tempat kurang di perhatikan terutama bagian wc sangat jorok pdhl itu adalah cerminan dr suatu tempat,berbagai area juga sangat kotor padahal pegawainya banyak tapi sibuk bergurau dan kurang memperhatikan tempat sekitar.
Pesan untuk di bawa pulang juga kurang di perhatikan ketika nge siler cupnya sehingga sampe rumah baru sadar kalo di jalan sudah tumpah dan bocor!!!"
Kopi Studio 24,uthed chandra,5,"Harga murah meriah, tempat makan luas, fasilitas lengkap ada mushola, toilet, wifi, colokan. Pelayanan ramah."
Kopi Studio 24,Enda Nada,1,"Saya tanggal 24 kemarin beli online  bundling ini, waktu itu pesan 3 menu dan dateng itu ga nyampe 20 menit tapi kenapa ini isinya kurang/ ngga full ya? Masa pesen yang bundling dikasi yang kaya gini, tolong diperbaiki lagi ya kak lain kali biar lebih berkembang lagi."
Kopi Studio 24,Mumu Otsutsuki,5,"enakkk buat nongkrong, matcha nya juga enak, aku mau seratusss"
Kopi Studio 24,Anggi Arta,5,sangat enak dan nyaman serta cocok untuk kantong pelajar good
Kopi Studio 24,uthed chandra,5,"Harga murah meriah
Free wifi
tempat makan luas, ada area sitting & lesehan
fasilitas lengkap ada mushola, toilet, wifi, colokan
Pelayanan ramah
Buka 24 jam"
Kopi Studio 24,Yeyen Ariska,1,"Sudah menunggu 1 jm tetapi tidak kunjung selesai, bilangnya cuma 10mnt selesai, wah tau nya berjam jam, minum sampai cair dan gk dingin. Lama bangett pelayanan nya"
Kopi Studio 24,Wkwkwk Wkwk,5,"Harganya sangat murah, tersedia promo buy one get one di cafe ini. Makanannya standard (biasa saja) untuk minuman lumayan enak, banyak macamnya, dari kopi, milk tea, matcha, sampai Ice cream boba. Sayangnya, banyak menu yang kosong jika sudah agak malam atau di pagi hari.

Untuk tempatnya sendiri sangat luas, terdapat indoor dan outdoor. Di indoor sendiri, tersedia bean bag dan meja lesehan (biasanya para pengunujung banyak yang memilih tempat ini, sehingga sering penuh) disediakan kipas angin juga, sehingga anda tidak perlu khawatir akan kepanasan. Kafe ini 24 jam dan didominasi oleh anak kuliahan karena tempat ini sangat nyaman untuk mengerjakan tugas ataupun hanya sekedar nongkrong saja. Biasanya akan ramai di sekitar pukul 19.00-01.00 dini hari. Wi-Fi lumayan stabil, lancar untuk main Dota dan games berat lainnya.

Untuk pembayaran hanya melayani via Qris.

*Toilet dan hospitality dari karyawan mohon lebih diperhatikan."
Kopi Studio 24,Muhammad Rifqi Rizqullah,1,"Tukang parkirnya ga bertanggungjawab sama sekali. Bayar parkir 5rb dan mereka ga ada kembalian 3rb trs disuruh ambil kembalian pas pulangnya. Giliran udah pulang trs mau ambil kembalian ternyata udah beda orang dan dia bilang klo dia baru dateng jadi ga ada uang buat ngasih kembalian. Saya malah disuruh balik kesana besoknya untuk ambil kembalian. Oke saya percaya klo gaada uang alhasil saya berniat tungguin sampai ada pelanggan dateng dan bayar parkir, 15 mnt kemudian saya lihat ada pelanggan baru dateng bayar parkir dan tukang parkirnya ngeluarin uang 2rb an banyak buat ngasih kembalian ke pelanggan tersebut padahal bilangnya gaada uang. Setelah liat itu, saya tagih lagi dong kembalian 3rb saya, eh kok tukang parkirnya malah bilang ""masio onok pun ga kiro tak kek i samean mas soale maeng guduk aku sg jogo (kalo ada pun mas nya ga akan tak kasih kembalian soalnya tadi bukan bagian saya)"". Saya yang bayar kok malah saya yang disuruh nyari-nyari kembalian. Tolong dievaluasi tukang parkirnya (ciri"" : pendek, bertopi, pake hoodie), saya sebagai konsumen merasa dirugikan walaupun cuma 3rb. Kejadian ini saya alami di hari selasa tanggal 24 September 2025 jam 23.00."
Kopi Studio 24,Gold De Edyson,5,Asik nih buat nongkrong.. Price nya murah juga..
Kopi Studio 24,Amanda Halimatuz,5,"Makanan dan minumannya murah bgt. Wifi-nya oke-lah buat nugas. Ramah bgt buat kantong mahasiswa. Suasananya oke meskipun ujan, ga berisik. Buat makanannya, aku pesen ayam geprek konslet, itu sambelnya agak kecut (emg rasanya gitu). Aku ga begitu suka kecut, jadi kurengg sih buat aku. Buat minumannya, yang green tea oke ajaa ✨"
Kopi Studio 24,Kevin Saputra,5,"Tempatnya sangat bagus, pelayanan cepat dan ramah, harganya juga terjangkau bangetttttt recended bgtttt😍"
Kopi Studio 24,Dzakiyyah Salma D,2,"Ulasan makanan dan minuman sy bahas belakangan karena BANYAK MASALAH di sini :
1. Fasilitas KURANG PERAWATAN. Banyak meja berdebu TIDAK DILAP. Toilet dan mushola kotor dan tidak ada tisu. Mungkin ""tisu dan lap meja"" bukan dijadikan perhatian ya? Padahal bisnis FnB kok tidak peduli kebersihan?
2. Jam 23 saya pesan makanan, ditolak, karena BOX HABIS. Oke berarti ini defisit supply box, semoga tertangani. Saya harap jika ada kendala pemesanan menu dipasang note ""SNACK & FOOD HABIS"" di kaca kasir. Semangat berbenah yaa 💪🏻
3. Kang parkir tidak stay 24jam. Saya pulang jam 4 pagi sambil khawatir apakah motor sy kenapa², untungnya aman. Semoga bisa ditingkatkan

Oke ini ulasan makanan dan minumannya:
1. Minuman murah puol, cocok utk mahasiswa irit. Tapi kemanisan sih setara mix** tolong diperbaiki ya kak, banyakin aja esnya. Toh production cost lebih hemat.
2. Makanan serba instan. Kulit ayam dan gepreknya ternyata mini, sesuai harga. Tapi enak kok jika sekedar utk pengganjal perut"
Kopi Studio 24,_vivi0fficial,5,"Salah satu rekomendasi tempat nugas paling sering Aku datengin 🤩
Ada colokan di setiap meja + deket kampus ✨"
Kopi Studio 24,harta karun,5,"enak, murah, tempat andalan buat nugas, mantap pokoknya"
Kopi Studio 24,Rafli wahyu permadi,5,"pelayanan cepat, ramahh, ojol nya cepat nga kyk biasanya padahal antri ojol dan yg ditempat banyak dan panjang"
Kopi Studio 24,Rifqi Rohadatul'aisy,5,"Tempat nyaman buat nugas, harga murah dan makanan sama minuman enak enak. Selain itu pelayan nya juga ramah. Tempat bersih banyak colokan juga"
Kopi Studio 24,Mlxyss,3,"Makanan nya oke sih tapi pelayanan nya kureng bgt, meja berdebu gapernah di bersihkan. Waitress nya jutek, kurang sopan ke pelanggan. Makanan minuman nya worth it sih + baru kali ini dikasi nasi kering wkwk. Kurang pelayanan sama kebersihan"
Kopi Studio 24,zahrotul laili,5,"murahhh, enaakkk, tempatnya luas,nyaman cocok buat nugas"
Kopi Studio 24,Arbaa Maulidya,5,"Semua outlet pembayaran pake qris. Tempat pemesanan di depan , jadi mempermudah pembeli, yang dulunya di belakang. Pindah ke depan."
Kopi Studio 24,yurikeprstk,3,"beberapa kali ke kopstud ini.

kelebihan (+)
+ tempatnya luas
+ makanan, minuman murah2 banget & rasanya juga oke
+ geprek & sambalnya enak dgn harga yg terjangkau bgt
+ ada musholla

kekurangan (-)
-tempatnya kurang bersih. mungkin krn sistem self service kali ya, jadi banyak meja2 kotor, terus berdebu bgt jadi hrs lap sendiri pake tissue 🥲
-musholla kecil, sebenernya gpp kecil tp masalahnya ini kecil + kotor (kalo sujud debu2 nya nempel di muka 🥲)
-kdg2 pegawainya berisik & pernah ada yg ngerokok di depan area kasir
-ada kmr mandi tp sayangnya ga terpisah antara cowok cewek
-penataan meja bbrp terlalu dekat jd kadang kurang nyaman krn sebelahan sm meja yg ada org ngerokok
-pegawai bagian kasir sering keliatan jutek 🥲
-pesen kue pancong minta mateng, tp ttp dikasihnya yg setengah mateng gtu"
Kopi Studio 24,Sandi Ardian,5,"pelayanan sangat  cepat dan ramah
tempat bersih dan nyaman
enak buat nugas dan meeting"
Kopi Studio 24,Azizatu Zahwa Belzinki Suaedi,5,"Harganya sangat-sangat friendly, tapi rasa masakan tidak mengecewakan walaupun harganyaa segitu. Kamar mandi bersih alhamdulillah. Tempat sangat sungguh luas enak banget buat WFC atau tempat ngumpul2 ramean soalnya tempatnya luas👌🏻"
Kopi Studio 24,Tifany Nadira,3,"Mohon kroscek Menu2 yg tersedia utk pelanggan. Sy langganan tp sekalinya belanja online malah orderan tdk sesuai gambar & menu tertera, pesanan bahkan merugikan krn kelalaian pihak resto dlm penyajian serta pengecekan brg order siap kirim.

Menu pesanan sy
* Buy 1get 1 free (Reg. Cookies Ice Cream with Crumb + Reg. Ice Jasmine tea)
* Paket Hemat Berdua 2 (Ice Brown Coffe + Ice Chocolate + 2 Indomie goreng toping Telor Matasapi)

Tp sy kecewa krn brg dtg tdk lah sesuai..
Pertama hanya minuman saja 4gelas sesuai order menu, namun 2pcs Indomie gorengnya gk ikutan dtg. Alhasil sy Retur via Kurir, bisa diteruskan dan diganti namun lagi2 dtg nya gk sesuai menu tertera. Dlm paketan 2minuman + 2mie goreng toping. Tp yg dtg cuma 1 mie goreng toping dg alasan ya itu 1 utk berdua.. Mana ada digambar menu tertera ada 2pcs kok ini malah gini..

Intinya kecewa bgt dan merasa dirugikan.. Mending pesan lgs kedai dan lgs jg utk komplain nya.. Klo online KASIHAN KURIRNYA DG KETELEDORAN KARYAWAN RESTO."
Kopi Studio 24,Galih Savitri,5,"panconggnya enakk bangett 🫶🏻 tempatnya nyaman, wifi lancarr poll cocok buat nugas 🫵🏻"
Kopi Studio 24,Afifah Bahruddin,4,"suasana nyaman, ada lesehan, banyak colokan"
Kopi Studio 24,Tiara Indah,1,"Masih makan lampunya malah dimatiin padahal mas nya udah liat klo kita lagi makan. Trus maksudnya kita harus makan gelap""an gini?"
Kopi Studio 24,Aldi Setyawan,1,"pelayanan lama, nunggu 30 menit makanan belum jadi"". cuma bilang proses"" padahal orderan gak terlalu banyak. banyak pegawainya yang santai"""
Kopi Studio 24,Nimas,5,"disini enak banget buat mengerjakan tugas, tempatnya nyaman, ademmmbangett"
Kopi Studio 24,Dila Jenn,4,"Tempat nongkrong yang sangat ramah di kantong. Ada banyak menu promo yang sangat terjangkau harganya, seperti buy 1 get 1. Untuk varian minuman banyak banget dan rasanya juga lumayan enak dengan harga segitu. Untuk makanan juga lumayan enak sesuai harga lah,ada harga ada rasa. Tempat nongkrong juga nyaman ada indoor dan outdoor ada juga lesehan. Buat yang gak suka bau asap rokok tidak disarankan datang kesini. Kalau mau nugas atau meeting bisa banget duduk di bagian lesehan nyaman tapi kalau siang terik agak panas tapi ya nyaman-nyaman aja tergantung selera juga. Untuk toilet juga bersih nyaman. Ada mushola juga."
Kopi Studio 24,Nanda Khoirun Nisa Ahmad,3,"Saya pertama kali kesini, agak bingung krn menunya yang ""buy one get one"" dan murah banget. Es Taro + Es Thai = 15.000, Pancong melted choco = 7.000. Untuk harga sangat membantu mahasiswa sekali! Tapi untuk rasa, jujur ini MANIS PARAH, buat org yang suka manis sampe eneg. Kue pancong nya jga MATENG gitu, jadi gak creamy dan lembut. Tempatnya berharap duduk di beanbag tapi full dan lembab, tapi masih oke krn da indoor dan outdoor room.
Dan seneng juga ada tukang parkir.

Please minumannya bikin sop untuk kemanisannya, dirasain dulu deh minimal sbelum dkkasih customer, untuk kue pancong coba buat rasain yang pancong beneran?? Hehe buat preferensi ya kakak. Thankyou."
Kopi Studio 24,Saudara Mahmud Syarif,1,"Overall enak semua, problemnya cuman di tukang parkir. Tukang parkirnya ga bertanggungjawab dan premanisme. Hati hati klo mau kesini, pengalaman pribadi parkir motor 2k saya bayar pake uang 5k dan ga dikasih kembalian. Giliran saya tagih malah marah balik."
Kopi Studio 24,Entris Sutrisna,5,"Makanan kumplit
Pegawai nya ramah""
Lahan parkir nya luas"
Kopi Studio 24,Arsisca Yulyant,4,"Rameeenya full

Kita take away, susah nyari parkir. Tapi krn ga ada parkir akhirnya sama tukang parkirnya di suruh duluin pesanan kita. makasih loh pak parkir 😀"
Kopi Studio 24,Supratman 19,2,Penyajian lama sekali hanyab2 menu butuh 45 m3ni padahal yang antri hanyabsedikit
Kopi Studio 24,Ken Haidar,3,"Kopi Studio yang paling luas menurut saya, tidak ada lantai 2 dan uniknya di cabang ini memiliki tempat lesehan. Secara rasa, seperti cabang yang lain. Menunya juga sama harganya dengan cabang yang lain, dimana harga menunya belum include pajak. Terdapat kamar mandi yang bersih dan musholla, cocok untuk nugas karena ada wifinya.

Antrean pesanan cukup panjang dan pembuatan pesanan pun lama. Terdapat biaya parkir di awal, tapi anehnya ada himbauan ""Bayar parkir di akhir"" yang baru saya notice waktu pulang. Tukang parkirnya baru gercep kalau yang punya motor cewe wkwkkw."
Kopi Studio 24,Lailatur Rohmah,5,"Tempat nya enak luas, pelayanan ramah, enak buat nongkrong sama buat nugas"
Kopi Studio 24,Muhammad Ilham,5,"Suasana Kopi Studio 24 Blimbing sangat nyaman, cocok untuk nongkrong maupun nugas. Pelayanannya ramah dan cepat, kopinya juga enak dengan harga terjangkau. Tempat yang pas buat santai bareng teman atau me time! ✨"
Kopi Studio 24,Ahmad Bachtiar Arif,4,"Kafe yang hampir selalu ramai pengunjung karena buka 24 jam. Menu makanan dan minuman di sini variatif dan harganya lebih murah jika dibandingkan cafe pada umumnya. Di sini disediakan area lesehan yang nyaman untuk digunakan sebagai tempat nugas. Wifinya cepet dan banyak colokannya, sehingga support untuk digunakan sebagai working space. Tempat parkirnya cukup luas, namun tidak ada parkir mobilnya. Kafe di sini menggunakan self service, namun banyak pengunjung yang belum sadar, sehingga meninggalkan sampah di mejanya."
Kopi Studio 24,Salsabila Tiara,5,"rekomendasi tempat nongkiii nichhh di daerah blimbing malanggg, good ambience, dan sangat worth it!! 🫰🏻🫰🏻🤗🤗 overall 9/10"
Kopi Studio 24,Avril Akhwat,4,"Beberapa kali kesini, dari segi harga makanan & minuman sangat ramah di kantong. Hanya saja meskipun menerapkan konsep self service seharusnya lebih diperhatikan lagi kebersihan meja dan kursinya. Tiap kali kesini meja masih penuh dgn debu, jd bikin pakaian kotor. Apalagi tidak disediakan tisu, jd klo ada bekas tumpahan minuman bingung bersihinnya."
Kopi Studio 24,Welly lahh,5,"tempatt luas nyamann, cocok banget buat nongki bareng teman"""
Kopi Studio 24,Nabila Azzahra,5,"Makanan dan minuman sangat enak, dan sangat ramah di kantong mahasiswa. The best banget buat nongki bareng teman"
Kopi Studio 24,rifqi kamal,1,"Disana parkirnya kayak preman, narik ke pengunjung dengan tidak sopan & tidak disebrangkan, eman tempatnya bagus"
Kopi Studio 24,Fiko Setya Indratama,5,Suasananya Bagus asri tempatnya cozy buat nugas
Kopi Studio 24,Putri karlia Isnaini,4,"tempatnya luas, pelayanannya cepat cuman minusnya sampah² bekas pengunjung ga di bersihin maaf ya kak 🙏😇 …"
Kopi Studio 24,Mashle Season,5,"Kopi Studio 24 Blimbing punya suasana yang nyaman dan cozy banget. Tempatnya bersih, pelayanannya ramah, dan kopinya enak dengan harga yang terjangkau. Cocok buat nongkrong, nugas, atau santai bareng teman."
Kopi Studio 24,Saifullah Yusuf,1,"Kasir jutek parah, ke situ tgl 25 september 2025, minta asbak katanya udah habis di pake semua padahal masih pagi jam 8:40 an dan kondisi sepi, tolong di perbaiki lagi bagian kasirnya ( kasir perempuan berhijab )"
Kopi Studio 24,Nindy Dwhytt,5,"rekomendasi tempat yang nyaman buat nugas karna selain tempat duduk kursi biasa, ada juga lesehannya😍 dan untuk menunya sangat affordable, apalagi menu minuman yang buy one get one sangat menarik customer"
Kopi Studio 24,22. Nadzwa Alya Zahra,5,"pelayanannya ramahh bgt kakaknya, menunya enak enak apalgi klo masalah harga sangat kantong pelajar dan yang terpenting adalahhh enak buat nugass"
Kopi Studio 24,Salsabillah aw,5,"Cocok buat rapat maupun nugas. Apalagi skripsian soalnya wifinya juga lumayan. Dan 24 jam adalah yang paling penting. Makanannya wort it bgt dan enak², minumannya juga. Ada mushola dan kamar mandi. Musholanya cukup luas dan ada mukenah juga. Ada outdoor indoor dan lesehan wkwk. Colokan pasti ada sih wkwk. Parkirnya juga luas. Sangat di rekomendasikan untuk mahasiswa yg bosen nugas dikosan."
Kopi Studio 24,Lusi Agustina,5,"pelajar friendly😍 lebih luas aja gitu sama ada space yang comfy gini, dulu ada musiknya sekarang engga. 24 jam juga pokoknya worth to come lah apalagi buat nongkrong! masukan aja tambahin uno dll"
Kopi Studio 24,Imza Kiyahh,5,Sangat memuaskan dan semua menu di sini sesuai
Kopi Studio 24,Yunita Indriani,5,"parkiran nya luas bangettt, avocado Choco favorit pancong terbaik geprek mantap suasanya enak puollll, pelayanannya baikk bintang nyaa sepuluuuuuuhhhhhhhhhhhhhhhh"
Kopi Studio 24,Sitinur Lailah,5,"pelayanan nya baik ramah, nyaman banget buat nongkrong, makanan nya juga enak murah, anzayyy"
Kopi Studio 24,nadita prisanta,2,"dari awal gada omongan kalo kartu parkirnya ilang bayar 5ribu, dateng langsung di kasih kartu yang di pasang di spion sama yang di bawa. udah bilang hilang gatau dimana, posisi rame juga malah disuruh nyari terus baru bilang bayar 5ribu kalo ga ketemu. kayak pungli jatohnya

kecuali kalo bikin karcis terus ada pemberitahuannya masih terima, jadi habis 7ribu. buat mahasiswa kerasa banget mohon maaf😁"
Kopi Studio 24,Regina Agustia,1,"Pesen nya apa yang di kirim apa
Bilang mau di ganti tapi sampai sekarang gak di respond lagi"
Kopi Studio 24,Latep Latep,5,jadi tempatnya strategis dari malang kota dan kopiannya enak cocok buat anak remaja maupun anak sekolah dan murah meriah tempatnya luas dan enak
Kopi Studio 24,Wasis Hartanto,5,Tempat nya bagus luar biasa enak dan bisa di buat santai enak sekali
Kopi Studio 24,farikhatul ilmi,3,"tukang parkirnya tolong diberi tahu, kita bayar parkir di awal oke aja tp pas mau cabut malah pada ga nongol sama sekali, mau puter mobil susah krn ga ada yg bantu nyetop in kendaraan lain.. trus juga mereka ga punya tongkat parkir yg LED itu jadi kurang safety"
Kopi Studio 24,Hadal Ashbek,5,"WiFi lancar, dan pilihan menunya beragam. Baristanya juga helpful dan cepat tanggap. Wajib dicoba kalau lagi di daerah Blimbing"
Kopi Studio 24,Papa Zola,1,"Untuk rice bowl nasi nya lembek dan kemarin pesen rasa 1 yg beda trnyta salah yg dtg,pdhl udh di note, trus untuk kopi d cream nya terlalu dikit ya size standart nya sama minuman lainnya juga walo es dikurangi tp terlalu sedikit... Rasa jga B aja."
Kopi Studio 24,Shokhibatul Khilmin Nazaha,3,pas laper banget... nasi beberapa masih mentah... sambalnya enak sih.. pelayanan menyebalkan. suruh ambil sisa kurangnya tapi ga di kasihkan. pas di minta jutek. suasan nya bagus cuma kotor ya... agak gimanaaa gitu. dan music di tmpt kasirnya... berisik banget
Kopi Studio 24,Narulita Alfiah,5,Tempatnya luas ada musholla sih terpenting besar juga jadi enggak perlu khawatir untuk parkiran luas wifi lancar jaya mantap deh pokoknya
Kopi Studio 24,Ahsanul Bisri,5,"Pertama kali ngopi di sini. Langsung dibikin kaget sama harganya.

Gile lu, Ndro! Enggak salah nih harga segini dapet dua? Murah bangeeeet.

Cocok buat mahasiswa, pelajar dan fresh graduate ngupi-ngupi di sini.

Rasanya juga cukup enak buat harga segitu ya. Minusnya cuma agak terlalu kemanisan aja buat gue yg udah manis. Hahahaha"
Kopi Studio 24,Itut,5,"Tempatnya nyaman, vibes nya juga enak buat ngerjain tugas. Cuma kadang ada beberapa sampah yang blm terbuang ke tong sampah. Mungkin bisa dikasih tulisan harap buang sampah ditempat sampah."
Kopi Studio 24,Dani,5,"Bagus banget tempatnya
Makan nya enak"
Kopi Studio 24,Rahmadani,5,"Seruuu ngopi di tempat ini, suasananya jg baguss.
Aq suka bgtt sm makanannya."
Kopi Studio 24,18. Muhammad Yoga Pratama,5,"tempatnya enak bisa lesehan pake kursi juga bisa, tempatnya ngga panas , harga juga murah di kantong pelajar, rasa semua minuman enak rata” manis mantap dah"
Kopi Studio 24,vinsyah bintang pamungkas,5,tempat nya enak buat nugas
Kopi Studio 24,Yassa Aji,5,Tempat nya luas dan nyaman untuk mengerjakan tugasss
Kopi Studio 24,Andan Sari,5,"Tempat nya bersih rapi, pegawai nya juga ramah makanan nya murah meriah rekomen bgt"
Kopi Studio 24,Hadi Setiawan,1,"1. Tukang parkir mabuk, kayak preman
2. Kasirnya mondar-mandir gk jelas, melayani tanpa senyum/jutek
3. Menu banyak yang kosong
Mohon diperbaiki lagi managementnya"
Kopi Studio 24,backup 1,5,"Kopi Studio 24 Blimbing punya suasana yang nyaman buat nugas. pelayanannya ramah, dan kopinya enak dengan harga yang terjangkau. Cocok buat nongkrong, nugas,atau santai bareng teman."
Kopi Studio 24,Fitria Al Azzam,5,Kopi studio 24. Saya baru tahu ada cafe di daerah sini. Asli keren banget. Lokasinya strategis. Dan satu lagi. Banyak menu minuman Dan snack yang recommend. Dan tentunya harganya samgat relatif Murah. Pelayanan ramah Dan self service. Banyak spot foto Instagramable Dan keren sekali. Vibesnya asli nikin nyaman. Menu yang variatif Dan harganya yang ramah di kantong. Pelajar Dan mahasiswa pasti betah kalau nongkrong disini. Rapat atau meeting juga jadi asik di sini
Kopi Studio 24,Mazida,5,"worth it buat yg mau nugas dengan budget pas2an, tapii gaada musik yaa ka hehe tapii aman ko karena ga semua pengen dengerin musik pas nugas wkwkkw"
Kopi Studio 24,Rizka Maulidina,1,Pelayanannya lama bangett Nunggu sampek 1 jam gak selesai selesai
Kopi Studio 24,17. Mohammad Novan Fahrul Rozi,5,"Tempatnya enak buat nongkrong, apalagi ngerjain tugas bareng-bareng sama temen sehabis pulang kuliah ditemenin sama ngopi, buat rekomen es coffe cold brew enak bgt sih sandingin sama pancong nya"
Kopi Studio 24,Rio Adi,5,Pelayanan bagus serta makananya enak dan rekomen bangett tempatnya buat nyantai dan ngobrol bareng teman2
Kopi Studio 24,Muhamad Romli,5,Saya ceritakan pengalaman kesini sangat bagus dan harganya murah
Kopi Studio 24,Oktavia N,5,"Untuk tempat nongkrong harga standar dan tempatnya cukup bagus. Enak sih buat nongkrong sampe malem sekalipun ga perlu khawatir tutup juga.
Makanan dan minuman rasanya lumayan. Ada menu nasi juga jadi ga bingung klo kelaperan. Variasi minumnya juga banyak. Ada juga menu es krim enak sih. Tapi untuk yg kurang begitu suka susu es krimnya berasa bgt susunya.
Parkiran luas. Tempatnya hampir selalu ramai. Kamar mandi juga bersih. Cuma meja2 emang ga dibersihin ya klo ada customer baru. Jadi bekas nongkrong bikin meja cukup kotor. Ada lesehan dan duduk. Saran aja sih kursinya udah waktunya diganti. Tapi 2x liat kursi patah pas kesana."
Kopi Studio 24,Refiana,5,Untuk harga menunya sgt terjangkau dan tempatnya luas kalau mau nongkrong atau rapat rame-rame. Beberapa tempat sgt instagramable dan aesthetic. Ada lesehannya juga. Bisa indoor atau outdoor.  Dan dia juga 24 jam🤩✨️ Recommend💙✨️
Kopi Studio 24,Dinda Larasati,5,"tempatnya sejuk, nyaman, dan enak buat nongkrong bersama teman-teman slebew srepet"
Kopi Studio 24,Farhan Mustofa,1,"Mungkin kepada tukang parkir nya bisa ditekan kan lagi kalau parkir ojol 1k soalnya pengalaman saya tukang parkirnya ambil 2k 🥺
mohon maaf yaaa bukannya saya tidak ikhlas atau bagaimana, soalnya untuk ojol seperti kami uang 1k itu penting banget lhoooo apalagi dlm sekali order kami hanya dpt komisi 6.400 kalau diambil 2k sisa 4.400 donk🥺🙏 sebenarnya sya juga salah karena tidak memakai seragam lengkap tapi setidaknya kalau bisa di tanya dulu ojol atau pelanggan apalagi sudah jelas ada holder hp di kaca spion sepeda saya"
Kopi Studio 24,Faris Ghaisani,5,Enak banget buat chill ngobrol lama²... sering nobar di sini 🎬
Kopi Studio 24,Rafi Khairan,5,"Tempat asik buat hangout dan nongki di sekitar blimbing, suasananya santai, space buat duduk banyak (ada indoor, outdoor, dan lesehan). Menunya beragam, minumannya enak enak, dan makanannya juga oke, mau nyemil atau makan berat ada. Dan yang pasti harganya murah. Ada wifi, bisa buat nugas. Parkir motor memadai."
Kopi Studio 24,syifa asya,5,"TEMPATNYA NYAMAN BGTTT APALGI BUAT NUGASS, MINUMANNYA JG MURAHH"" BANGET DAN ENAK"" BANGETTTT, PANCONGNYAA JUGAA ENAK BANGETTT, SUKAKK BGTT DEHHHH‼️🫰🏻🫰🏻"
Kopi Studio 24,Vanesa salsa,5,"Tempatnyaaa nyamannn bangettttt, kakak²nya jugaa ramah-ramahh, pelayanannya punn cepett polll❤‍🔥❤‍🔥"
Kopi Studio 24,Zainul Mutaqin,4,Makanan dan minumannya murah. Tempat luas namun ada beberapa spot yg kuranh bersih. Tukang parkirnya kurang satset haha
Kopi Studio 24,Adisya Septia,5,"tempatnya bagus, enak buat nugas apalagi kopi susu nya enakk polll"
Kopi Studio 24,DINDA FETY AISYAH,5,"sangat mantab dan enakkkk, tempat nya enak nyaman. makanan nya enak dan murahh 😍"
Kopi Studio 24,Didik Tri,1,Sebenarnya enak si di sini nun pelayanan nya kurang kemarin charger ketinggalan katanya mau di cek CCTV sampek sekarang gada kabar
