nama_tempat,username,rating,review
Kopi Studio 24,Nabilatul Rosida,5,"Tempat nya comfy banget buat kumpul ama temen maupun buat nugas. Ada yang di indoor maupun outdoor. Ada juga tempat lesehan. Ambience nya nyaman, musholla dan kamar mandinya bersih. Beberapa spot juga Instagrammable. Untuk rasa menunya sama saja dengan cabang kopstud yang lain"
Kopi Studio 24,difany kurnia ramadhani,5,"tempatnya nyaman bgtt buat nugas, cocok buat ngopi santai, makanan sama minumannya murmer sm pelayanannya juga cepett ga nunggu lama💗💗💗"
Kopi Studio 24,Supriadianto,5,"tempatnya enak, adem, banyak colokan, nyaman"
Kopi Studio 24,Dinda Ayu,5,"Tempatnya nyaman, luas, pas banget buat nugas, menunya bervariasi dengn harga yang murce, pelayanannya juga baik dan ramah, recommended buat yang cari tempat nugas dan santai"
Kopi Studio 24,A. Khoirul Fathoni,5,"Good place
Nice sippp
Good looking
Pelayanannya oke
Lokasinya strategis
Mudah dicari
Nyaman buat nyantai
Parkir luas, bersih
Banyak varian menu makanan dan minuman
Musholla dan Toilet ada"
Kopi Studio 24,Nurtjahja Juniarsa,4,"Lokasi strategis, ruangan enak, menu lengkap. Harga terjangkau. Pelayanan  baik. Bisa untuk group, untuk individu juga bagus"
Kopi Studio 24,Ar Ja,3,"Harga standar kopi studio. Eskrimnya terlalu manis. Makanan enak. Minumannya agak bikin serik ya kalau yang teh teh-an. Minuman yang lain sih ok. Kue pancongnya rasanya biasa. Tempat luas, bersih, ada outdoor dan indoor. Ada mushola juga dan bersih. Lumayan ramai kalau weekend dan antrinya panjang. Pelayan ramah dan informatif. Tukang parkirnya galak dan nggak mau bantu nyebrangin. Toiletnya super jorok asli, bau pesing dan kotor banget pokoknya 🤮 ."
Kopi Studio 24,Ihza Ardana,5,"pelayanan baik, temoat bersih, nyaman"
Kopi Studio 24,Zahro Firdausin. N,5,"tempat nya keren, pelayanan bagus, suasana oke banget, menu nya dana pelajar, tempat bagus buat ngopi santai, intinya keren"
Kopi Studio 24,Fayzz Rmdhn,5,tempat nyaman harga murah cocok buat nugas
Kopi Studio 24,Cut Efitri Okta Rose,1,"buruk bgt pliss ga dipisah area ngerokok dan ngganyaa, semua tempat bebas rokok bgt jadi ga nyaman (tau kan rasanya pusing sesek sampe gamood ngapa²in) trs kamar mandinya sumpah jorok bgt"
Kopi Studio 24,Abdurrohman Hedi,5,"Makanan oke, pelayanan cepat, minuman semua murah
Cocok buat nugas sama temen banyak
Banyak menu dan murah
Mantepp kopi studioooooo"
Kopi Studio 24,Cica Aprilia Munika,3,"Tempatnya enak, tpi knp menunya tuh ada yg selalu belum ready contohnya green tea, 2 kali ke sini selalu belum ready, karyawannya juga yaa...  kalo diajak ngomong tuh liat lawan bicaranya, bukan sibuk sama hpnya, senyum dikit mbak. Klo lgi banyak masalah gausah di bawa ke tempat kerja. Semoga diperbaiki, terimakasih."
Kopi Studio 24,Nayla Zaliya,2,"lama banget pesanannya jadi, padahal ngga terlalu ramai, cuman pesan 2 minuman aja sampe setengah jam, ngga cocok si kalo kesini pas lagi haus” nya"
Kopi Studio 24,Ka Zie,5,"Tempat nyaa ademmm,, suka banget buat nugas disini, murah murah jugaa harga nyaa, langganan banget disini, apa lagi wifi nya lancarr behhhh"
Kopi Studio 24,Elia Kusuma (El),5,"Dari POV ku

Rating :
Makanan 8.2/10 = sesuai harga dan makanan kok dan masih layak makan dan
Layanan 8/10 = sikap ya ala kadar nya
Suasana 8.5/10= ok sih, dari desain bangunan dan ambience nya ok buat nongki menyesuaikan budget hehe

Sukaa polll dan rekomen ya yg ini"
Kopi Studio 24,Elvan Agung,1,Karywan ndak profesional sama sekali masak orderan shope nomornya di loncatin
Kopi Studio 24,Hanif Fadhillatuzzahro,1,"Dari kopstudnya sendiri bagus, tempatnya nyaman buat nugas, segi makanan dan pelayanan oke. Sayang bgt tukang parkirnya sangat sangat menyebalkan. Sistem parkirnya dikasih nomor parkir di kendaraan sm pengendaranya. Saya kesana nggak tau kalo dikasih nomor tsb. (Terakhir kesana blm ada sistem gtu) tukang parkirnya ngotot buat nyuruh cari sedangkan saya aja nggak dikasih sama sekali dan nggak megang kok disuruh nyari nomornya, mau nyari apaan wkwk. Ngeyel suruh nyari klo nggak gtu bayar denda. Padahal setelah saya bayar parkir tuh ga dikasih nomor dan motor saya pun saat itu juga nggak dikasih nomor. Pas mau pulang di motor ada nomor parkirnya. Nggak bgt sumpah tukang parkirnya. Udah gtu nggak nyeberangin lagi."
Kopi Studio 24,Wira Syarief,5,Tempat bersih nyaman dan pelayanan yang ramah
Kopi Studio 24,Nazwa Divana,5,"pelayanannya ramah bgt, tempatnya cocok buat nugasssss"
Kopi Studio 24,Silviyah Aniansyah,5,"Penyajian makanan dan minumannya cepat, wifi lancar, pramusaji nya ramah"
Kopi Studio 24,NIAN WAHYUDI,5,"Tempatnya super luas, disediakan banyak ruangan hingga area lesehan. Wifi lumayan kenceng dan banyak colokan sehingga proper sebagai working space. Menu makanan dan minuman sangat variatif yang tentunya terjangkau, self-sevice konsepnya.
Hampir selalu ramai pengunjung karena buka 24 jam."
Kopi Studio 24,Aan Yoga,5,Pelayanan terbaik suasana juga enak buat nongki
Kopi Studio 24,Ririh Agusti,4,"Banyak tempat duduk..cukup nyaman.. tapi kebersihan perlu ditingkatkan. Sy lihat puntung2 rokok di sebelah tempat duduk sy belum dibersihkan.

Dan para pengunjung kl.mau ngrokok buang pada tempatnya atau minta asbak."
Kopi Studio 24,Aya Ya,1,"Damn!!!!! Kasirnya gak sopan. Pesanan gak sesuai, apa yang dipesen dibilang sama sama menu lain padahal beda. Gak eye contact. Harus ngulangin ngomong 3x. Ntah karyawan baru atau apa, baru kali ini kecewa banget sm pelayanannya.
*note kasirnya cewe berhijab pake kacamata frame nya clear"
Kopi Studio 24,Andan sari,5,"pelayanan ramah, makanan minumannya murah, tempat baguss rekomen"
Kopi Studio 24,Taufan Ardiansyah,1,"makanan enak minuman enak..
tp ya lucu mosok parkir di ruko sebelah parkiran n motor di tunggu in sama istri kok di tarik parkir.."
Kopi Studio 24,Devanda Hanifan Kusuma,5,"Makanan: kemarin kentang goreng saya terlalu banyak garam, mohon untuk takaran garamnya lebih diperhatikan serta dikira untuk porsi pemberiaan garam nya.
Layanan: ditempat ini semua self service (mengambil makanan dan minuman sendiri di tempat dekat kasir)
Suasan: cocok untuk yang nugas 24 jam, banyak stopkontaknya

Harga di sini sangat terjangkau bagi siswa siwi maupun mahasiswa atau lain lain. Karena minuman hanya sekitar 10 ribuan saja. Lokasi yang luas dan nyaman, serta mendukung untuk nugas."
Kopi Studio 24,Adelia Revianti,5,tempatnya nyaman enak cocok buat ngumpul bareng temen atau ngerjain tugas
Kopi Studio 24,Brilliant A.,4,"waktu itu aku kesana 2x (tempat yg muraah dan lumayan untuk makanannya) aku dulu pesan beberapa macam minumannya krena murah jd kurang kerasa  untuk aku yaa (jd kerasanya kya gula sm es batunya ajaa) dan itu jg rivew dr aku dan temenku, kalo buat makanannnya enaak dg porsi yg dikit karena kan murah jugAa😬😬 tp untuk wifi nya ksang kenceng soalnya banyak yg ngerjain disanaa JUGAAA dan tempatnya okeey (walaupun beberapa ad yg ga bersiin sendiri jd kegeletakan dmna-mana) 😞😞 buat kamar mandinya termasuk kotor dan kurangnya tisu di kamar mandii (harusnya buat kamar mandi minimal bgt ada tisunya) dan agaak berkerak, mungkin bisa dibersiin kedepannya"
Kopi Studio 24,Danelladahayu calya,5,"Tempatnya cozy banget buat nongkrong atau kerja. Kopinya enak, staff ramah, vibes-nya bikin betah lama-lama"
Kopi Studio 24,vee alensa,5,pelayanannya baikk ramahh  tempatnya enak buat nongkrong gassinnn
Kopi Studio 24,ahmad febriansyah,1,"pelayanan kurang banget, katanya menu yg habis cuma beberapa aja, ternyata waktu dipesan udh banyak yg udh habis, tempatnya juga kotor banget"
Kopi Studio 24,Salsabila Ananda,5,"Rame bangettt, makanan sama minumannya standar tapi harganya murah banget. Lumayan bersih, cocok buat rame2, buat yang suka ga rame ga cocok disini. Parkir luas juga lumayan, kebanyakan anak2 smp-sma"
Kopi Studio 24,Silvia Eka Hardi Saputri,1,"Orderan ga ramai, tapi pelayanannya super duper lamaaaa…….. ksini cuma berdua, orderan untuk 2 org tapi 40 menit lebih ga jadi2 waw😌👌 not rekomended sih ini"
Kopi Studio 24,saina,1,"kesini tanggal 8 kemaren. pengennya duduk di area lesehan, tapi lembab banget gak nyaman, bau pesing bangettt. terus yang beanbag di bagian pojok juga ada tai kucingnya. maaf ya, keadaan hectic gabisa jadi alesan buat gak sempat ngecek kebersihan. fnb lohh..."
Kopi Studio 24,005_Micha Michela Fitriana,5,"🌿 [Kopi Studio 24 – Blimbing, Malang]
☕ Hidden gem dengan rasa yang bikin nagih

📍 Lokasi: Blimbing, Malang
⭐ Rating: 4.5 / 5

💬 Catatan Pribadi:

🍶 Creamy Series-nya juara! Manisnya pas, teksturnya lembut, dan aftertaste-nya bikin pengen nambah.

🧊 Kopi es-nya ringan tapi tetap nendang, cocok buat yang nggak suka kopi terlalu pahit.

🧋 Kemasan simple tapi estetik — cocok buat OOTD di meja cafe atau sekadar difoto bareng notes.

🪑 Tempatnya nggak terlalu ramai, nyaman buat chill atau kerja sebentar.

⚠️ Minus sedikit:

Parkiran agak terbatas kalau jam ramai

🎯 Overall:
Kalau kamu cari tempat ngopi yang low-key tapi rasa dan vibes-nya berkelas, Kopi Studio 24 ini bisa jadi pilihan andalan!"
Kopi Studio 24,Fadhlul Razak,5,"overall tempatnya bagus dan harga menunya juga tergolong murah banget. saya rasa tempat ini cocok buat mahasiswa yang begadang buat nugas, karena cafe ini buka 24 jam. Ini saya datang jam 3 pagi juga masih bisa order meskipun tempatnya sepi"
Kopi Studio 24,Rafi Abiyyu Airlangga,5,"Gue demen banget sama dunia perkopiannya, uda enak dan murah banget. Nagihin banget dah. Kek misalnya apa ya, aku lupa nama menunya, tapi ukuran large aja harganya 11rb??? Cuman yah, ada minusnya si, panas bingitz lesehannya🥹"
Kopi Studio 24,stevanie yuliana,4,"Tempat yg nyaman untuk Nongkrong, karena harga makanan dan minumannya cukup terjangkau. Tersedia menu buy one get one, marketing yg menarik. Parkiran-nya luas untuk sepeda.

Tersedia indoor dan outdoor untuk Nongkrong dan bersantai. Rekomen kue pancong nya dan Es kopi nya."
Kopi Studio 24,A_07_Alfi Thoyyibah,5,"tempatnya luas dan comfy buat wfc, paling gong nya sih pancongnya😉"
Kopi Studio 24,Probo Hindarto,5,"Harga makanan dan minuman di sini murah-murah makanya banyak yang suka terutama dari kalangan pelajar. Tempat duduk lumayan banyak dan tersebar termasuk di dalam dan di luar.

Cocok buat nongkrong bahkan makan siang kalau yang suka nasi ayam kulit. Harga makan nasi kulit ayam cuma 10.000-an bisa jadi opsi. Wi-fi-nya juga lancar karena itu saya kasih rating yang tinggi.

Untuk yang suka cafe dengan suasana berkelas mungkin ini bukan pilihan yang terbaik, tapi kalau untuk nilai berdasarkan harga makanan dan minuman ini termasuk yang terbaik."
Kopi Studio 24,Irfan Rizz,3,"Makanan murah.,rasa sesuai harganya..yg enak cm es krim sundae aja sih., lainnya ampun.,pelayanan kurang cepet dan sejak pindah di depan lambat dan antrian mengular.. beli es krim aja tunggu lama..padahal cmn take away"
Kopi Studio 24,Kartika mey,2,"pegawainya ga ramah bgt yang cowo, maksa bgt waktu ngasirin, sekedar mau naro laptop ke meja sebentar aja malah maksa gabole pergi padahal udah payment, eh mas nya malah teriak teriak maksa suruh nunggu struknya, tau kok kalo emg struk sama makanan itu self service, tp ga gitu juga pelayanannya, maksa bgt! orang aku jg ga nyuruh mas nya buat ngasih makanannya ke aku, diliat tuh depan gada meja, terus aku mau taro laptopku dimanaa??!!!"
Kopi Studio 24,Su Mi,5,"Pelayanan nyaa baik dan kasirnya ramah,, apalagi makanan sama minumannya juga murahh😍"
Kopi Studio 24,Ema Emo,1,"Layanan nya kurang bagus, kalo mesinnya untuk minuman rusak harusnya di beri sedotan bukan malah di suruh nyucup dri gelas langsung, 👎
Pegawainya kurang ramah juga, 👎👎"
Kopi Studio 24,Arie Prawira Sholeh,4,"Cafe ala mahasiswa, buka 24 jam, minuman nya banyak macam nya ada bermacam-macam teh, kopi, coklat dan yang lain, snacks nya juga banyak cocok lah buat cangkruk atau nongkrong, lengkap dengan free Wifi juga, bisa semalaman kalau cangkruk disini, minuman nya enak semua, tapi tingkat kemanisan tidak bisa di modifikasi, kedepannya semoga bisa pilih less sugar atau no sugar ya hehehe. Keseluruhan enak....."
Kopi Studio 24,Liaa Aaa,4,"Tempatnya asik, tapi kalo pas rame bgt jd kurang nyaman, apalagi weekend. Harga makanannya cenderung murah, jadi sering rame mahasiswa/anak muda. Kurang cocok kalo untuk keluarga, lebih cocok buat nongkrong² aja."
Kopi Studio 24,Rhefal virghi,5,Tempatnya nyaman sangat cocok untuk nugas
Kopi Studio 24,cika humaira,4,"Sangat affordable ya selalu, cocok di kantong mahasiswa. Pilihan menu bundle jg ada lbh hemat. Pilihan nongkinya juga outdoor taman dan indoor dengan bean bag/kursi. Enak buat nugas ramean.Pas kesini emang pagi sekitar pukul 7. Kalau habis turun dr stasiun blimbing bingung kemana, kesini aja.  Menu sarapan jg udah ready nasi, mie, pancong. Saran sih kalo yg ngga suka manis2 bisa less sugar ya. Karena menurutku yang pesen normal sugar ternyata kemanisan."
Kopi Studio 24,Hannah Aprilia,1,Less ice mending tambah harga dari pada cuma segini
Kopi Studio 24,Nabila Oktavia,5,"Harganya sangat murah, tersedia promo buy one get one di cafe ini. Makanannya standard (biasa saja) untuk minuman enak, banyak macamnya, dari kopi, milk tea, matcha, sampai Ice cream boba. Disini juga lengkap dengan makanan lainnya👍🏻👍🏻"
Kopi Studio 24,Andi Tri Setiawan Putra,5,"real enak buat nongki, ngerjain tugas santai, wifi tergolong cepat dan mudah di akses, rekom banget di kopistudio 24 cabang blimbing"
Kopi Studio 24,muneefah putri,4,"It’ cheap and comfortable place. Nasi kulit rempahnya enak, thai tea dan avocadonya juga enak. Open for 24 hours. Sayangnya untuk daerah bean bag kebersihannya kurang, bean bagnya kadang berbau apek."
Kopi Studio 24,Naya Rahadi,5,"saya sangat puas pelayanan nya fasilitas nya sangat lengkap, dan toilet sangat bersih sehingga saya kalo ngising tai saya bahagia, dan wifi sangat banter👍"
Kopi Studio 24,Retno Putri,2,"Tidak dikasih sarung tangan padahal sudah minta, kurang enak kalau makan cuman pakai sendok"
Kopi Studio 24,Kecek Purwateja,3,"Nyari tempat kopi, nyoba main kesini karena kelihatannya rame.

Tempat nya ok banget, minimalis dengan permainan banyak lampu dan hiasan tanaman yang lagi Hits. Tidak usah kuatir kalo kamu gak kebagian tempat, karena memang banyak menyediakan meja dan kursi.

Buat kamu pecinta kopi, sebaiknya jangan nyoba di sini, karena disini menyediakan es kopi blended gt. Ya es kopi gitu deh. Menu snack juga banyak disini, kebetulan nyoba kue pancong, dan rasanya gak banget. Blenyek-blenyek gitu. Tapi untuk harga murah murah banget.

Buat nongkrong ok sama temen atau keluarga, tapi kalo kamu pengen kopi dan pemerhati makanan enak, kayanya gak cocok main kesini."
Kopi Studio 24,maulana aldrian,5,"murah,nyaman,cocok buat nugas"
Kopi Studio 24,Wahyu Hasna,5,"Tempat ngopi murah bgt, paketan medium 2 gini cuma 15k ajah..
Cocok bgt buat nongkrong low budget dan anak2 kampus buat nugas..
Rame selalu pengunjung dan ojol👌 …"
Kopi Studio 24,NAVI CYBER INDO,5,"Pelayanan ramah pol disini nga kyak di cabang lain, cepat banget si apalagi kalo antrian nya dikit. Tempat nyaman. Kalo yang ngasir cewe ramah si senyum terus ngga jutek"
Kopi Studio 24,hlloo,5,"tempatnya nyaman bgt dan bersih, kaka""nya ramah, pancongnya tetepp ter the best manisnya ga bikin enek"
Kopi Studio 24,Andri Anto,4,"Tempatnya nyaman, tempatnya luas, ada outdor ada indoor area, pelayanan cepat, rasanya si agak kurang namun sepadan dengan harga, pancongnya lumayan enaque, parkir luas depan jalan besar. Untuk kebersihan relatif kurang apalagi di kamar mandi."
Kopi Studio 24,Yuliana Septiani,1,"Karyawan kurang ramah, tidak helpful
Makananya sekarang banyak yg kualitas nya menurun. Cirengnya keras, jatohnya jd kerupuk. Nasinya lembekk, kopinya aneh rasanya."
Kopi Studio 24,Izza Ishmatil Maula,5,"Sangat rekomendasi buat ngerjain tugas sampai tengah malam, pelayanannya juga baik, mbak2/mas2nya ramah"
Kopi Studio 24,Wulan Saraswati,5,"tempatnya enak kalo buat santai, ngerjain tugas pun juga oke, mau yg lesehan atau pun duduk di kursi, pelayanannya juga cepet walaupun ruameee pol, mungkin udah terbiasa yah, karena kopstud kan juga terkenal pelayanannya yg cepet,

untuk kamar mandinya gaada tisunya, jadi perlu bawa sndiri” gitu jadi aga ribet deh wkwk but yaa itskkeyy lah

trs apalagi ya, parkirnya juga lumayan, cmn kalo mobil aga terbatas ya sayy krn emg lebih di khususkan bagi konsumen” yg bawa motor si wkwk

okayy thankyou"
Kopi Studio 24,Beauty Milla_,5,"Tempat nongkrong termurah, buy 1 get 1 selalu andalan
Apalagi pancongnya aku suka keju lumerrrrrr
Andalan di sini"
Kopi Studio 24,Kristanto Anggoro,5,Americano dan Cold Brew nya favorit banget... Yg perlu diperbaiki mungkin perlu ditambah mesin espresso nya supaya pembeli online dan offline tidak campur dan pelayanan jadi lebih cepet. Kasian yg beli lsg take away harus nunggu antrian dengan bapak2 gofood dan shopeefood.
Kopi Studio 24,jack indo garden,1,"gajelaa pelayan lama,pesanan tidak sesuai ga rekomend bangett"
Kopi Studio 24,Not Found,5,"Tempatny ramai, makanan enak pelayanan ramah"
Kopi Studio 24,Hafidz Odinsyah,5,"Untuk snack dan minumannya not bad lah ya.  Tempat untuk duduknya macem2, ada yang lesehan, ada yang pakai kursi. Di tempat lesehan juga ada bean bag dan banyak colokan. Sayangnya kesadaran pelanggannya yang kurang, terutama terkait sampah"
Kopi Studio 24,hastag,1,"gapapa kalau emang banyak yang lagi kosong makanannya, tapi service nya itu yang ga banget. dari pemberitahuan menu kosong yang nunggu customer pesen sebutin satu persatu dulu, akhirnya baru ditulis pas customer udah nyebut banyak menu yang dibilang kosong. makanannya beberapa ada yang salah, pesen cheesse ga dikasi chesse, pesen ricebowl mayo, mayonya ga ada. udah ditegor malah sewot. tempatnya kotor ga disapu meja juga banyak yang kotor. nampan yang paling ga bisa ditolerir, nampan buat bawa makanan kotor. saya pesen sampe bawa 3 nampan, dan tiga""nya nampannya kotor (bukan buluk ya, tapi kotor). maaf saya komen gini, karena saya juga kerja di bidang cafetaria, jadi tau sop nya dan minimal standart nya seperti apa dan memaklumi kalau ada miss dari pegawai pada bidang ini karena tau keadaan di dapur seperti apa. tapi yang kali ini menurut saya ga bisa dimaklumi si, terlebih lagi di sini self service yang mana pegawai ga dibebankan buat nganter makanan customer. jadi cukup disayangkan."
Kopi Studio 24,Abdurrohman Hedi,5,"Tempat nongki terdekat di rumah, apalagi pancongnya mantappppoo
Pesan makanan juga cepat jadii
Yukk gesas ke sini"
Kopi Studio 24,rere,5,"pelayanan ramah dan cepat, suasananya juga nyaman, cocok buat ngerjain tugas, apalagi makanannya enak enak semua💯💯"
Kopi Studio 24,Arsy Barajati Putra Ersa,5,Tempatnya nyaman buat nugas dan ngopi santai. tempatnya luas walau malam minggu.
Kopi Studio 24,Adzani Fatimah Az-Zahroh Yuwono,5,"Pelayanan cepat, ramah. Makanannya oke. Buat nongkrong oke banget. SFSG alias so far so good anjay"
Kopi Studio 24,Muhammad Sahlan,2,Saya ke sana kan tanya sama tukang parkir e mas masih rame a? Terus jawabnya yo lek cafe mesti rame mas. Lah moso jawabanne kek gitu. Mohon diperbaiki layanannya terutama tukang parkirnya dong
Kopi Studio 24,Adela Desty,5,"colokannya buanyakkk cocok buat nugassss, mantaps👍 nyamannn jugakkk"
Kopi Studio 24,Mifta Nur Aini,5,"Sering nongkrong di sini, paling nyaman selain deket rumah dan murah. Tempatnya gede banget, tempat parkirnya luas dan pelayanannya ramah"
Kopi Studio 24,Fernanda Fahmi,5,Tempat nyaman dan cocok untuk nugas
Kopi Studio 24,rizal ghozali,1,"Lama syekali
Pegawai malah bercanda tidak mengerjakan orderan masuk"
Kopi Studio 24,Vania Eka Putri Laksono,5,"mantap, hujan hujan kesini suasananya bagus"
Kopi Studio 24,Muhammad Naufal Shidqii Aditya,5,"Bagus tempatnya, recomended"
Kopi Studio 24,Rega Ramantha,5,"tempat nya nyaman buat nugas mantab, harga nya murah"" cocok untuk pelajar."
Kopi Studio 24,Miss Pentol,1,"Pelayanan kurang satset, Pesen 2 Nunggu e 1 jam, di tanyakan ke kasir, ternyata belum di buatkan, pdhal ga terlaku rame pengunjung, pesen es krim sendok ga dikasih, nyucup es krim nggawe sedotan ."
Kopi Studio 24,Maulida,5,"Tempat nyaman yaa karena lebih luas dari kopi studio 24 lainnya, lokasi pinggir jalan raya blimbing setelah perempatan bangjo kiri jalan homey banget ada indoor outdoor dan semi outdoor juga mau lesehan pake meja semuanya ada, colokan setiap tempat, wifi lancar jaya karena ada beberapa wifi juga, harga affordable banget, tapi dibanding kopi studio lainnya harganya disini lebih mahal sedikit kaya yg buy 1 get 1 ukuran reg 10k di tempat kopstud lainnya disini 12k gituu yaa"
Kopi Studio 24,Amanda Mahardka,5,pelayanannya ramah terus juga makanann dan minuman nya murce udah 24 jam juga jadii nya worth to berlaam lama hshs
Kopi Studio 24,Didik Siswanto,5,"Tempatnya nyaman, pelayanan nya ramah pokok is the best deh 👍👍"
Kopi Studio 24,Ganta Fajar,5,"pelayanan ramah, staff nya juga baik enjoy,buat nugas apa kumpul juga luas asik tempatnya...."
Kopi Studio 24,Makan ala MOT,5,"Menunya bervariasi, minuman murah meriaaah"
Kopi Studio 24,Mar Kanti,1,"Minus kasir ga ada ramah nya sedikitpun, ketus, sinis. Mohon dijadikan koreksi untuk staf seperti itu, krn kalian di bagian pelayanan."
Kopi Studio 24,Nizzar Mizzukane,5,"- Tempatnya luas ,
- Anak kampus banget
- Serba mie miean ,
- parkiran enak
- 24 jam
- harga kantong mahasiswa
- Terbaek"
Kopi Studio 24,AHMAD NAUFAL WASKITO AJI,5,"Kopi Studio 24 ini tempatnya asik banget buat nongkrong atau nugas! Pilihan menunya variatif, favorit saya pancong lumer yang rasanya pas dan cold brew coffe. Pelayanannya ramah, tempatnya bersih. Harga cukup terjangkau, rekomendasi buat yang cari kafe santai di Malang!"
Kopi Studio 24,22.048 Alamsyah,5,Rekomendasi buat anak² mudah yang ingin mengerjakan tugas atau hanya ingin menenangkan diri. Di sni menyediakan ruang outdoor dan indoor untuk indoor memiliki beberapa ruang dari yang menggunakan kursi dan batal untuk berbaring
Kopi Studio 24,Wahyu Wibisono,5,"Lokasi nongkrong asik yang lumayan terjangkau. Smoking dan non-smoking area sudah dipisah, jadi leluasa untuk semua orang. Untuk makanan sudah oke, dengan harga yang terjangkau. Lokasi juga tidak terlalu ramai."
Kopi Studio 24,09_Fitria Nur Fadilah,4,"Tempatnya oke banget buat nugas, kumpul"", nongkrong"" jg bisa soalnya ada tempat outdoor sama indoor nya. Lesehan bisa pake kursi juga bisa, untuk makanan dan minumannya juga harganya ramah di kantong dan enak juga. Pilihan menunya juga banyak kok dan sistem nya self service ya jadi ngambil pesenan sendiri. Ada mushola, wifi, toilet, stop kontak nya juga banyak intinya oke sih. Recommend bgt buat nongkrong"" 👍🏻"
Kopi Studio 24,Tasha Monica Anggraini,5,"Pelayanan baik, murah meriah, makanan enak²"
Kopi Studio 24,Mochammad Imam SA,5,"Pertama kesini, makan take away

Kopi d cream dan kue pancong adalah menu terbaik menurut saya

Ntar kalo dah makan disini, review lagi

All over, tempat e uwapik rek"
Kopi Studio 24,Gita MLG,3,Kenapa konsumen kudu bayar pake uang pas dah?
Kopi Studio 24,Stefanus Aprilianto,5,"Si paling 24jam bukanya, banyak tempat jadi aman pasti kebagian tempat. Cocok buat ramean, menu banyak pol 🥳"
Kopi Studio 24,ratih 1234,5,sangat gembira bisa ke sini bareng teman” banyak piliham makanan& minumann enakkk porsi banyakk
Kopi Studio 24,getsa salsa,5,"makan nanya dan minum nya enak, dan tempat nyaman"
Kopi Studio 24,Aac Aac,5,Rekomend buat nongkrong atau nugas
Kopi Studio 24,Anni khoirun Nisa,5,sangat nyaman buat ngerjakan tugas
Kopi Studio 24,Victor Hurulean,5,Makanan standart sih... Cukup terjangkau untuk kantong mahasiswa.. yg enak tempatnya ....rekom untuk kerjakan tugas atau sekedar cuci mata... Selalu kesini kalo ada project
Kopi Studio 24,damai lintang,1,"pelayanan sangat lama orderan shoopefood cuman 4 item hampir 1 jam rugi waktu dan komplain customer, mohon untuk karyawan lebih memerhatikan pelayanan fast bar dan fast order"
Kopi Studio 24,Muhammad Habibi Munif,5,"Secara keseluruhan,Bagus.Pelayanan juga oke,makanan juga mantap.Saran saya,Bisa ditingkatkan porsinya,Dan jika porsinya banyak, bisa sedikit di tingkatkan harganya, agar seimbang dan tidak terlalu rugi.

Secara keseluruhan Fine fine ajah.Mungkin fasilitas Musholanya bisa ditingkatkan lagi, yaa...memang masih dalam tahap pembangunan, saya wajarkan lah ya. Dan semoga makin baik kedepannya, siipp dah"
Kopi Studio 24,Fharel Aditya Pratama,5,"wifinya lancar, tempatnya juga enak buat nyantai atau buat wfc, bintang 5 dehh buat tempat inii😄😄😄😄"
Kopi Studio 24,Cahbakoh Indonesia,2,"udh lumayan sering kesini, paham sih ini self service, tapi emg harus ya kasirnya jutek? pinjem lap aja di kasih yang bau, nah udh tau bau malah di kasih wkwkwkwk, trus skrang antri minuman mesti nunggu dipanggil g pake device atau speaker jadinya ya udh kehabisan tempat duduk"
Kopi Studio 24,Dino prianto,5,makanan dan pelayanannya oke banget jadi nyaman ngopi disini
Kopi Studio 24,23_Nazar Setiawan,5,"murah, nyaman, cocok untuk ngopag"
Kopi Studio 24,Muhammad Harsya,5,"tempatnya bagus, ada spot baruuu, lumayan buat nambahh tempat dudukk, cocok buat nongkrong sama nugas"
Kopi Studio 24,B- Zikha Pratiwi,5,"Makanan enak, tapi minumnya kemanisan, mungkin di kamar mandi dikasih tisu dan sekitarnya"
Kopi Studio 24,abigail jihanfarera,5,pelayanan nya ramah dan cepat tempatnya nyamannn🥰
Kopi Studio 24,lyon wahyu,5,Sangat memuaskan tempat dan interior ok tolong kedepannya lebih bagus lagi
Kopi Studio 24,14_1B_ROBY MULIANO PUTRA_D4JTD,5,"sangat nyaman bagi mahasiswa apalagi dibuat nugas, intinya enak pwoll dehhh😁😁 …"
Kopi Studio 24,libra safira,5,"tempat nya nyaman bangett , rekom banget buat maba"" baru di malangg 🥰"
Kopi Studio 24,afifa dwi,1,"kasir tidak ramah, tidak senyum, karyawan lainnya juga tidak ramah kepada kurir shopeefood tapi kalo sama temennya banyak becandanya"
