nama_tempat,username,rating,review
Kopi Studio 24 Panglima Sudirman,miming redinas,5,"Tempatnya enak, akses mudah dijangkau, pelayanan cepat dan ramah"
Kopi Studio 24 Panglima Sudirman,Fellyza Fergianita,5,Pelayananya sangat ramah tempatnya bersih recomended sekali 😍
Kopi Studio 24 Panglima Sudirman,AFIFAH DWI HUSNA SHABHA,5,"Tempatnya nyaman, pelayanan juga ramah dan super cepat, menu nya juga tergolong sangat murah"
Kopi Studio 24 Panglima Sudirman,vyola permatasari,5,"Mantap pelayanan dan harga bersahabat ,dekat tempat kerja enakk"
Kopi Studio 24 Panglima Sudirman,Jaya Agil,5,"Pelayanan ramah dan makanan juga ramah d kantong .
Tempat enjoy santai untuk nugas atau kerja wfh..  mantapppp.
Ruangan indoor nya juga bersih nyaman"
Kopi Studio 24 Panglima Sudirman,Ayulita Ikaputri Mudzakkir,5,"tempatnya cozy banget, pelayanannya ramah....harga sangat murah di kantong
ruangan juga bersih baik yg indoor ataupun outdoor
cocok untuk tempat kerja ataupun ngerjain tugas"
Kopi Studio 24 Panglima Sudirman,Anggie Deva,5,"Tempat nyaman, ramah pelayanan Kaka nya, recommended bgt guys 🫶🏼"
Kopi Studio 24 Panglima Sudirman,Fellyza Fergianita,5,Tempatnya bersih pelayanan ya ramah 😍
Kopi Studio 24 Panglima Sudirman,A A,5,"menurutku tempatnya paling enak disini diantara semua kopstud, pegawainya juga ramah2, ngasih rekomendasi dan ksh tau ada diskon apa aja👍🏻👍🏻💯💯"
Kopi Studio 24 Panglima Sudirman,Luna Kintan,5,"mantap, pelayanan cepat, lingkungan bersih"
Kopi Studio 24 Panglima Sudirman,Siska Dian Anggraeni,5,Tempat bersih kamar mandi juga bersih pelayanan kakaknya ramah dan baik banyak ya g beli untuk dibungkus dan dibawa pulang tapi pelayanan cepat enak sekali mampir karena habis beli pampers di toko sebelah 😃
Kopi Studio 24 Panglima Sudirman,cndyyy,5,tempatnya nyaman pelayanannya cepet dan ramah
Kopi Studio 24 Panglima Sudirman,Cheri Adelia,5,"Tempat cozy lt 2 enak buat nugas, cocok di kantong mahasiswa"
Kopi Studio 24 Panglima Sudirman,Sitimasluha Luha,5,"Tempat bersih
Pelayanan baik"
Kopi Studio 24 Panglima Sudirman,Raditya Rizki Pratama,5,"tempat recommended dan nyaman, harga juga murah"
Kopi Studio 24 Panglima Sudirman,Maria Aprita,5,tempatnya bersih dan pelayanannya ramah
Kopi Studio 24 Panglima Sudirman,Putri Nur Fadhillah Azzahra,5,"Rekomen banget buat nongki, makanann dan minumanyaa juga enak 😍 ramah dikantong"
Kopi Studio 24 Panglima Sudirman,Rifqy Madani,5,"Tempat nya bersih, nugasable banget. ada musholla sih jadi kalo lama disana enak."
Kopi Studio 24 Panglima Sudirman,Fawwaz Dzaky,5,"Tempat oke ada lantai 1 dan 2, lantai 1 smoking area, lantai 2 AC dan tidak smoking area, kamar mandi nyaman, makanan dan minuman oke, yang aku foto ini lantai 1 saja"
Kopi Studio 24 Panglima Sudirman,Rizka Rahmania Ameilia,5,"Pelayanan cepat, es kopi susu d'cream selalu jadi menu favorit yang kupesan.
Tempat cozy"
Kopi Studio 24 Panglima Sudirman,laily damayanti19,1,"firstime ke tempat karna dekat rumah udh dpt pelayanan gak enak.
kasir tidak melayani sesuai antrian👎🏼
org baru datang lgs dilayani, saya antri depan dilayani belakangan"
Kopi Studio 24 Panglima Sudirman,Lia Nada,5,Tempatnya nyaman n pelayanannya ramah
Kopi Studio 24 Panglima Sudirman,Martina Damayanti,5,"pelayanan baik, kakanya ramah, tempatnya enakk"
Kopi Studio 24 Panglima Sudirman,nonny felisha,5,"pelayanannya cepat, karyawannya juga ramah sekalii, menu nya sangat banyak cocok juga buat kalian yg mau nongkii dan nugasss"
Kopi Studio 24 Panglima Sudirman,P17310223058 SYAHRINA TAZKIA PUTRI,5,"pelayanannya cepat, karyawannya juga ramah sekalii, menu nya sangat banyak cocok juga buat kalian yg mau nugass"
Kopi Studio 24 Panglima Sudirman,Imanuelkevin Jhonson,5,"Untuk makanan dan minumannya tidak pernah mengecewakan, mau di kopi studio mana pun sama aja. Yang jadi poin plus nya, sistem pembayaran bisa cash dan Qris, tidak seperti di outlet lain yang hanya bisa Cash/Qris saja. Untuk tempatnya juga lumayan luas, buat nugas juga cocok sekali. Tempatnya bersih dan nyaman, mudahan tetap terjaga👍🏼🤩"
Kopi Studio 24 Panglima Sudirman,angger. prameswari,5,pelayanannya ramah ramah pesannya cepat jadi🫰🏻💞💞
Kopi Studio 24 Panglima Sudirman,izzaa ixan,5,"pelayanannya ramah, tempatnya luas cocok untuk nongkrong"
Kopi Studio 24 Panglima Sudirman,Dimas Irfan Shaugi,5,Seperti biasa menu yang murah enak dan bisa akses 24 jam.  Menu juga variatif
Kopi Studio 24 Panglima Sudirman,Yunita,5,Tempat cozy enak buat nyantai bersama keluarga juga. Makanan enak
Kopi Studio 24 Panglima Sudirman,ramdhani rizki,5,"Tempatnya strategis, dekat dari stasiun dan pasar klojen. Suasananya nyaman, pas buat nongkrong"
Kopi Studio 24 Panglima Sudirman,Shinta Ayu Dewi,5,"tempatnya yang bagus, menunya enak semua"
Kopi Studio 24 Panglima Sudirman,Diva Miftahul Jannah,5,"pelayanannya ramah
tempat bersih
ada ruangan ber ac cocok untuk wfc"
Kopi Studio 24 Panglima Sudirman,intanputri maharani,5,"Tempatnyaa bersih bgt, kasirnyaa ramah, pelayanannya cepatt bgttt"
Kopi Studio 24 Panglima Sudirman,Sompeel Coffee,5,Tempat nyaman dan pelayanan Ramah
Kopi Studio 24 Panglima Sudirman,Aura Salsabila,5,"tempatnya enak, pelayanannya baik. top!"
Kopi Studio 24 Panglima Sudirman,Andita Kumalasari,5,Tempat nya nyaman. Bersih . Oke
Kopi Studio 24 Panglima Sudirman,Nnda diah,5,"Pelayanannya ramah , tempatnya bersihh"
Kopi Studio 24 Panglima Sudirman,Sabila Sheha,5,Kopstud paling nyamanan siihh menurutku😍😍 kopsus d cream nyaa the besssttt😍😍😍😍🤪🤪
Kopi Studio 24 Panglima Sudirman,Yuli Siva,5,"Pelayanan super ramah, cepat dan tanggap
Kopinya juga worth it"
Kopi Studio 24 Panglima Sudirman,Nafisa Meitinho,5,"tempat nyaman, kakanya ramahhhhh lovvv"
Kopi Studio 24 Panglima Sudirman,Nozan Tya,5,"Tetap jaga ramah, kualitas makanan minuman, dan kebersihan yaa kakk. Terimakasih"
Kopi Studio 24 Panglima Sudirman,kodok zuma,5,Tempat baguss dan bersih cocok buat ngerjain tugas dan pelayanannya ramah
Kopi Studio 24 Panglima Sudirman,pratista rahmaaa,5,"pelayan baik, harga murah, rasa okee👍🏻👍🏻👍🏻"
Kopi Studio 24 Panglima Sudirman,Han Zs,5,"Suasana nyaman buat nugas kuliah, makan dan minuman meskipun murah enak banget, recommended banget lah intinya"
Kopi Studio 24 Panglima Sudirman,Elsa Dwi Rhenata,5,"Harga di kopi studio memang murah, kualitas rasa enak, tempatnya sih nyaman karna ada sofa juga di lt 2."
Kopi Studio 24 Panglima Sudirman,Hibatul Aziz Lutfian,5,"Enak rasaya , tempat nyaman, pelayanan bertangung jawab untuk segalanta, dan wifi lancar"
Kopi Studio 24 Panglima Sudirman,Mc Huwayu,3,"Meja kecil2 cukup berdua saja.
Suasana biasa saja , dekor tidak ada.
Untuk area merokok dan tidak blm ada tanpa warning sekat mana wajib tanpa rokok.
Krn ada meja outdoor juga.
Untuk makanan cukup enak untuk ke panco nya.
Dan harganya yg sangat istimewa murah meriah."
Kopi Studio 24 Panglima Sudirman,nia nadiatus,5,pelayanan ramah sekali minumannya oke cepat penyajiannya rekomendasi pollll sihhhhhhhhh
Kopi Studio 24 Panglima Sudirman,karimatul chikmah,5,"Pelayananya ramah banget, minumannya oke,cepatt penyajiannya, rekomendasi poll sih🥰😍"
Kopi Studio 24 Panglima Sudirman,Revan Gaming,5,pelayanannya cepat dan kasir ramah dan murah senyum
Kopi Studio 24 Panglima Sudirman,Muhammad Nazran Isany,5,Makanan nya enak layanan ramah
Kopi Studio 24 Panglima Sudirman,Puput Moejia,5,Tempatnya cozy … menunya enak2 harganya affordable
Kopi Studio 24 Panglima Sudirman,Shellia herni,5,"Pelayanannya ramah tempatnya oke,, pokoknya recommended bng buat kaliann"
Kopi Studio 24 Panglima Sudirman,resita nursafitri,5,"Minuman murah dan enak, tempat nyaman dan pelayanan ramah"
Kopi Studio 24 Panglima Sudirman,Margaretha Fransiska Carolin Oinori,5,"aesthetic banget, karyawan ramah dan grecep, pesanan sesuai rasa enak dan pas di kantonh"
Kopi Studio 24 Panglima Sudirman,Pendik Ayam,5,Tempatnya nyaman dan pelayanannys cepat
Kopi Studio 24 Panglima Sudirman,Aura Griselda,5,murah dan enak 🙌 goodjob 👍🏼semoga makin rame
Kopi Studio 24 Panglima Sudirman,Muhammad Naufal Raihan Zaky,5,"Tempatnya masih baru, lokasinya berada di sebelah buchi kids"
Kopi Studio 24 Panglima Sudirman,Fifi Antika Sari,5,"Tempat bersih, pelayanan ramah"
Kopi Studio 24 Panglima Sudirman,Nanda Dwi rizky Habibillah,5,"Pelayanan ramahh, tempatnya nyaman, dan makannanya enakk.. worth it!!"
Kopi Studio 24 Panglima Sudirman,Brilian Putri,5,tempatnya cozy dan pelayanannya ramah
Kopi Studio 24 Panglima Sudirman,24.Nailasalsabila Choiruddin,1,kecewa bngt pesen pancong chocho crunc dikit banget pdhl di store lainnya banyak😭
Kopi Studio 24 Panglima Sudirman,Syafasyahrul Ramadhan,5,Pelayanan ramah murah enak tempat nya nyaman
Kopi Studio 24 Panglima Sudirman,syahrinaaa,5,"karyawannya ramah, menu nya juga ramah dikantong pelajar, tempat nya cocok buat nugas🤙🏻"
Kopi Studio 24 Panglima Sudirman,Feri Anotd,5,"Pelayanan ramah, tempatnya nyaman dan enak buat ngerjain tugas dan nongkrong. Sipp bgtt pokoknya"
Kopi Studio 24 Panglima Sudirman,armareta berliana,5,"Harganya murah, ada buy 1 get 1👍🏻👍🏻👍🏻"
Kopi Studio 24 Panglima Sudirman,Leny Latifa,5,"pelayanan ramah, cepat, wifi kenceng, ambience nyaman"
Kopi Studio 24 Panglima Sudirman,P17310224106 FAUZIAH AZAHIR,5,"Karyawannya ramah, harganya worth it buat pelajar👍"
Kopi Studio 24 Panglima Sudirman,Anisa Munifatun Nabillah,5,"Tempat nyaman banget buat nugas, pelayanan nya baguss, harganyaa sangat worth it🙏🏻"
Kopi Studio 24 Panglima Sudirman,erna wati,5,tempat nya enakk pelayanan oke harga juga murah makanan minuman enak
Kopi Studio 24 Panglima Sudirman,Elsa manora,5,Makanannya enak
Kopi Studio 24 Panglima Sudirman,annasya hasna,5,"cabang baru lebih deket sama rumahh, bisa kesini wfc tiap harii👍🏼👍🏼 nice"
Kopi Studio 24 Panglima Sudirman,Realme Argi,5,"Temptnya nyaman, kasirnya juga ramah"
Kopi Studio 24 Panglima Sudirman,Aska rafasa Rafasa,5,Tempatnya nyaman dan bersih pelayanan baik
Kopi Studio 24 Panglima Sudirman,Aura Griselda,5,tempatnya nyaman banget buat nugas 🙌
Kopi Studio 24 Panglima Sudirman,putu Eka,5,"Suasanya nyaman , tempat bersih , pelayanannya bagus dan ramah"
Kopi Studio 24 Panglima Sudirman,sabilla syafira,5,"tempatnya bersih dan nyaman, harga makanannya mahasiswa friendly, pelayanannyaa jugaa super baiik dan ramah🙌"
Kopi Studio 24 Panglima Sudirman,chelsea setyawan,5,pelayananyaa ramah harga pelajar
Kopi Studio 24 Panglima Sudirman,nurul maullana,5,"mantep poll , tempat baru tapi mantepp pelayanannya"
Kopi Studio 24 Panglima Sudirman,Anggun Dwi,5,"pelayanan bagus,minuman dan makanannya enak enakk,bersih"
Kopi Studio 24 Panglima Sudirman,Adela Jasinka,5,"pegawainya ramah, menunya enak enak, tempatnya nyaman buat nugas"
Kopi Studio 24 Panglima Sudirman,Manajer Top Eleven,5,Pelayanan cepat ramah suasana menyenangkan
Kopi Studio 24 Panglima Sudirman,Rima Pusparani,5,"Kalo butuh jajanan murah meriah ramah kantong, kesini ajaaa..."
Kopi Studio 24 Panglima Sudirman,Firda Annisa,5,"tempatnya nyaman, pancongnya enak"
Kopi Studio 24 Panglima Sudirman,Eka agustiningtias,5,"Tempatnya bersih,pelayananya ramah"
Kopi Studio 24 Panglima Sudirman,Anggraini Fatmasari,5,"tempatnya nyaman , pelayanan ramah dan cepat , harga terjangka"
Kopi Studio 24 Panglima Sudirman,Kholidi El,5,Sangat bersih tempatnya dan menarik konsepnua
Kopi Studio 24 Panglima Sudirman,Andera Afra,5,"tempatnya nyaman buat nugas, pelayanan baikk"
Kopi Studio 24 Panglima Sudirman,Henny Denandra,5,"Pelayanan yang baik,ramah,cepat & tempat nyaman...🥰🥰"
Kopi Studio 24 Panglima Sudirman,Arga Satria Vasudeva,5,udah pernah kesini tempatnya bagus dan nyaman
Kopi Studio 24 Panglima Sudirman,locatara m.s,5,pelayanannya ramah & tempatnya comfyy 😻😻
Kopi Studio 24 Panglima Sudirman,Besty Cintara,5,"Tempat nya nyaman dan strategi, pelayanan juga cepat dan kasir ramah."
Kopi Studio 24 Panglima Sudirman,Elvira Sandra,5,"Rekomendasi minuman yang enak, pelayanan yang ramah, tempat yang nyaman, dan harga yang terjangkau (kantong pelajar)"
Kopi Studio 24 Panglima Sudirman,Devanda Afrylio,5,"Tempat sejuk, bersih, cocok untuk kerja."
Kopi Studio 24 Panglima Sudirman,Novianda Fitriannisa,5,"sangat nyaman tempatnya buat nongki dan nugas, worth it bgtttt"
Kopi Studio 24 Panglima Sudirman,zabrina verda,5,"Makanannya enak, ramah dikantong pelajar, cocok buat nugas"
Kopi Studio 24 Panglima Sudirman,Ridhoomahvisual,5,"Emm panas2 gini paling enak ngadem sama nikmatin varian es dari kopstud paling tertuju sama d'creammnyaa,😋😋😋"
Kopi Studio 24 Panglima Sudirman,Mahda FT,5,Mantap jos jiss
Kopi Studio 24 Panglima Sudirman,Intan Ps,5,pelayanan ramah dan tempatnya bersih
Kopi Studio 24 Panglima Sudirman,ahmad raynan favian aziz,5,"Enak tempatnya, makanannya juga lumayan enak dan murah jadi worth it buat nongkrong"
Kopi Studio 24 Panglima Sudirman,Hadid Ibrah Hamdi,5,"Pelayanan mantap, cozy, tempat bersih"
Kopi Studio 24 Panglima Sudirman,Muhammad raffly nur r,5,"Suasana bagus nyaman, karyawan ramah"""
Kopi Studio 24 Panglima Sudirman,yuli dan dodit,5,"tempatnya nyaman,, pelayanan ramah,,
wajib mampir kesini,,,"
Kopi Studio 24 Panglima Sudirman,Muhammad Nur Aqila Fadhil Pratama,5,"Di sini enak nyama dan sejuk , makanan dan minuman nya di sini enak 👍 …"
Kopi Studio 24 Panglima Sudirman,Dinda Aisah,5,"Tempatnya bersih, pelayanan bagus"
Kopi Studio 24 Panglima Sudirman,Wridyang bagus Misgiantoro,5,"Tempat strategis, mantap buat nugas, nongkrong,"
Kopi Studio 24 Panglima Sudirman,Anisa Nadia,5,"Tempatnyaa nyamannn, makanannya murah dan cocok bangett buat nugaass"
Kopi Studio 24 Panglima Sudirman,manusia,5,enak banget pelayanan ramah cepat dan wifi kenceng
Kopi Studio 24 Panglima Sudirman,Chelsa Regxyo,5,"tempatnya nyaman , bersih dan makanannya enak pelayanannya ramah"
Kopi Studio 24 Panglima Sudirman,azizah,5,"Tempat bersih, sampah langsung dibuang, mbaknya ramah dan sat set. Banyak colokan AC dingin, ada tempat sholat, WC bersih, bikin makanannya cepet"
Kopi Studio 24 Panglima Sudirman,Shelly Sabella _BWKS,5,"tempatnya bersih, nyaman, pelayanannya jugaaa bagussss"
Kopi Studio 24 Panglima Sudirman,Nafila Zahro,5,"tempat nya nyaman enak bersih juga
untuk pelayanan nya bener"" ramah semua + untuk kasir nya baikk full senyum"
Kopi Studio 24 Panglima Sudirman,Rizky Putra Pratama,5,Tempatnya enak
Kopi Studio 24 Panglima Sudirman,iis azahra,5,"Harga murah , pelayanan bagus , banyakin promo biar sering2 ngopi di sini"
Kopi Studio 24 Panglima Sudirman,Chesta Nahda,5,"Tempat bagus dan pelayanan ramah, menu² juga cepet readynya👍🏻👍🏻"
Kopi Studio 24 Panglima Sudirman,Ridho Yudagani,5,"Paling suka menu D'Creame , selalu dan selalu menjadi favorit ketika ngopi di kopi studio😁😋"
Kopi Studio 24 Panglima Sudirman,gazta dkvgrf,5,"saya adalah langganan dan pecinta kopi studio, saya sering datang kesana, mulai dari cabang sukun, suhat, sawojajar, sulfat, sarangan, dan rampal. tapi yang paling bagus dari semua itu tadi adalah kopi studio cabang rampal, karena disana tempatnya luas dan banyak, lalu banyak meja dan kursi yang besar cocok buat 4 orang permeja, ac pas dinginnya, wifi lancar download apapun cepet, kamar mandi luas dan bersih kurang cermin aja sih, parkiran luas gak usah bingung mobil/motor, colokan banyak tiap meja ada colokan, ada juga meja kursi buat balita yang safety, dan disini juga gak rame banget gak sepi banget gak berisik gak ada yang putar lagu karena takut kena royalty sepertinya wkwk. tempatnya bersih minesnya 1 sih banyak sampah di meja bekas makan minum yang telat bersihin, sarannya tiap 30 menit  di cek ruangganya apakah ada yang perlu di bersihkan atau tidak? kalo makanan dan minuman standart ya.. kaya pop ice lah minumannya tapi lebih enak paling 6/10 miripnya layanan jg cepet dan kasirnya ramah.. yang saya suka dari kopstud ini ada 3 1. 24 jam jadi aku bisa kerjain tugas sekolah gak bingung kapan tutupnya nih cafe. yang ke 2 tempatnya nyaman dan bersih dan ke 3 murah"
Kopi Studio 24 Panglima Sudirman,Mohammad Iqbal Wahyu Septifana,5,Tempatnya enak buat nongkrong
Kopi Studio 24 Panglima Sudirman,M. Luthfi Musthofa,5,Tempat nya nyaman enak buat nugas
Kopi Studio 24 Panglima Sudirman,Nabila Naya Nirwasita,5,"Kopi studio terdekat dirumah, pelayanan baik, enak banget pokonya rekomen😁👍"
Kopi Studio 24 Panglima Sudirman,apaci ipacu,5,"Enak banget, tempatnya juga okeee pelayanannya jga ramah"
Kopi Studio 24 Panglima Sudirman,Rendy aditya Pratama,5,Layanan nya ramah makanan sama minuman nya murah sama enak²
Kopi Studio 24 Panglima Sudirman,Anisa nur azizah,5,"Suasana nyaman poll, kopi enak, cocok buat santai atau kerja bareng teman."
Kopi Studio 24 Panglima Sudirman,liliss,5,"tempatnya bersih, rapi baik indoor maupun outdoor jadi cocok buat ngerjain tugass. pelayanannya ramah, harganya juga pas dikantong pelajar, fasilitas juga lengkapp"
Kopi Studio 24 Panglima Sudirman,Citra Diahayu,5,Enak banget deh ngopi disini sambil ngerjain tugas sekolah suasanya juga enak banget
Kopi Studio 24 Panglima Sudirman,veronikaaa ptrym1303,5,"sangat nyaman dan pelayanan nya sangat baik, makanan nya jugaa enak"
Kopi Studio 24 Panglima Sudirman,Suga BooBoo'ᄉ',5,"Pelayanan sangat bagus dan ramah, harga juga sangat terjangkau sekali🤩💖💖💖"
Kopi Studio 24 Panglima Sudirman,Arinda Putri Dewi,5,"Pelayanannya sangat ramah, suasananya enak di buat nongki, dan harganya ramah di kantong 😁"
Kopi Studio 24 Panglima Sudirman,Hesty Ap,5,"pancongnya enak banget, barista atas nama bela gacorr bgt klo buat pancong😤💓💓"
Kopi Studio 24 Panglima Sudirman,Helmi Cemi,5,Tempat nyaman dan pelayanan ramah
Kopi Studio 24 Panglima Sudirman,Sherly Pratama,5,"pelayanannyaa okeee bgtt, sangat amat rekomenn"
Kopi Studio 24 Panglima Sudirman,Amien Hokya Hokya,5,Pelayananya ramah tempatnya luas bersih
Kopi Studio 24 Panglima Sudirman,Siftia Chatarina,5,Tempat nya enak buat ngopi stategis dengan pusat kota rekomendasi buat yang suka ngopi dengan harga yang terjangkau
Kopi Studio 24 Panglima Sudirman,P17451221004 RIZKY PUTRA PRATAMA,5,Tempatnya baru buka. Terbilang tidak ramai sehingga tenang dan nyaman untuk nugas. Cocok menjadi opsi dikala kopstud lainnya ramai
Kopi Studio 24 Panglima Sudirman,Corina Cornelia,5,"Tempat nya bersih,pelayanan mudah di mengerti"
Kopi Studio 24 Panglima Sudirman,Isti Lailatul,5,Kakak²nya ramah² cekaliiii dan tempatnya bersih pancong dan kopinya sangattt recomenddddd
Kopi Studio 24 Panglima Sudirman,suci ati,5,"tempatnya lebih nyaman, pelayanannya ramah"
Kopi Studio 24 Panglima Sudirman,Firda Amelia,5,"tempat cozy makanan sama minuman enak, rekomen deh"
Kopi Studio 24 Panglima Sudirman,Satrio Al Aziz,5,"tempat nyaman,bersih,harga okee,nice lah"
Kopi Studio 24 Panglima Sudirman,Syafira Ayu S,5,"haega makanan dan minumannya sangat terjangkau, tempatnya nyaman dan bersih, pelayanannya super baik dan ramah🙌🏻"
Kopi Studio 24 Panglima Sudirman,Rayhan Ardhani,5,"Tempatnya nyaman, harganya bersahabat, cocok buat temen2 kuliah"
Kopi Studio 24 Panglima Sudirman,EROS EROS,5,"tempatnya strategis, vibes asik, harga bersahabat, recommend buat nongkrong..."
Kopi Studio 24 Panglima Sudirman,indah sulistiyowati,5,"Rasa minumannya enak dan berasa.. langganan anak² beli minuman disini krn bs buy one get one juga dan tempatnya nyaman, pelayanan nya ramah"
Kopi Studio 24 Panglima Sudirman,Someone you loved,5,"sering banget mampir buat sekedar beli minum
enak bngtttt mana murah lagi"
Kopi Studio 24 Panglima Sudirman,febrian Permana,5,tempatnya sangat nyaman dan bersih pokoknya mantapp dehh
Kopi Studio 24 Panglima Sudirman,Sinta Permata Susanto,5,"Makanan dan minuman nya endul dan harga nya sanganmt bersahabat dikantong ibu rmh tangga 😍😜
Enk tempat nya bersih nyaman"
Kopi Studio 24 Panglima Sudirman,Catur Ageng,5,Pelayanan cepat dan masnya ramah
Kopi Studio 24 Panglima Sudirman,Khalilah Nafisah,5,Pelayanan mantap
Kopi Studio 24 Panglima Sudirman,Nur Anisa Indriani 229,5,"Lokasi sangat strategis di keramaian kota, makanan sangat enak dan murmer sekali~^^♡♡♡"
Kopi Studio 24 Panglima Sudirman,Vesmanda Lifa,5,"Tempatnya sngt nyaman, menunya juga enak"" favrite semua"
Kopi Studio 24 Panglima Sudirman,Lucki Firmansyah,5,tempatnya rekomen harganya murah
Kopi Studio 24 Panglima Sudirman,xilada group,5,Tempat Mantap dan Bersih makanan nyaa enak recomend bangett..
Kopi Studio 24 Panglima Sudirman,Ariska Mayang,5,"Enak banget kopi nya, pelayanan ramah, dan selalu di hati"
Kopi Studio 24 Panglima Sudirman,Aku Ini,5,"Makanannya enak, saya suka sekali kesana"
Kopi Studio 24 Panglima Sudirman,Maulaiqbal 123,5,"Tempat nya strategis, mudah dijangkau buat orang yang tiba tiba pengen ngopi"
Kopi Studio 24 Panglima Sudirman,Puhdidi Yt,5,"perlu ditingkatkan sop meraciknya terutama dcream rasanya selalu berubah-rubah
Saya sudah langganan kopistudio sejak lama,sayangnya untuk menu d cream sering kali rasanya aneh.terkadang cuman terasa manis,kadang terasa pahit tidak ada rasa creamynya malah terasa sepeti coldbrew.sebenarnya enggan memberi penilaian.Dari semua cabang yang pernah saya order hanya dicabang sulfat yang selalu konsisten.kota lama,sukun,sering mengecewakan rasanya.akhir2 ini panglima sudirman juga rasanya aneh.dalam 1 minggu ini saya sudah beli 4x online maupun offline tapi rasanya gak karuan.creamy dan manisnya sering kali hilang dari rasa.dibandingkan dengan kopi lain sekelas starbuck saya lebih suka menu d cream.maka dari itu tolong konsisten😭"
Kopi Studio 24 Panglima Sudirman,Anita Kharisma,5,mba nya informatif baik makanan minuman murah meriah mantap🥲👍🏻
Kopi Studio 24 Panglima Sudirman,fahira nova,5,"pelayanan ramah, menawarkan pilihan lain lainnya"
Kopi Studio 24 Panglima Sudirman,Kahfita Maulidyah,5,"Pelayanan bagus , tempatya bersih"
Kopi Studio 24 Panglima Sudirman,Sugini,5,"Tempatnya bagus , recomended untuk nongkrong sma temen , dan pelayanan nya ramah² 🫶🫶"
Kopi Studio 24 Panglima Sudirman,Nayswaapta Audina,5,Tempatnya nyaman
Kopi Studio 24 Panglima Sudirman,you young,5,"enakk bangettt disini cozy banget apalagi lantai 2 , makanan nya juga murce murce. paling suka cireng bumbu rujak + sama kopi susu dcream beuhh nikmat manalagi yang kita skip yakan. buat nugas buat nongkrong tetep enak"
Kopi Studio 24 Panglima Sudirman,lokadump,5,"pelayanannya ramah, gercep & sesuai dengan pesanan 🥇🤍"
Kopi Studio 24 Panglima Sudirman,Ahmad Jayadi,5,"tempatnya bersih, pelayanannya ramah, cocok untuk ngopi santai"
Kopi Studio 24 Panglima Sudirman,Hamzah,5,Tempatnya nyaman dan enak
Kopi Studio 24 Panglima Sudirman,15_Fathir Akhdan Musyafa,5,"pelayanannya sangat baik dan ramah, serta penyajiannya cepat. sangat recomennded"
Kopi Studio 24 Panglima Sudirman,sofiah firotul,5,bagus bersuh dan pelayanan nya ramah
Kopi Studio 24 Panglima Sudirman,11_Daniel Yudi Kristanto,5,Mantap pelayanan bagus
Kopi Studio 24 Panglima Sudirman,NADIA ZAHRA ASADRINA,5,"sangat nyaman dan bersih, kakaknya ramah sekali 🤩🫰"
Kopi Studio 24 Panglima Sudirman,Okta Dylan,5,Mantap pokoknyaa
Kopi Studio 24 Panglima Sudirman,Franaia Farellyan,5,pelayanan baik tempat nyaman
Kopi Studio 24 Panglima Sudirman,Ine Irine,5,Tempat bagus banget enak cocok bersih
Kopi Studio 24 Panglima Sudirman,Iben Ahmad,5,"Harga terjangkau,, kasir ramah bngt,, ada ruang AC jg,, rekomendasi buat yg mau mampir"
Kopi Studio 24 Panglima Sudirman,Titik Okti Amala,5,Tempatnya enak dan pelayanannya mantap
Kopi Studio 24 Panglima Sudirman,ratna putri,5,Recommended.. kopinya enak ☺️
Kopi Studio 24 Panglima Sudirman,Nadia Vega,5,mas nya baik pelayanan ramah+++ harga murah
Kopi Studio 24 Panglima Sudirman,ira setiawan,5,"Tempat nya enak luas dan berdih, pelayanan ok, minuman enak hrg bersahabat"
Kopi Studio 24 Panglima Sudirman,Maula Iqbal Alfaiz,5,Tempat nya sangat nyaman buat nyantai
Kopi Studio 24 Panglima Sudirman,chelsea setyawan266,5,pelayanan nya ramah harga pelajar rekomended bannget😍 …
Kopi Studio 24 Panglima Sudirman,icahyaaa9,5,"tempatnya bersih, pelayanannya baik, americano nyaa enakkk recomended bgtt🫶🏼"
Kopi Studio 24 Panglima Sudirman,BOB_ Screen Printing Supplies,5,Tempatnya enak dan nyaman 😍
Kopi Studio 24 Panglima Sudirman,Sido ora,5,"Tempat sangat recommend, cocok buat mahasiswa"
Kopi Studio 24 Panglima Sudirman,Tirta Praptojaya,5,"Pengalaman yang luar biasa di Kopi Studio 24! 🍽️☕ Makanan sangat lezat dengan cita rasa yang khas, dan pelayanannya pun ramah serta cepat. Suasana tempatnya nyaman dan cocok untuk nongkrong atau kerja santai. Sangat direkomendasikan, pasti akan kembali lagi😘"
Kopi Studio 24 Panglima Sudirman,rasyid,5,"tempatnya bersi, minumannya enak"
Kopi Studio 24 Panglima Sudirman,santa berta maharani,5,"Tempatnya nyaman buat nongki, rasa kopinya enak,, cirengnya juga mantap.."
Kopi Studio 24 Panglima Sudirman,Satya Langlang,5,"Tempatnya nyaman, pelayanan juga oke"
Kopi Studio 24 Panglima Sudirman,rexx vienn,5,tempatnya nyaman dan murah
Kopi Studio 24 Panglima Sudirman,Djihan Permata Ramadhani,5,"tempatnya nyaman bersih, makanannya enak"
Kopi Studio 24 Panglima Sudirman,luna ayu,5,tempat nyaman pelayanan ramah
Kopi Studio 24 Panglima Sudirman,Gadis Kirania,5,"Tempat nongkrong yg asyik
Harga sangat aman di kantong
Makanan minuman nya enak banget"
Kopi Studio 24 Panglima Sudirman,Ainurrohma Widiyanti,5,Enak buat nugas & strategis
Kopi Studio 24 Panglima Sudirman,Khusnul Musyayaroh,5,makanan enak harga terjangkau tempat nyaaaman karyawan ramah thank you
Kopi Studio 24 Panglima Sudirman,Angelia Rahmadhani,5,"tempat nyaman, harga murah, enak dibuat wfc"
Kopi Studio 24 Panglima Sudirman,Ridho Putro Yonatha,5,Pelayanannya sangat ramah dan cepat. Makanan dan minuman yang disajikan juga enak
Kopi Studio 24 Panglima Sudirman,Erwind Burger,5,Harga nya murah makanan nya enak pelayanan nya juga ramah bangettt
Kopi Studio 24 Panglima Sudirman,J_Melina Indira Paramita_,5,"harganya murah, minuman sama makanannya juga enak"
Kopi Studio 24 Panglima Sudirman,dhista pertama,5,"pelayanan nya bestt bangett, luveeee!!!"
