nama_tempat,username,rating,review
KOPI STUDIO 24 SARANGAN,Alfa Nyy,5,"tempatnya nyaman, bersih, pelayanan cepat, suasanya enak buat nugas maupun nongkrong"
KOPI STUDIO 24 SARANGAN,Tino Anggara,5,"Tempat nyaman dan bagus, rekomen untuk belajar atau sekedar nongkrong"
KOPI STUDIO 24 SARANGAN,Shahrul Rossi,5,"Tempatnya Cozy banget
Ini tuh vibes beda banget ya kayak biasanya
Buat nugas meeting kecil cocok banget tempat nya
Dan like usual makanan dan minuman nya tetep okee dong🚀🚀"
KOPI STUDIO 24 SARANGAN,widiya hera,5,"Tempat nya nyamann, makanannya jugaa worth it buat kantong mahasiswaa. Staff nya ramahh2😍"
KOPI STUDIO 24 SARANGAN,Dwi ani Risnawati,5,"Tempatnya nyaman banget. Kopinya enak, pelayanan ramah, dan cocok buat nongkrong santai bareng teman. Pokoknya wajib mampir ☕🌿"
KOPI STUDIO 24 SARANGAN,Khofi Ubaydillah,5,"Nyaman banget nugas di sini, tempatnya bervariasi dan estetik"
KOPI STUDIO 24 SARANGAN,kieza aliyyah,5,"tempatnya lumayan pewe sih, terus makanannya juga murah dann rasanya enakk, cuman mungkin antar meja jaraknya mepet yah jadinya yang bukan perokok keganggu banget sama asap rokoknya hehe😁🙏🏻"
KOPI STUDIO 24 SARANGAN,Restu Chandra,5,suasananya oke. bisa buat ngumpul bareng temen yang 4 orang an atau sekedar nugas sendirian. tempat duduk tersedia banyak dan ada pilihannya mau di indor atau outdoor. overall okee banget buat nugas ataupun sekedar ngobrol bareng temen temen
KOPI STUDIO 24 SARANGAN,Dewi Nur Azizah,5,Tempatnya nyaman dan pelayanan baguss puolllll. Rekomen bangettttt
KOPI STUDIO 24 SARANGAN,Aulia Ilmi,5,"tempatnya nyaman banget buat nugas karena tersedia banyak colokan, makanan sama minumannya juga enak2+banyak promo buy 1 get 1 nya. untuk parkirannya juga luas banget dan tersedia musholla yang bersih. disini juga ada area indoor dan outdoor yang luas. rekomennnn bangettttt"
KOPI STUDIO 24 SARANGAN,Adelia Ramadhani,5,"Tempatnya cozy buat nugas, ada mushollanya juga jadi gampang buat sholatnya"
KOPI STUDIO 24 SARANGAN,Iffatul Izza M,5,Enak banget tempatnya nyaman pol.
KOPI STUDIO 24 SARANGAN,PUTRI NAJMA ZAHIRO,5,"tempatnya jyaman, pelayanannya bagus"
KOPI STUDIO 24 SARANGAN,Yukimura Yuu,5,"Udah langganan disini. Murah dan enak semuaa, selalu rame 🫵🏻😭💗"
KOPI STUDIO 24 SARANGAN,Rizza P,5,"suasananya sangat pw nyaman, enak buat nugas, banyak colokan tiap meja, banyak kursi juga🤩🤩"
KOPI STUDIO 24 SARANGAN,Naufal Numuda,5,Cocok buat nugas dan harganya cocok banget di kantong mahasiswa rekomen banget
KOPI STUDIO 24 SARANGAN,Faradilla Grandisa,5,Pelayanan bagus makanan minuman enak dan murah
KOPI STUDIO 24 SARANGAN,Helen Aldiase,5,"Harga nya murah, kasirnya ramah, tempatnya bagus"
KOPI STUDIO 24 SARANGAN,Ahmad Kurniawan Sendy,1,"makanan enak,tempatnya lumayan cuma pelayanannya lama banget pesenan datang satu jam setelah nunggu dan ada yang dapet duluan padahal aku yang dateng duluan kalau misalnya makanan blm selesai mending minumannya di keluarin duluan biar ga nunggu lama"
KOPI STUDIO 24 SARANGAN,Hoopicot,5,"vibesnya cozy, pelayanannya ramah, minumannya selalu enakk"
KOPI STUDIO 24 SARANGAN,Muhammad Rifqi Al Muiz,5,"tempatnya enak buat nugas, nyaman dan ga berisik juga. harga makanan murah poll!"
KOPI STUDIO 24 SARANGAN,M. Iqbal Fatony,5,nyaman banget buat nugas sama nongkrong disini. harga murah dan anak kos friendly sihh
KOPI STUDIO 24 SARANGAN,LUSI HASANAH,5,"tempatnya bersih luas enak banget buat nongki sama temen temen, makan minum murah meriah pelayanan cepet ramas mba mba nya, recommended poll"
KOPI STUDIO 24 SARANGAN,mukhamad_akbar _setya budi,5,"tempat nya nyaman, dan bagus serta pelayanan bagus"
KOPI STUDIO 24 SARANGAN,Lia Melia,5,"Tempatnya nyaman dan bersih, mas dan mbak nya ramah top deh buat wfc di akhir bulan heheh"
KOPI STUDIO 24 SARANGAN,taufik salahudin,5,Untuk harga sangat worth it tempat nya nyaman juga buat kerja nongkrong nugas . Deket juga dari rumah :) untuk kamar mandi bisa lebih di perhatikan lagi untuk kebersihan nya . Untuk keseluruhan masih wort it dari segi harga dan tempat juga
KOPI STUDIO 24 SARANGAN,welly,5,"tempatt nyamann asik buat nongkrong orang banyak, bersih, harga terjangkauu lopp bangett"
KOPI STUDIO 24 SARANGAN,Azmil Rahmania,5,"Menunya enak ,tempat strategis,sampai sering gk kebagian tempat😅🤣terlalu recomended soalnya"
KOPI STUDIO 24 SARANGAN,Hans Felix T,5,"Makanan sangat murah tapi ga murahan, layanannya lumayan oke dan suasana juga bagus mungkin krn tempatnya kecil jadi terbatas areanya"
KOPI STUDIO 24 SARANGAN,fafa diaryy,5,"Coffeeshop ini punya menu unik yang jarang ada di tempat lain. Kue pancongnya enak banget, hangat, lembut di dalam dan gurih manis dari kelapa. Avocado chocolate-nya juga juara, creamy alpukat berpadu pas dengan cokelat yang rich, segar dan mengenyangkan. Tempatnya nyaman buat nongkrong maupun kerja, staff ramah dan pelayanan cepat. Recommended!"
KOPI STUDIO 24 SARANGAN,Merah Hitam,5,"Tempatnya nyaman dan bersih sangat cocok untuk menemani skripsi mahasiswa akhir, menu menu makanannya juga worth it dan enak untuk dibeli, mungkin bisa ditambah lagi luas nya untuk indoor ehehehehhe"
KOPI STUDIO 24 SARANGAN,Syifaul Huda,5,Pelayanan mantap dan ramah minuman enak2 dengan harga terjangkau
KOPI STUDIO 24 SARANGAN,1A K3_AGUSTIN DWI YANTI,5,suka banget nugas disini. tempatnya ga luas tapi banyak tempat duduknya di indoor maupun outdoor. karena 24 jam jadi lebih lega nugasnya tanpa mikir jam. makanannya juga affordable untuk mahasiswa tapi rasanya enak enak
KOPI STUDIO 24 SARANGAN,Era Wardani,5,Tiap weekday pasti nongki disini sambil nungguin anakku yg sekolah di seberangnya.
KOPI STUDIO 24 SARANGAN,khusus proker pr 24,5,"Tempatnya enak bangetttt
Apa lagi sundae nya mantapp dan pancongnya

Nuansa baru kopstud yang biasanya aku samperin"
KOPI STUDIO 24 SARANGAN,Nafa Cntkk,5,"Pelayanan nya baik , tempat bersih dan harga juga ramah dikantong"
KOPI STUDIO 24 SARANGAN,Aisyah Dyanti,5,"the places good, comfy. cocok buat nongkrong dan wfc, recommend🩷🩷 …"
KOPI STUDIO 24 SARANGAN,Anna Second princess,5,Harga sangat bersahabat dengan kualitas minuman dan makanan yg enak. Aku suka banget sama es cookies and creamnya yang  smooth bgt. Mantap untuk jadi tempat nongkrong rutin.
KOPI STUDIO 24 SARANGAN,Munawaroh Mun,5,"Tempat sangat cocok untuk mengerjakan tugas, tidak panaas, ada musholla yang memadai, dan toilet yang bersih"
KOPI STUDIO 24 SARANGAN,Caroline Angelita,5,"Suasana nyaman, bersih, cocok untuk nugas, untuk kentang baladonya enak, dan untuk minumannya enaknya pas"
KOPI STUDIO 24 SARANGAN,nabilla zilda baynifsi,5,"tempatnya nyaman banget, makanannya enak + murah juga, sukaaa bangettttttt"
KOPI STUDIO 24 SARANGAN,Margaretha andela Sukamto,5,"tempat nya nyaman buat nongki, nugas,dll..
bersih dan adem banget, makanannya whort it bgtt dan pelayannya juga oke"
KOPI STUDIO 24 SARANGAN,SIRILUS ANGGIE,5,"Tempat nya nyaman, pelayanan nya juga ramah,makan dan minum nya juga enak2"
KOPI STUDIO 24 SARANGAN,batos got talent,5,tempatnya nyaman dan pelayanannya baik
KOPI STUDIO 24 SARANGAN,Ajeng Putri Hardiyanti,5,"Tempatnya aestetik, pelayannya juga ramah, makanan enak dan harga hemat dikantong"
KOPI STUDIO 24 SARANGAN,Stefani Pudia,1,"dri awal udah bilang kalau kentang gak pakai garam tpi masih tetep pakai garam padahala buat anak kecil. karena kalau dikasih garam ngasih nya banyak banget kayak makan garam.

Sendok untuk pancong kata nya hbis seharus nya harus ada stock dong biar gak kehabisan. akhirnya dibawa pulang pancong nya

meja nya kotor ndak diberesin kalau ndak minta di beresin"
KOPI STUDIO 24 SARANGAN,09_anggi putri pramudita,5,"tempat nya enak, nyaman, harganya affordable, mantap deh"
KOPI STUDIO 24 SARANGAN,Rahayu Ayu,2,"Sebenernya kopstud ini tempatnya nyaman bgt dimana mana , tapi pertama kali disini kasirnya judes banget , ga ada senyumnya 😭😭😭 , padahal pakai baju hitam ya harusnya pegawai lama soalnya ada yg baju putih juga . Mungkin mbanya lagi pms huhu …"
KOPI STUDIO 24 SARANGAN,vera zulia,5,"tempatnyaa enak bangett buat nugass, selalu milih ke kopstud kalau nugas wkwkwk"
KOPI STUDIO 24 SARANGAN,putri abelia,5,"Tempatnya bersih, pelayanan cepat, makanan dan minuman enak"
KOPI STUDIO 24 SARANGAN,Rifaldy Afd,5,Tempat nyaman cocok untuk nugas dan harganya sangat terjangkau untuk mahasiswa
KOPI STUDIO 24 SARANGAN,Margaretha Andela,5,"makanan nya standar lah, murahh tpi rasa ga murahannn ENAK BGTT !! tempat nya ada outdor dan indor cocok bgt buat nongkrong bahkan nugas"
KOPI STUDIO 24 SARANGAN,Maxel Sebastian,5,"Tempatnya luas, parkiran aman, dan interiornya bikin rileks. Makanan ringan ky pancong dan gepreknya enak banget. Pelayanan jg cepat bangettt."
KOPI STUDIO 24 SARANGAN,Navida LA,5,Worth it banget.. Pelayanan juga oke.. Tempatnya sangat nyaman. Cocok banget buat nugas ataupun bersantai.. Sukses selalu buat kopi studio 👍
KOPI STUDIO 24 SARANGAN,maulia eka wulandari,5,Suasananya mantap… servisnya ramah bintang 5
KOPI STUDIO 24 SARANGAN,ezra Yonathan,5,"Tempatnya bagus, tapi tolong kalo ngopi di sini mejanya jangan di jadikan asbak kasihan petugasnya"
KOPI STUDIO 24 SARANGAN,Ulin nm,5,"super cozyyy!! mulai dr tempatnya, pelayanannya, dan menu2 nya 🥰"
KOPI STUDIO 24 SARANGAN,Nurul Nurul,5,makanannya enak dan pelayanannya ramah dan cepat
KOPI STUDIO 24 SARANGAN,Aamirah Dwi Anhari,5,"Tempat yang nyaman, bisa wfc disini. Makanan dan minumannya murah, ada buy 1 get 1 juga..
Ada musholla dan kamar mandi. Ada indoor dan outdoor."
KOPI STUDIO 24 SARANGAN,Prihastya Raehana,5,Besttt muraaah dan enakkk
KOPI STUDIO 24 SARANGAN,maxel silitonga,5,"cabang baru dengan dekorasi baru jugaa, kursi nya lebih beragam dan juga ada sofa di indoor untuk yang mau senderan tempatnya juga masih di daerah sekitar kota jadi lumayan gampang dijangkau"
KOPI STUDIO 24 SARANGAN,Faricha aisya Nurdiana,5,"tempatnya cozy bgt jujur, bersih, pelayanannya ramah, nyaman bgt buat nugas"
KOPI STUDIO 24 SARANGAN,Ellyndah Chalimatus,5,"suasana ruangan indor enak karena kursinya empuk, bikin betah disini 😍😍"
KOPI STUDIO 24 SARANGAN,Jastin Nugroho,5,Tempatnya nyaman dan enak serta harga terjangkau
KOPI STUDIO 24 SARANGAN,Gisel sabina,5,"makanan dan minuman masuk harga pelajar, tempat juga nyaman, cocok buat nugas"
KOPI STUDIO 24 SARANGAN,FAUZI ROMADON,5,wach g nyangka pertama kesini kaget liat harganya murah bgt. buy one get one
KOPI STUDIO 24 SARANGAN,Novirahma Hari Mulyani,5,"pelayanan ramah, minumanya enak dan harganya terjangkau"
KOPI STUDIO 24 SARANGAN,Fauziah Rahma,5,"Banyak menu pilihan yang enak dan seger, tempat tang nyaman ada ruang ac dan juga outdoor. Pelayanannya jugaa ramahh bangettt"
KOPI STUDIO 24 SARANGAN,adinda BASTARI,5,"pelayanan sangat ramah, kebersihan terjaga, suasana nyaman, dan rasa makanan minuman nya sangat enakk, wajib kesinii sii"
KOPI STUDIO 24 SARANGAN,Agas Ae,5,"Saya baru saja mengunjungi *KOPI STUDIO 24 SARANGAN*, sebuah tempat ngopi yang sangat cozy dan nyaman di pusat kota. Berikut pengalaman saya:

*Suasana*
Suasana di KOPI STUDIO 24 SARANGAN sangatlah hangat dan nyaman. Dekorasi yang minimalis namun elegan membuat saya merasa seperti berada di rumah sendiri. Musik yang diputar juga sangatlah santai dan sesuai dengan suasana.

*Menu*
Menu di KOPI STUDIO 24 SARANGAN sangatlah beragam, mulai dari kopi, teh, hingga makanan ringan. Saya memesan kopi cappuccino dan croissant, dan keduanya sangatlah lezat. Kopi yang disajikan sangatlah kental dan aromatik, sedangkan croissant yang disajikan sangatlah renyah dan lezat.

*Pelayanan*
Pelayanan sangatlah baik. Staf yang bekerja sangatlah ramah dan helpful, serta sangatlah sigap dalam melayani pelanggan.

*Harga*
Harga di sangatlah terjangkau. Harga kopi dan makanan ringan sangatlah kompetitif dengan tempat ngopi lainnya.

*Kesimpulan*
Saya sangatlah puas dengan pengalaman saya di Kopi Kita. Suasana yang nyaman, menu yang lezat, pelayanan yang baik, dan harga yang terjangkau membuat saya sangatlah merekomendasikan tempat ini kepada siapa saja yang mencari tempat ngopi yang baik.

*Nilai*
Saya memberikan nilai 5/5 untuk Kopi Kita.

*Rekomendasi*
Saya sangatlah merekomendasikan Kopi Kita kepada siapa saja yang mencari tempat ngopi yang baik."
KOPI STUDIO 24 SARANGAN,Pieces Of amel,5,Cabang baru dan konsep nya bagus bgt sih harga murah meriahhh tapi suasana kek di cafe elittt seperti biasa masih bertemu banyak mahasiswa tapi juga bisa buat berkeluarga banyak yang bawa anak kecil . Pelayanan ramah cepet pula saran kek nya bisa di tambah musik tipis tipis aja sih over all oke 🫶🏻
KOPI STUDIO 24 SARANGAN,Aditya Mauludin,5,"Tempatnya sangat nyaman dan luas, menunya jg banyak pilihan 👍"
KOPI STUDIO 24 SARANGAN,Anggi Putri Kinanti,5,"kopi nya enak, tempat nya enak buat nongkrong ataupun nugas, hargany kantong pelajar/mahasiswa"
KOPI STUDIO 24 SARANGAN,Ardi Tirtonurrohim,5,"makananya enak , mienya kmantap , kalo bisa yg ada kuahnya  tempatnya kalau malang sering full harus dulu duluan dengan customer lain hehe"
KOPI STUDIO 24 SARANGAN,Wira Fajar,5,"Tempatnya enak buat nugas, colokannya banyak, harganya murah"
KOPI STUDIO 24 SARANGAN,Jeon Cookie97,5,"makanan nya enak... murah, tempat nya nyaman"
KOPI STUDIO 24 SARANGAN,Nova Tri Amalia,4,Tempat baguss nymannn topp
KOPI STUDIO 24 SARANGAN,Yordan Maulana,5,"""Pengalaman ngopi yang luar biasa di Kopi Studio Sarangan! Suasana studio yang cozy dan instagramable membuatku betah berlama-lama. Kopi yang disajikan memiliki rasa yang sangat memuaskan,  Pelayanan staff juga sangat ramah dan responsif. Tempat ini cocok banget untuk nugas, meet up. Pokoknya, wajib coba!"""
KOPI STUDIO 24 SARANGAN,Luh Dewi Pratanggani,5,"Enak buat nugasss, tetep murah tempatnya lebih cozy bgt. Banyakin promonya ya pak anang 😍😍"
KOPI STUDIO 24 SARANGAN,Nanang Sulistiyo,5,"nyaman buat nongki2
..kopi dan pancongnya 👍"
KOPI STUDIO 24 SARANGAN,Khoirun Nisa,1,"Sebenernya udah langganan kopi studio dari dulu cabang mana² cuma yg cabang ini kasirnya gk ramah minimal senyum atau apa gitu, repeat ordernya juga gk konsisten gk kesemua customer ,mau pesen jadi males kasirnya jutek udah yg kedua di jutekin pesen disini tolong sop kerjanya"
KOPI STUDIO 24 SARANGAN,hardy yudha,2,"Take away taruh di tumblr, ternyata ga ditutup
rapat sama staffnya, alhasil tumpah kemana mana, baru sadar pas sampe kosan mana abis kehujanan lagi"
KOPI STUDIO 24 SARANGAN,Putri Azzahra,5,"Harga murah meriahhh  🤩
Tempat nyaman bersih"
KOPI STUDIO 24 SARANGAN,naura tsany,5,"tempatnya ga bosenin, ada yang ac juga worth it bgt"
KOPI STUDIO 24 SARANGAN,maxel maxel,5,"kopstud baru nyaman banget! Dari pertama masuk kakak""nya humble bgt. suka d'creamnya emng juara, tempatnya juga bersih dan tenang. Cocok banget buat nugas atau nyantai."
KOPI STUDIO 24 SARANGAN,Safira Azalia,5,"Menu nya murah meriah, tempat nya nyaman buat nugas + wifi nya kenceng"
KOPI STUDIO 24 SARANGAN,nabila purnamasari,5,tempatnya bersih dan makanan murah murah enak lagiii mantappp
KOPI STUDIO 24 SARANGAN,aprisa sfr,5,"Tempat ngopi recommend!!! Menu nya 10k-25k, Wifi lancar, tempat ada indoor dan outdoor, cocok untuk nugas atau nongkrong sama teman👍🏻"
KOPI STUDIO 24 SARANGAN,Adhylia Septia,5,pancongnya enak bgtt tempatnya juga nyamann buat ngerjain tugass
KOPI STUDIO 24 SARANGAN,Bim Nalendra,5,"Tempat ini sangat direkomendasikan! Ada area indoor dan outdoor yang nyaman untuk nongkrong. Pilihan menu juga sangat beragam, sehingga kamu tidak akan pernah bosan. Cocok untuk hangout bersama teman atau keluarga. 5/5 bintang!"
KOPI STUDIO 24 SARANGAN,ricky andrian,5,"Parkiran, mobilnya full,  kasirnya ramah
Es kopi susu nya  mantap
Paket menu promo untuk Ramadhan"
KOPI STUDIO 24 SARANGAN,Mayang Ananda,5,"tempatnya nyaman, harganya juga murah"",cocok buat nugas disini😊"
KOPI STUDIO 24 SARANGAN,Gilang Nur Janah,5,"Tempatnya nyaman, bersih, tertata, pelayanan baik dan ramah, harganya murah dan terjangkau"
KOPI STUDIO 24 SARANGAN,Dedek Naymungil,5,Sering nongki ke sini karna secozy itu tempatnya. Ada harga ada rasa ya🥰
KOPI STUDIO 24 SARANGAN,Tirza Tsedaqa Malfonita,5,"Kopstud baru, tempatnya sangat nyaman. Parkirannya cukup luas, ada berbagai pilihan tempat duduk mulai dari sofa, bangku biasa, indoor, outdoor. Jauh lebih lega dibandingkan dengan di ruko. Saran kedepannya lebih dilengkapi lagi stop kontak di tiap tempat duduk, terutama yang sofa. Mantappp👍🏻👍🏻👍🏻"
KOPI STUDIO 24 SARANGAN,Nila adr,5,"Sangat baik, enak, pelayanan mantap"
KOPI STUDIO 24 SARANGAN,ahmad muchson,1,"Rabu 9 Juli 2025 kesini siang tempat jadi 1 dengan 7 seven chiken. pelayanan buruk. Pegawai kurang profesional, Kasir wanita dan satu pegawai wanita terlalu banyak bercanda. Kasir kurang komunikatif, saat ditanya rekomendasi makanan kurang bisa menjelaskan. Pegawai pria kurang cekatan dalam bekerja."
KOPI STUDIO 24 SARANGAN,Welly lahh,5,"Kasir ramah, tempat nyaman luas, cocok banget buat pelajar
lop lop kopstud"
KOPI STUDIO 24 SARANGAN,Mela laurentya cary ayu,1,"Beli d'cream+jasmine (R) sama redvelvet+jasmine (M)..di nota salah nulis pesanan+ukuranya, waktu dikomplain kasirnya mau ganti tapi dengan muka yg judes dan kesel (kasir cewek)
Kalaupun mau tambah uang buat ganti pesenanya supaya bener gapapa banget tp malah gitu pelayananya..
Sebelum-sebelumnya selalu langganan disini dan kasirnya cowo ramah, baru kali ini dilayani kasir yg cewek dan ga ramah sama sekali.
makananya enak tapi kalau pelayanan nya kurang baik membuat yg beli kapok mau balik lagi."
KOPI STUDIO 24 SARANGAN,Difa Naya,5,"kesinii buat nugas, tempatnya nyaman banget, ada stopkontaknya, cocok juga buat nongki rame rame sama temen sekelas hihi😙🫶🏻"
KOPI STUDIO 24 SARANGAN,muhammad novan,5,"pelayanan baguss, menunya enak, tempat nya bersih dan nyaman, crew nya juga ganteng dan cantik"
KOPI STUDIO 24 SARANGAN,Widel,5,"Tempat yang cozy untuk nugas, menu makanan dan minuman yang beragam"
KOPI STUDIO 24 SARANGAN,Daanesha Muzakir,5,tempat nyaman recomended😍
KOPI STUDIO 24 SARANGAN,mustofa vvcell,1,Menu tidak siap pelayanan lama dan pelayan kurang ramah
KOPI STUDIO 24 SARANGAN,Memen Mardiono,5,"Pelayanan Baik,
Tempat Sahduu,
Lokasi Bersih,
Parkiran Baik,
Stop kontak Sangat banyak selalu ada di Tiap Meja tapi sayang yg Di Sofa dalam Ruangan tidak ada,
Yg Lain Sudah Terbaaaaik,
Harga 👣👣👣👣👣,
Rasa ⭐⭐⭐⭐⭐"
KOPI STUDIO 24 SARANGAN,Via Kumara,5,"Tempatnya nyaman, luas, harganyaa affordable, tiap selesai olahragaa selalu belii kopii disiinii, pegawainya ramahhh ✨️"
KOPI STUDIO 24 SARANGAN,Syafira Choirunnisa Azzahra,5,makanannya dan minumannya enak tempat bersih
KOPI STUDIO 24 SARANGAN,Fera Adelia Putri,5,tempat nya enak banget buat nugasss sipp pokoknyaaa
KOPI STUDIO 24 SARANGAN,Raihan Ariq,5,"Tempatnya nyaman, pelayanan baik gak nunggu lama. Cocok untuk nongkrong"
KOPI STUDIO 24 SARANGAN,fauzan akhdan,5,"Tempatnya estetik, nyaman bangetttt
Harganya murahhh, cocok untuk kalian kaum mendang mending"
KOPI STUDIO 24 SARANGAN,Sharbela Adelia,5,"tempatnya comfortable bangett, kasirnya ramah, makanannya enak, harganyaa affordable enak buat nugas dan quality time sama temen"
KOPI STUDIO 24 SARANGAN,Nur Laeli,5,"enak bgt buat nugas, harganya terjangkau tempatnya luas ada tempat indoor outdoor juga buat nongkrong🤩"
KOPI STUDIO 24 SARANGAN,Afin Febrian,5,"Tempatnya nyaman, terdapat ruangan ber ac jadi nyaman bgt buat nugas
Gepreknya enak ayamnya kerasa bumbunya
Untuk harga makanan dan minuman sangat terjangkau"
KOPI STUDIO 24 SARANGAN,fadilah nizar,5,"Tempat nya nyaman, stategis, dekat sama tempat kerja paling suka es greentea enak gk terlalu manis ✌suka sama tempat nya 😍"
KOPI STUDIO 24 SARANGAN,putrirahmanitabr,5,"Muraah, enak, tempatnya strategis, ramah2 juga staffnya"
KOPI STUDIO 24 SARANGAN,Hanzel Nut,5,"tempat nya nyaman buat nongki dan nugas, makanan dan minumannya enak2"
KOPI STUDIO 24 SARANGAN,rachel salwaa,5,"nyaman, bagus, pelayannya ramah 🥺💞🤍🆘🙋🏻‍♀️👍🏼"
KOPI STUDIO 24 SARANGAN,Kevin Al M,5,Makanannya murah dan enak. Comfy dan bersih untuk tempatnya. Worth banget sih makan di sini
KOPI STUDIO 24 SARANGAN,Charissa Meylajasmin,5,"enak banget kopinya, sama tempatnya juga nyaman adem gituu enak dehh, aku saranin kalo mau ngopi kesini ajahhh, mana murah banget lagiii"
KOPI STUDIO 24 SARANGAN,Michelle Kenzo,5,"tempatnya cozy dan selalu jadi langganan buat kumpul bareng temen, buat kerja tugas dan rapat. Workspace nya bagus bangett sukakk adem, dan bikin betah disini lama lama, harganya terjangkau buat pelajar dan mahasiswa jugaa Sukak bangett"
KOPI STUDIO 24 SARANGAN,Js S,5,"Tempatnya luas bgt, bersih, colokan dimana2 , enak buat nonton drakor, pelayanan ramah dan cepat, makanan minuman enak murah, top bgt."
KOPI STUDIO 24 SARANGAN,Riska Febrianti,5,"salah satu tempat nongkrong ternyaman di malangg, tempatnya bersih banget, banyak colokan, dan yang pasti aesthetic bgttt. pelayanan bestt bgtttt"
KOPI STUDIO 24 SARANGAN,nino putra,5,"tempatnya nyaman ada indoor dan outdoor, trs yg bikin nyaman tempatnya selalu bersih dan jauh dari kata kotor, dan menunya sangat murah bgt under 15k uda dpt 2 gacor kopstud sarangan🔥🔥"
KOPI STUDIO 24 SARANGAN,Juniar Heny,3,"pelayanan sangat lamaaaaaa , minimal minuman dulu yang dikeluarkan🙂 , pesan geprek series komplit tapi gak ada kol gorengnya😔"
KOPI STUDIO 24 SARANGAN,nilam asya,5,"samgat enak tempatnya, makananya juga enak gada yang mengecewakan"
KOPI STUDIO 24 SARANGAN,ulfah farzana,5,"Tempatnya cozy banget, harga murah"
KOPI STUDIO 24 SARANGAN,malang,5,Tempatnya enak dan makanannya murce mantap pokonya
KOPI STUDIO 24 SARANGAN,Rachel Angel,5,"Tempat nyaman, tapi indoor nya kurang luas. Karena bnyk peminatya. Mungkin bisa di lebarkan lagi tempatnya. Overall semua nya nyaman dan enak"
KOPI STUDIO 24 SARANGAN,MAXEL SEBASTIAN,5,"waktu tau buka cabang baru langsung cobain dan tempatnya dekoratif tapi tetep dengan khas kopstud menu menu terjangkau, bakal sering mampir kesini sihh"
KOPI STUDIO 24 SARANGAN,Reza octha,5,"Tempatnya luas banyak colokan bisa buat nugas nongki rapat , makanan nya harga standar cocok buat kantong mahasiswa"
KOPI STUDIO 24 SARANGAN,Della Ayu Puspitasari,5,Tempatnya nyaman pelayanan oke makanannya rekomen bngttt
KOPI STUDIO 24 SARANGAN,Siti Laela,5,"tempatnya  nyaman dan bersih, pelayanannya sangat baguss"
KOPI STUDIO 24 SARANGAN,Callista az-zahra,5,"enak banget tempatnya, apalagi indoornya dingin, biasanya buat tempat kumpul panitia, menunya murah banget apalagi di kantong pelajar, GEPREK KOMPLITNYAA APALAGII, ENAK BANGEETTTTT. josjis pokoknya 🫶🏻🫶🏻🫶🏻"
KOPI STUDIO 24 SARANGAN,Fauziah Rahma firdaus,5,"Tempat nya keren banget, cozy, nyaman, ada indoor dan outdoornya. Ada tempat sholat nya juga jadi bisa nugas dengan nyaman"
KOPI STUDIO 24 SARANGAN,Annisa Patrianna Zheannia Putri,5,"Tempatnya nyaman, cocok untuk mengerjakan tugas"
KOPI STUDIO 24 SARANGAN,Nirvana Gadis,5,Tempatnyaa nyaman dan bersih makanannya super murah kakak²nya juga baik jugaaa🥰🥰
KOPI STUDIO 24 SARANGAN,Novira Dwi A,5,Selalu kesini kalo nyari kopi murah dan enak. Tempatnya nyaman dan dekat rumah.
KOPI STUDIO 24 SARANGAN,Davina Fayza,5,"keren tempatnya pelayanan juga oke banget cepet, keep it up!!"
KOPI STUDIO 24 SARANGAN,Nadine elisha Candra dinata,5,"Tempat nya nyaman banget,pancong nya enak sekali"
KOPI STUDIO 24 SARANGAN,Nadine Fidela Wulan Nur Rahma,5,"Suasanya oke bgt tenang, pelayanan juga oke ramah dan lumayan cepat"
KOPI STUDIO 24 SARANGAN,Galih Janggan,5,"Tempatnya comfy bgt, udah murah, enak buat nugas... Ada outdoor dan indoor... Cepet kesini🫶🏻🫶🏻"
KOPI STUDIO 24 SARANGAN,Vaddantya Gantari Chandra Kirana,5,"Cocok banget buat nugas ataupun WFC. Ada ruangan indoor dan outdoor juga. Harganya juga masuk di dompet mahasiswa. Meskipun rame, pelayanannya cepet kok. Petugas nya juga ramah dan helpfull 💗"
KOPI STUDIO 24 SARANGAN,P17311203028 SALSABILA IFADA,5,Tempat nya enak buat nongkrong sambil nugas
KOPI STUDIO 24 SARANGAN,hasna shirfie,5,"tempat kopi studio baru ini sangat nyaman dan terlihat aesthetic, menunya juga ramah di kantong mahasiswa, pelayanannya juga cepat"
KOPI STUDIO 24 SARANGAN,Antonik Arizki,5,"Tempatnya recommended, pelayanan ramah kakaknya asyik, menunya enak dan murah murah!!"
KOPI STUDIO 24 SARANGAN,nasya andre,5,tempatnya cozy pelayananya ramah
KOPI STUDIO 24 SARANGAN,Nadia kharisma,5,Pelayanannya super ramah
KOPI STUDIO 24 SARANGAN,Rizky Gabuttt,5,"tempatnya nyaman rekomen banget, menunya enak dan murah, kasir dan pelayanannya ramah, besttt!!"
KOPI STUDIO 24 SARANGAN,Kurnia Fitriasari Wilujeng,5,tempaat okeeyyy murmerr cocok buat nugass deket rumaaah
KOPI STUDIO 24 SARANGAN,Rifs 45,5,"Tempat nya nyaman buat nugas, pelayanan mantap worth it banget"
KOPI STUDIO 24 SARANGAN,Anggra N,5,"Suka banget sama Kopi Studio🥰
Tempatnya nyaman buat nugas, dekorasinya estetik. Kopinya juga sangat enak, pilihan menunya variatif. Pelayanan juga sangat ramah dan cepat. Sudah beberapa kali datang ke sini dan selalu puas. Rekomen bangett😍"
KOPI STUDIO 24 SARANGAN,TTK Vinsensia Lidia Almaria,5,"pelayanannya sangat mantap, makanannya enak2. tempat yang bagus untuk foto2 disini, kasirnya cantikk😍"
KOPI STUDIO 24 SARANGAN,Sufiana Khadijah,5,Tempatnya cozy dan pelayanannya baik. Menu variatif dan cocok untuk berkumpul dengan teman atau keluarga
KOPI STUDIO 24 SARANGAN,Aliyah Shabirah Wijaya,5,tempatnya nayaman keren enak luas pelayanannya juga cepat
KOPI STUDIO 24 SARANGAN,Fajar Bayu Kusuma,5,Tempat paling enak buat nugas. Real langganan nugas kelompk
KOPI STUDIO 24 SARANGAN,Arya Dillah,5,"tempat sangat enak luas fan nyaman untuk nugas dan cozy, favorite palace saya sebagai seorang pelajar bersama teman², pelayanan sangat ramah"
KOPI STUDIO 24 SARANGAN,kalycafarahghaza,1,"untuk bluetooth nya tolong di kecilkan kalau bisa di matikan jika hanya di pakai buat nonton tiktok yg gajelas, di kira semua pengunjung suka gitu denger² yg gajelas? mas/mba nya aja dah yg dengerin, udah volume full tapi muter tiktok, mending bluetooth nya matiin aja"
