nama_tempat,username,rating,review
KOPI STUDIO 24 SARANGAN,Annisa Widya SR,5,"tempatnya pw bngt buat nugas, murce, rame bngt siii harus dateng pagi. bersihh dan tata letaknya ga bikin sumpek gtu, interiornya bguss kliatan cerah"
KOPI STUDIO 24 SARANGAN,Virginia Imelda,5,"tempatnya nyaman banget buat nugas, wifinya kenceng banget. harganya juga murah murah"
KOPI STUDIO 24 SARANGAN,Adkiya najihuddin A,5,Pelayanan sangat memuaskan
KOPI STUDIO 24 SARANGAN,Impures,5,"Tempat bersih dan nyaman

Pelayanan ramah

Banyak colokan & Wi-Fi kencang

Harga terjangkau"
KOPI STUDIO 24 SARANGAN,Wisnu Hadi wicaksono,5,"pelayanannya ramah, cepat, tempatnya bersih, cocok buat ngopag"
KOPI STUDIO 24 SARANGAN,Siti Choliszah,5,Tempatnya nyaman buat nugas dan minumannya banyak variannya
KOPI STUDIO 24 SARANGAN,Azzahra Zagita Nugroho,5,"makanan nya enak, minuman nya menarik, tempatnya higienis dan nyaman cocok untuk nongkrong dan ngerjain tugas"
KOPI STUDIO 24 SARANGAN,Risma Bangkit,5,Tempatnya cozy buat nugas atau kumpul bareng temen. Best sihh
KOPI STUDIO 24 SARANGAN,Dea Novita,5,"tempatnya cozy parah, kopi studio paling enak buat ngechill waktu break kerja, bener-bener ramah di kantong😍😍😍"
KOPI STUDIO 24 SARANGAN,P17610251001 BISMA ATMAJA KURNIAWAN,5,Makanan enak minuman enak tempatnya enak semua enak pokoknya. cocok buat nongkrong sama nugas kuliah topp🔥🔥
KOPI STUDIO 24 SARANGAN,Karima Aminina,5,"tempat nyaman, enak banget buat nugas"
KOPI STUDIO 24 SARANGAN,Danang putra Karya sasmita,5,"Tempat nya enak nyaman
Pelayanan juga bagus"
KOPI STUDIO 24 SARANGAN,Naula Rizak,5,"Tempatnya comfy banget, banyak colokan buat nge cas juga, gepreknya mantep banget rasanya trus minumannya juga enak-enak dan harganya juga murah. Mantep banget deh pokoknya kopi studio 24"
KOPI STUDIO 24 SARANGAN,Amirah Ayu Fatmala,5,"Tempat bersih , menenagkan, pelayanan sat set , ada buy 1 get 1 , definisi ngopi gaperlu mahal tp rasa juaraaaa"
KOPI STUDIO 24 SARANGAN,Raditya Arya Wiguna,5,"bagus tempatnya, harganya juga bersahabat cocok buat mahasiswa"
KOPI STUDIO 24 SARANGAN,Absorzx,5,"makanan nya enakk kesinii sering nih beli pancong, pancongnya rasanyaaa pass enakk minum nya juga pokok nya rekomendasi bangett dah buat nugas juga enakk"
KOPI STUDIO 24 SARANGAN,Itsmearerarera,5,"Tempatnya nyaman, menu nya juga enak enak, pelayanan nya juga okeee, recommended ✨🌟"
KOPI STUDIO 24 SARANGAN,hong nayoa,5,tempatnya bagus pelayanannya ramah dan bersih recomend untuk kembali lagi kesini
KOPI STUDIO 24 SARANGAN,Shevy Rizkianty Ayu Ginanjar,5,"makanannya enak puolll, pelayanannya mantap ramah, suasana nya jg adrm meskipun di pinggir jalan tp ga keganggu"
KOPI STUDIO 24 SARANGAN,Aris Sugianto,5,Wuihh dabestttt banget pelayananya pegawai sumringah menu ada  ada semua tanpa terkecuali bagus bagus tingkatkan pelayanannya dan gajinya
KOPI STUDIO 24 SARANGAN,Gede Nafiis,5,"pancongnya enak, geprek sama sambelnya juga sip, pelayan kasir overall good"
KOPI STUDIO 24 SARANGAN,William Zulkarnaen,5,"kakanya ramahh"" sukaa dehh, tempatnya juga nyaman enakk buat nohki"
KOPI STUDIO 24 SARANGAN,Nur Muhammad Abduh,5,Tempatnya nyaman yg indoor
KOPI STUDIO 24 SARANGAN,Novi Witri,5,"tempatnya nyaman . bersih . rapi .
harga terjangkau . jadi mau ngopi tiap hari aman"
KOPI STUDIO 24 SARANGAN,Wahyu Mita,5,"Pelayanannya cepat, tempat tunggu yang cukup nyaman, pelayan yang ranah, dan murah senyum ✨"
KOPI STUDIO 24 SARANGAN,Cantika Wulan,5,mantap kalii punn aku sering banget nugas disini pokoknyaa mantapp saran boleh kan kak untuk always ada tisuuu
KOPI STUDIO 24 SARANGAN,Dhea Ananda,5,kopi nya enak tempatnya nyaman pelayanan ramah dan cepat dan kakaknya memberikan solusi jika pembayaran kita lagi eror
KOPI STUDIO 24 SARANGAN,Gabriel Nathanael,5,"Kopi dan wadahnya nyaman banar, bagus juga buat skripsian"
KOPI STUDIO 24 SARANGAN,Dinnar Rizqianda,5,TEMPATNYA NYAAAMAAAN RIILLL. VIBES. NYA ASIKK. LOPP SEKEBONN.
KOPI STUDIO 24 SARANGAN,ALDINA PERMATASARI,5,"Baru kedua kali ini kesini kakak"" Nya ramah sekali tempat bersih dan nyaman
Hidangan nya sangat enak polllllll suka dehh"
KOPI STUDIO 24 SARANGAN,Tristan Flavio11,5,"pelayanan nya cepat. makanan nya banyak pilihan nya sama minuman nya juga banyak, tempat oke"
KOPI STUDIO 24 SARANGAN,RICO ROBBI KURNIAWAN,5,"minum sangat bermacam macam dengan harga murmer, tempatnya sangat nyaman untuk berbagai macam kegiatan terlebih lagi buka 24 jam"
KOPI STUDIO 24 SARANGAN,Selvy Alentina Suci,5,"Tempatnya nyaman ,suasananya enak dan
banyak colokan.Cocok buat nugas"
KOPI STUDIO 24 SARANGAN,Salsa Billa,5,tempatnya enak bgt buat nugas pelayanannya oke
KOPI STUDIO 24 SARANGAN,Sunflowers Matcha,5,"pelayananannya ramah, tempatnya cozy, mbak marcel baik hehehehe, mbak cia juga, semua dehhh baik wkwkwkwkwk"
KOPI STUDIO 24 SARANGAN,Rona Aisah,5,"tempatnya nyaman buat nugas, bakal balik lagi kesini buat nuga"
KOPI STUDIO 24 SARANGAN,Robby Alifian,5,"tempatnya cocok buat wfc, harga ramah dikantong, overall good🥰"
KOPI STUDIO 24 SARANGAN,Riska Rosita,5,"Rasa enak,mantab pa lagi pancongnya🤩🥰,Fav Dcream jg 🤩"
KOPI STUDIO 24 SARANGAN,Ratih Mei,5,Free wifi colokan banyak cocok buat nugas pokoknya mahasiswa friendly
KOPI STUDIO 24 SARANGAN,lik ani,5,"kopstud sarangan pelayanannyaa Topp bangett!! bener bener rekomen buat diskusi, nugas, me time, nyamann polll"
